63,[],False,,,False,blarrrgo,,,,[],,,,text,t2_6cyid,False,,,False,False,,False,,False,1562312035.0,1562283235.0,,,self.personalfinance,0,False,0,{},False,False,c996iq,False,False,False,False,True,True,False,,#cb5f16,Planning,[],205032c0-c078-11e4-b7bd-22000b3d8247,Planning,light,text,False,,{},False,,,,[],t3_c996iq,True,13,0,,False,all_ads,/r/personalfinance/comments/c996iq/whats_the_best_course_of_action_to_do_with_net/,False,6,False,,,False,3,,{},"[Here's a rough calculation of my monthly and annual net income](https://imgur.com/IfFGIcR)

My goal is to save enough to get into real estate investing. I currently have $5k sitting in my checking account doing nothing. Others have suggested putting that into a high yield savings account while I save an extra 15-20k. 

As you can see, I have maybe about $1.1k leftover after expenses. Should I start a ROTH IRA and put the rest into a HYSA? Or move it all to a HYSA and get into real estate quicker?

Any other routes you guys can think of I can take?


At this point I'm 34 and single and I feel like I'm starting way too late in investing my money. The only thing I've got is contributing to my company's 401k and ESPP plan. I also have an HSA with $750 sitting in it but I'm not sure what to do with that.","&lt;!-- SC_OFF --&gt;&lt;div class=""md""&gt;&lt;p&gt;&lt;a href=""https://imgur.com/IfFGIcR""&gt;Here&amp;#39;s a rough calculation of my monthly and annual net income&lt;/a&gt;&lt;/p&gt;

&lt;p&gt;My goal is to save enough to get into real estate investing. I currently have $5k sitting in my checking account doing nothing. Others have suggested putting that into a high yield savings account while I save an extra 15-20k. &lt;/p&gt;

&lt;p&gt;As you can see, I have maybe about $1.1k leftover after expenses. Should I start a ROTH IRA and put the rest into a HYSA? Or move it all to a HYSA and get into real estate quicker?&lt;/p&gt;

&lt;p&gt;Any other routes you guys can think of I can take?&lt;/p&gt;

&lt;p&gt;At this point I&amp;#39;m 34 and single and I feel like I&amp;#39;m starting way too late in investing my money. The only thing I&amp;#39;ve got is contributing to my company&amp;#39;s 401k and ESPP plan. I also have an HSA with $750 sitting in it but I&amp;#39;m not sure what to do with that.&lt;/p&gt;
&lt;/div&gt;&lt;!-- SC_ON --&gt;",True,False,False,personalfinance,t5_2qstm,r/personalfinance,13779949,public,,,What's the best course of action to do with net income if my goal is to save up for investing in real estate?,0,3,https://www.reddit.com/r/personalfinance/comments/c996iq/whats_the_best_course_of_action_to_do_with_net/,[],,False,all_ads,6
64,[],False,,,False,AvaPotatoCat,,,,[],,,,text,t2_26opuya8,False,,,False,False,,False,,False,1562311564.0,1562282764.0,,,self.personalfinance,0,False,0,{},False,False,c993uo,False,False,False,False,True,True,False,,,Credit,[],,Credit,dark,text,False,,{},False,,,,[],t3_c993uo,True,19,0,,False,all_ads,/r/personalfinance/comments/c993uo/advice_needed_i_already_help_my_mom_pay_her/,False,6,False,,,False,3,,{},"My father and my mother divorced shortly before my father passed away three years ago. I received all of his assets. Since my mother no longer was getting alimony, I agreed to give her the $1500 per month that my dad would have needed to pay her for her mortgage. I have now given her about $50,000 to help her pay off her mortgage. She says she will pay the money back, but I know this is most likely not true (she only works part-time and at slightly above minimum wage). I have accepted this.

Today, my mom texted me in a panic. She is worried that the bank will ""catch on"" that she cannot herself qualify for the mortgage and wants me to co-sign a new mortgage for the $80,000 remaining. I think my deceased father's name is still on her mortgage (which I understand is another issue, but is frankly hers to deal with). I do not feel comfortable co-signing the mortgage with her. I will continue helping her out as long as I am able to do so (especially since I feel somewhat guilty that my father's assets went to me, although I know he would have wanted it that way).

Am I wrong for not wanting to co-sign? For additional context, I am only 27 and am working full time while also in graduate school. I am going to have a lot of my own expenses now and in the future. I'm not sure what to do. Thank you in advance!","&lt;!-- SC_OFF --&gt;&lt;div class=""md""&gt;&lt;p&gt;My father and my mother divorced shortly before my father passed away three years ago. I received all of his assets. Since my mother no longer was getting alimony, I agreed to give her the $1500 per month that my dad would have needed to pay her for her mortgage. I have now given her about $50,000 to help her pay off her mortgage. She says she will pay the money back, but I know this is most likely not true (she only works part-time and at slightly above minimum wage). I have accepted this.&lt;/p&gt;

&lt;p&gt;Today, my mom texted me in a panic. She is worried that the bank will &amp;quot;catch on&amp;quot; that she cannot herself qualify for the mortgage and wants me to co-sign a new mortgage for the $80,000 remaining. I think my deceased father&amp;#39;s name is still on her mortgage (which I understand is another issue, but is frankly hers to deal with). I do not feel comfortable co-signing the mortgage with her. I will continue helping her out as long as I am able to do so (especially since I feel somewhat guilty that my father&amp;#39;s assets went to me, although I know he would have wanted it that way).&lt;/p&gt;

&lt;p&gt;Am I wrong for not wanting to co-sign? For additional context, I am only 27 and am working full time while also in graduate school. I am going to have a lot of my own expenses now and in the future. I&amp;#39;m not sure what to do. Thank you in advance!&lt;/p&gt;
&lt;/div&gt;&lt;!-- SC_ON --&gt;",True,False,False,personalfinance,t5_2qstm,r/personalfinance,13779949,public,,,"Advice Needed: I already help my mom pay her mortgage, but now she wants me to co-sign",0,3,https://www.reddit.com/r/personalfinance/comments/c993uo/advice_needed_i_already_help_my_mom_pay_her/,[],,False,all_ads,6
65,[],False,,,False,ccsm1419,,,,[],,,,text,t2_42w9z01u,False,,,False,False,,False,,False,1562307066.0,1562278266.0,,,self.personalfinance,0,False,0,{},False,False,c98dqu,False,False,False,False,True,True,False,,,Planning,[],,Planning,dark,text,False,,{},False,,,,[],t3_c98dqu,True,7,0,,False,all_ads,/r/personalfinance/comments/c98dqu/20_year_old_in_tough_financial_spot/,False,6,False,,,False,3,,{},"Hey there, just recently found this subreddit and I’m just hoping someone could give me some advice on how to get out of my current situation. I currently am working a full-time job where I earn about 1800$ per month. I pay for insurance (144$) a car (224.30$) a phone bill (65$), groceries for my whole family. (200$) I have been put in a terrible situation by my parents by them constantly borrowing money from me and not fully paying me back. 

My parents have split up and sold the house that we lived in but due to their terrible financial habits have no money left from the sale of the house. I currently am supporting my mom and younger sister (13) and i have had to use my credit card to do so.

We are staying in a motel because we do not have a place to go and are still actively looking for a place. My mother is extremely irresponsible with money and it has put me in to a tough spot. 

I would like to get my own place but I can’t leave my sister and I wouldn’t be able to support her if I took her with me.

Does anyone have any suggestions on how I can currently get out of my debt which $2800 and I still need a place to live.  

Anything helps at this point, thank you guys so much. I’ll do my best to follow up any questions with any information you guys would need.","&lt;!-- SC_OFF --&gt;&lt;div class=""md""&gt;&lt;p&gt;Hey there, just recently found this subreddit and I’m just hoping someone could give me some advice on how to get out of my current situation. I currently am working a full-time job where I earn about 1800$ per month. I pay for insurance (144$) a car (224.30$) a phone bill (65$), groceries for my whole family. (200$) I have been put in a terrible situation by my parents by them constantly borrowing money from me and not fully paying me back. &lt;/p&gt;

&lt;p&gt;My parents have split up and sold the house that we lived in but due to their terrible financial habits have no money left from the sale of the house. I currently am supporting my mom and younger sister (13) and i have had to use my credit card to do so.&lt;/p&gt;

&lt;p&gt;We are staying in a motel because we do not have a place to go and are still actively looking for a place. My mother is extremely irresponsible with money and it has put me in to a tough spot. &lt;/p&gt;

&lt;p&gt;I would like to get my own place but I can’t leave my sister and I wouldn’t be able to support her if I took her with me.&lt;/p&gt;

&lt;p&gt;Does anyone have any suggestions on how I can currently get out of my debt which $2800 and I still need a place to live.  &lt;/p&gt;

&lt;p&gt;Anything helps at this point, thank you guys so much. I’ll do my best to follow up any questions with any information you guys would need.&lt;/p&gt;
&lt;/div&gt;&lt;!-- SC_ON --&gt;",True,False,False,personalfinance,t5_2qstm,r/personalfinance,13779949,public,,,20 Year Old In Tough Financial Spot,0,3,https://www.reddit.com/r/personalfinance/comments/c98dqu/20_year_old_in_tough_financial_spot/,[],,False,all_ads,6
66,[],False,,,False,any_cycles,,,,[],,,,text,t2_3xgfk55h,False,,,False,False,,False,,False,1562306617.0,1562277817.0,,,self.personalfinance,0,1562278055.0,0,{},False,False,c98azb,False,False,False,False,True,True,False,,#19a53f,Auto,[],ea2c76fe-c077-11e4-afea-22000bb2c1d0,Auto,light,text,False,,{},False,,,,[],t3_c98azb,True,7,0,,False,all_ads,/r/personalfinance/comments/c98azb/moving_to_a_new_state_dad_says_i_can_use_his_old/,False,6,False,,,False,1,,{},"Hello,

My dad has generously offered to give me his 2007 Toyota Camry for my upcoming move to Illinois from Minnesota. I currently drive this car to work and he has my name added to his insurance policy.

My question is, what do I need to do to ensure I can get Illinois license plates, insurance, register the car, etc.

Do I need my dad to transfer the title to me or at least add me as a co-owner?

Regarding insurance, I assume he will have to take me off his policy and I'll need to purchase my own, or should we check my dad's insurance policy to see if they will extend coverage in this situation?

I just don't want to add any extra overhead or costs that aren't necessary for all parties involved.

Thanks!","&lt;!-- SC_OFF --&gt;&lt;div class=""md""&gt;&lt;p&gt;Hello,&lt;/p&gt;

&lt;p&gt;My dad has generously offered to give me his 2007 Toyota Camry for my upcoming move to Illinois from Minnesota. I currently drive this car to work and he has my name added to his insurance policy.&lt;/p&gt;

&lt;p&gt;My question is, what do I need to do to ensure I can get Illinois license plates, insurance, register the car, etc.&lt;/p&gt;

&lt;p&gt;Do I need my dad to transfer the title to me or at least add me as a co-owner?&lt;/p&gt;

&lt;p&gt;Regarding insurance, I assume he will have to take me off his policy and I&amp;#39;ll need to purchase my own, or should we check my dad&amp;#39;s insurance policy to see if they will extend coverage in this situation?&lt;/p&gt;

&lt;p&gt;I just don&amp;#39;t want to add any extra overhead or costs that aren&amp;#39;t necessary for all parties involved.&lt;/p&gt;

&lt;p&gt;Thanks!&lt;/p&gt;
&lt;/div&gt;&lt;!-- SC_ON --&gt;",True,False,False,personalfinance,t5_2qstm,r/personalfinance,13779949,public,,,Moving to a new state. Dad says I can use his old car. What paperwork should I start?,0,1,https://www.reddit.com/r/personalfinance/comments/c98azb/moving_to_a_new_state_dad_says_i_can_use_his_old/,[],,False,all_ads,6
67,[],False,,,False,slothlova,,,,[],,,,text,t2_kb70awh,False,,,False,False,,False,,False,1562306527.0,1562277727.0,,,self.personalfinance,0,False,0,{},False,False,c98adt,False,False,False,False,True,True,False,,,Saving,[],,Saving,dark,text,False,,{},False,,,,[],t3_c98adt,True,3,0,,False,all_ads,/r/personalfinance/comments/c98adt/more_saving_potential_with_side_business/,False,6,False,,,False,4,,{},"Hey guys,

I started a small side business this summer. We have a name, logo, website shop, all of that. On a podcast I listened to previously (couldn’t find it), I thought I remembered the hosts saying with a business, you’re able to tuck away more money into investments or set up a business account on Vanguard, Fidelity, etc separate of your own personal account. Is this true?

For instance, my Roth I can obviously only contribute 6k/year. But with a small business, would I be able to do more in a separate account?

If so, would I need to pay the $300 or so to trademark my business name? What would I need to do to make my business eligible for that ability?

I teach, so the business world and it’s technicalities have been brand new to me. Any advice or experience you have is welcome. Thanks!","&lt;!-- SC_OFF --&gt;&lt;div class=""md""&gt;&lt;p&gt;Hey guys,&lt;/p&gt;

&lt;p&gt;I started a small side business this summer. We have a name, logo, website shop, all of that. On a podcast I listened to previously (couldn’t find it), I thought I remembered the hosts saying with a business, you’re able to tuck away more money into investments or set up a business account on Vanguard, Fidelity, etc separate of your own personal account. Is this true?&lt;/p&gt;

&lt;p&gt;For instance, my Roth I can obviously only contribute 6k/year. But with a small business, would I be able to do more in a separate account?&lt;/p&gt;

&lt;p&gt;If so, would I need to pay the $300 or so to trademark my business name? What would I need to do to make my business eligible for that ability?&lt;/p&gt;

&lt;p&gt;I teach, so the business world and it’s technicalities have been brand new to me. Any advice or experience you have is welcome. Thanks!&lt;/p&gt;
&lt;/div&gt;&lt;!-- SC_ON --&gt;",True,False,False,personalfinance,t5_2qstm,r/personalfinance,13779949,public,,,More saving potential with side business?,0,4,https://www.reddit.com/r/personalfinance/comments/c98adt/more_saving_potential_with_side_business/,[],,False,all_ads,6
68,[],False,,,False,yeahanotherwunnadeez,,,,[],,,,text,t2_1c3s3o99,False,,,False,False,,False,,False,1562294448.0,1562265648.0,,,self.personalfinance,0,1562269535.0,0,{},False,False,c963io,False,False,False,False,True,True,False,,,Budgeting,[],,Budgeting,dark,text,False,,{},False,,,,[],t3_c963io,True,11,0,,False,all_ads,/r/personalfinance/comments/c963io/do_i_need_a_financial_advisor_or_just_a_good_plan/,False,6,False,,,False,3,,{},"30, HCOL city. No dependents and plan on staying that way. Old throwaway because my primary account is probably identifiable by some friends or family that might see this.


I've lurked here and r/financialindependence plenty, but generally feel out of my depth and uninterested in the ""active management"" approach. The lazier the better, as in everything.


Having changed careers (less than $30k/yr) into something that pays quite a bit more (now at $80k/yr) a couple of years ago and not feeling like I have as much to show for it financially as I should, I've been pondering paying a financial advisor for some help. I'm worried that if I pay someone $1500 right now, I'm just going to end up with a budget that I could have created on my own and $1500 less towards savings or investments.


I have 2 distinct short-er term goals:

* within 2 years, buy and outfit a van for living/adventuring. I realize that my living situation could change due to SO situation or whatnot in the meantime, but I like to go camping and hiking and adventuring a lot and this would enable that further, making me happier (the most important part!). And if that situation doesn't ariae, I have a much cheaper housing situation that would prepare me for the next part. I want to do this right, and expect the whole thing to cost in the neighborhood of $60k all said and done.

* partial retirement by 40. Looking to only need to pick up contracting or consulting work a couple days a week, and would expect an absolute minimum of $50/hr. I want to bump around the country going to national parks and exploring, then come back to WiFi or whatever and make enough to subsist that lifestyle on while whatever investments I have continue to grow. Timeframe would be somewhat flexible but I'm not working full time past 45 without being drug kicking and screaming.


Long term goal of continuing that lifestyle, willing to keep piddling with contracting or whatnot for a while, hard to particularly say now since that's so far in the future.


I have some assets and debt, but nothing spectacular.


Assets

* A little over $10k in high yield savings (ally), a couple thousand in my bank's lower yield (summer is expensive, I've been reluctant to move it all over and have to wait if I decide to do something. In winter my spending goes way down and it will all go to ally)

* a 401k that I'm not great at tracking the value of but is probably somewhere in the neighborhood of $3k (I didn't enroll myself for too long, dumb move)

* $500 in wealthfront. Just getting started here.

* HSA with a couple thousand in it. 


Debt

* $5k left on a car loan, paying $270/mo right now

* $1300 in student loans. Making $350/mo payments so that's gone in a couple months, then divert most or all of that to the car

* Both of these are paying almost entirely principal, I'm accruing less than 2% interest total even if I don't shift the payments


My monthly bills (rent, insurance, phone, streaming services, etc) come out to about $1900/mo, and my take home is right at $5000/mo. I put $700/Mo in savings automatically, and try to put another ~$500 in each month.


I don't really feel like I need a financial advisor, since most of the cases I see if that are people that are in some horrible debt or tax situation and Im (thankfully, for the first time in my life) not. But I think the peace of mind of having it all figured out for me might be worth it. That said if it's just going to be a budget and pump more money into savings accounts and investments I don't want to waste my money. Though, also due to my huge pay increase I feel like I've let some lifestyle creep get me and now I'm not sure what kind of budget is reasonable, especially because I don't really ""have"" to. I can just go out and eat if I want, I have plenty of money. That's proving to be problematic for an aggressive savings plan.


Any recommendations, based on my story? Assuming they're well regarded and certified and not crazy expensive for my area, is a financial advisor...advisable?

Edit: formatting","&lt;!-- SC_OFF --&gt;&lt;div class=""md""&gt;&lt;p&gt;30, HCOL city. No dependents and plan on staying that way. Old throwaway because my primary account is probably identifiable by some friends or family that might see this.&lt;/p&gt;

&lt;p&gt;I&amp;#39;ve lurked here and &lt;a href=""/r/financialindependence""&gt;r/financialindependence&lt;/a&gt; plenty, but generally feel out of my depth and uninterested in the &amp;quot;active management&amp;quot; approach. The lazier the better, as in everything.&lt;/p&gt;

&lt;p&gt;Having changed careers (less than $30k/yr) into something that pays quite a bit more (now at $80k/yr) a couple of years ago and not feeling like I have as much to show for it financially as I should, I&amp;#39;ve been pondering paying a financial advisor for some help. I&amp;#39;m worried that if I pay someone $1500 right now, I&amp;#39;m just going to end up with a budget that I could have created on my own and $1500 less towards savings or investments.&lt;/p&gt;

&lt;p&gt;I have 2 distinct short-er term goals:&lt;/p&gt;

&lt;ul&gt;
&lt;li&gt;&lt;p&gt;within 2 years, buy and outfit a van for living/adventuring. I realize that my living situation could change due to SO situation or whatnot in the meantime, but I like to go camping and hiking and adventuring a lot and this would enable that further, making me happier (the most important part!). And if that situation doesn&amp;#39;t ariae, I have a much cheaper housing situation that would prepare me for the next part. I want to do this right, and expect the whole thing to cost in the neighborhood of $60k all said and done.&lt;/p&gt;&lt;/li&gt;
&lt;li&gt;&lt;p&gt;partial retirement by 40. Looking to only need to pick up contracting or consulting work a couple days a week, and would expect an absolute minimum of $50/hr. I want to bump around the country going to national parks and exploring, then come back to WiFi or whatever and make enough to subsist that lifestyle on while whatever investments I have continue to grow. Timeframe would be somewhat flexible but I&amp;#39;m not working full time past 45 without being drug kicking and screaming.&lt;/p&gt;&lt;/li&gt;
&lt;/ul&gt;

&lt;p&gt;Long term goal of continuing that lifestyle, willing to keep piddling with contracting or whatnot for a while, hard to particularly say now since that&amp;#39;s so far in the future.&lt;/p&gt;

&lt;p&gt;I have some assets and debt, but nothing spectacular.&lt;/p&gt;

&lt;p&gt;Assets&lt;/p&gt;

&lt;ul&gt;
&lt;li&gt;&lt;p&gt;A little over $10k in high yield savings (ally), a couple thousand in my bank&amp;#39;s lower yield (summer is expensive, I&amp;#39;ve been reluctant to move it all over and have to wait if I decide to do something. In winter my spending goes way down and it will all go to ally)&lt;/p&gt;&lt;/li&gt;
&lt;li&gt;&lt;p&gt;a 401k that I&amp;#39;m not great at tracking the value of but is probably somewhere in the neighborhood of $3k (I didn&amp;#39;t enroll myself for too long, dumb move)&lt;/p&gt;&lt;/li&gt;
&lt;li&gt;&lt;p&gt;$500 in wealthfront. Just getting started here.&lt;/p&gt;&lt;/li&gt;
&lt;li&gt;&lt;p&gt;HSA with a couple thousand in it. &lt;/p&gt;&lt;/li&gt;
&lt;/ul&gt;

&lt;p&gt;Debt&lt;/p&gt;

&lt;ul&gt;
&lt;li&gt;&lt;p&gt;$5k left on a car loan, paying $270/mo right now&lt;/p&gt;&lt;/li&gt;
&lt;li&gt;&lt;p&gt;$1300 in student loans. Making $350/mo payments so that&amp;#39;s gone in a couple months, then divert most or all of that to the car&lt;/p&gt;&lt;/li&gt;
&lt;li&gt;&lt;p&gt;Both of these are paying almost entirely principal, I&amp;#39;m accruing less than 2% interest total even if I don&amp;#39;t shift the payments&lt;/p&gt;&lt;/li&gt;
&lt;/ul&gt;

&lt;p&gt;My monthly bills (rent, insurance, phone, streaming services, etc) come out to about $1900/mo, and my take home is right at $5000/mo. I put $700/Mo in savings automatically, and try to put another ~$500 in each month.&lt;/p&gt;

&lt;p&gt;I don&amp;#39;t really feel like I need a financial advisor, since most of the cases I see if that are people that are in some horrible debt or tax situation and Im (thankfully, for the first time in my life) not. But I think the peace of mind of having it all figured out for me might be worth it. That said if it&amp;#39;s just going to be a budget and pump more money into savings accounts and investments I don&amp;#39;t want to waste my money. Though, also due to my huge pay increase I feel like I&amp;#39;ve let some lifestyle creep get me and now I&amp;#39;m not sure what kind of budget is reasonable, especially because I don&amp;#39;t really &amp;quot;have&amp;quot; to. I can just go out and eat if I want, I have plenty of money. That&amp;#39;s proving to be problematic for an aggressive savings plan.&lt;/p&gt;

&lt;p&gt;Any recommendations, based on my story? Assuming they&amp;#39;re well regarded and certified and not crazy expensive for my area, is a financial advisor...advisable?&lt;/p&gt;

&lt;p&gt;Edit: formatting&lt;/p&gt;
&lt;/div&gt;&lt;!-- SC_ON --&gt;",True,False,False,personalfinance,t5_2qstm,r/personalfinance,13779949,public,,,Do I need a financial advisor? Or just a good plan and budget?,0,3,https://www.reddit.com/r/personalfinance/comments/c963io/do_i_need_a_financial_advisor_or_just_a_good_plan/,[],,False,all_ads,6
