,all_awardings,allow_live_comments,approved_at_utc,approved_by,archived,author,author_cakeday,author_flair_background_color,author_flair_css_class,author_flair_richtext,author_flair_template_id,author_flair_text,author_flair_text_color,author_flair_type,author_fullname,author_patreon_flair,banned_at_utc,banned_by,can_gild,can_mod_post,category,clicked,content_categories,contest_mode,created,created_utc,discussion_type,distinguished,domain,downs,edited,gilded,gildings,hidden,hide_score,id,is_crosspostable,is_meta,is_original_content,is_reddit_media_domain,is_robot_indexable,is_self,is_video,likes,link_flair_background_color,link_flair_css_class,link_flair_richtext,link_flair_template_id,link_flair_text,link_flair_text_color,link_flair_type,locked,media,media_embed,media_only,mod_note,mod_reason_by,mod_reason_title,mod_reports,name,no_follow,num_comments,num_crossposts,num_reports,over_18,parent_whitelist_status,permalink,pinned,pwls,quarantine,removal_reason,report_reasons,saved,score,secure_media,secure_media_embed,selftext,selftext_html,send_replies,spoiler,stickied,subreddit,subreddit_id,subreddit_name_prefixed,subreddit_subscribers,subreddit_type,suggested_sort,thumbnail,title,total_awards_received,ups,url,user_reports,view_count,visited,whitelist_status,wls
0,[],True,,,False,OrphanScript,,,,[],,,,text,t2_31kjwk8i,False,,,False,False,,False,,False,1562320535.0,1562291735.0,,,self.personalfinance,0,False,0,{},False,False,c9aei8,False,False,False,False,True,True,False,,,Housing,[],,Housing,dark,text,False,,{},False,,,,[],t3_c9aei8,False,507,0,,False,all_ads,/r/personalfinance/comments/c9aei8/my_bank_has_not_yet_deducted_my_rent_payment_from/,False,6,False,,,False,3812,,{},"Hello. So every month I move around $1,000 into my account and pay my rent using my apartment complex's online portal. I pay directly from the account and my understanding is that this is treated as a digital check. The apartment complex accepts payment immediately and clears my balance, and the bank itself typically takes 3 days to deduct that payment from the account. 

This past month, the bank just didn't take the money out. It's still sitting in the account I used to pay. The apartment complex confirms that I'm paid in full, and I paid a bit early last month so it's been nearly 2 weeks now since I've paid. 

I can't imagine the bank would make this kind of mistake (it's one of the bigger banks in the US), but they've never taken anywhere near this long to collect the money after my payments.

Guess I'm just wondering if this is something I should be concerned about. I plan on leaving the money in there until the end of the month at minimum just to cover myself in case they deduct it. But if they don't, am I clear to assume that it's still 'my' money or do I have anything to worry about?","&lt;!-- SC_OFF --&gt;&lt;div class=""md""&gt;&lt;p&gt;Hello. So every month I move around $1,000 into my account and pay my rent using my apartment complex&amp;#39;s online portal. I pay directly from the account and my understanding is that this is treated as a digital check. The apartment complex accepts payment immediately and clears my balance, and the bank itself typically takes 3 days to deduct that payment from the account. &lt;/p&gt;

&lt;p&gt;This past month, the bank just didn&amp;#39;t take the money out. It&amp;#39;s still sitting in the account I used to pay. The apartment complex confirms that I&amp;#39;m paid in full, and I paid a bit early last month so it&amp;#39;s been nearly 2 weeks now since I&amp;#39;ve paid. &lt;/p&gt;

&lt;p&gt;I can&amp;#39;t imagine the bank would make this kind of mistake (it&amp;#39;s one of the bigger banks in the US), but they&amp;#39;ve never taken anywhere near this long to collect the money after my payments.&lt;/p&gt;

&lt;p&gt;Guess I&amp;#39;m just wondering if this is something I should be concerned about. I plan on leaving the money in there until the end of the month at minimum just to cover myself in case they deduct it. But if they don&amp;#39;t, am I clear to assume that it&amp;#39;s still &amp;#39;my&amp;#39; money or do I have anything to worry about?&lt;/p&gt;
&lt;/div&gt;&lt;!-- SC_ON --&gt;",True,False,False,personalfinance,t5_2qstm,r/personalfinance,13779950,public,,,My bank has not yet deducted my rent payment from my account. It has been nearly 2 weeks and my apartment complex says they've been paid in full.,0,3812,https://www.reddit.com/r/personalfinance/comments/c9aei8/my_bank_has_not_yet_deducted_my_rent_payment_from/,[],,False,all_ads,6
1,[],True,,,False,livesfortrails,,,,[],,,,text,t2_13gyrp,False,,,False,False,,False,,False,1562318588.0,1562289788.0,,,self.personalfinance,0,False,0,{},False,False,c9a4sq,False,False,False,False,True,True,False,,,Taxes,[],,Taxes,dark,text,False,,{},False,,,,[],t3_c9a4sq,False,65,0,,False,all_ads,/r/personalfinance/comments/c9a4sq/irs_owes_us_money_but_takes_forever_to_respond_to/,False,6,False,,,False,355,,{},We had an error in our 2014 tax return that showed a family member was on a health exchange health plan when they weren’t. Because of that error our refund was $3000 less than what it should have been. Filed a corrected 1040 that was accepted. However IRS didn’t refund us the extra $3000 back. We have called and they accepted it was an error. We write to them and they say they are working on it and will get back to us in 45 days. However months go by and we hear nothing. I’m tired of writing to them and calling them only to have to wait 3 hours to talk to somebody. What are our options?,"&lt;!-- SC_OFF --&gt;&lt;div class=""md""&gt;&lt;p&gt;We had an error in our 2014 tax return that showed a family member was on a health exchange health plan when they weren’t. Because of that error our refund was $3000 less than what it should have been. Filed a corrected 1040 that was accepted. However IRS didn’t refund us the extra $3000 back. We have called and they accepted it was an error. We write to them and they say they are working on it and will get back to us in 45 days. However months go by and we hear nothing. I’m tired of writing to them and calling them only to have to wait 3 hours to talk to somebody. What are our options?&lt;/p&gt;
&lt;/div&gt;&lt;!-- SC_ON --&gt;",True,False,False,personalfinance,t5_2qstm,r/personalfinance,13779950,public,,,IRS owes us money but takes forever to respond to correspondence,0,355,https://www.reddit.com/r/personalfinance/comments/c9a4sq/irs_owes_us_money_but_takes_forever_to_respond_to/,[],,False,all_ads,6
2,[],True,,,False,DomStud,,,,[],,,,text,t2_5nkqd,False,,,False,False,,False,,False,1562317425.0,1562288625.0,,,self.personalfinance,0,False,0,{},False,False,c99z0v,False,False,False,False,True,True,False,,,Unset,[],,Other,dark,text,False,,{},False,,,,[],t3_c99z0v,False,73,0,,False,all_ads,/r/personalfinance/comments/c99z0v/i_am_able_to_do_travel_nursing_for_a_significant/,False,6,False,,,False,179,,{},"I am in a position to do travel nursing and double my income whilst also reducing my taxable amount. Should I take this opportunity to work my ass off for a few years and pay off my mortgage?

Also I'm not yet fully vested I to my 401k. Next year will be my 5 year mark and I will be fully vested.","&lt;!-- SC_OFF --&gt;&lt;div class=""md""&gt;&lt;p&gt;I am in a position to do travel nursing and double my income whilst also reducing my taxable amount. Should I take this opportunity to work my ass off for a few years and pay off my mortgage?&lt;/p&gt;

&lt;p&gt;Also I&amp;#39;m not yet fully vested I to my 401k. Next year will be my 5 year mark and I will be fully vested.&lt;/p&gt;
&lt;/div&gt;&lt;!-- SC_ON --&gt;",True,False,False,personalfinance,t5_2qstm,r/personalfinance,13779950,public,,,I am able to do travel nursing for a significant amount of money. Should I do it full-time?,0,179,https://www.reddit.com/r/personalfinance/comments/c99z0v/i_am_able_to_do_travel_nursing_for_a_significant/,[],,False,all_ads,6
3,[],True,,,False,Deadspyder88,,,,[],,,,text,t2_avrb3,False,,,False,False,,False,,False,1562321001.0,1562292201.0,,,self.personalfinance,0,1562331857.0,0,{},False,False,c9agu4,False,False,False,False,True,True,False,,#c313d3,Housing,[],1033dbd0-c078-11e4-b0f1-22000b3d8247,Housing,light,text,False,,{},False,,,,[],t3_c9agu4,False,163,0,,False,all_ads,/r/personalfinance/comments/c9agu4/a_relator_told_me_the_inspector_i_used_was_too/,False,6,False,,,False,173,,{},"First time home buyer here, and recently backed out from buying a house because of the inspector’s report. The inspector I used was the guy with the best reviews on a google search, all the people on a list my relator gave me were all booked solid for well over a week.

So the inspector does his inspection and there was a multitude of expensive fixes that needed to be done, and more than I wanted to take on as a first time home buyer. Honestly I really liked how thorough and no nonsense the inspector was, thought that was what inspectors were supposed to do.

So I am back at the house hunt, and I ask the realtor (a fill in because my relator is out of town until Saturday) if I could see a house that just came on the market (shopping in the range of 120-150k and houses are moving fast). So I get to the house before my relator and noticed that paint was chipping really bad under the roof, the detached garage had rotten boards, and see that the house probably wouldn’t work either.

The stand in realtor shows up and agrees with me that the home probably wouldn’t meet the requirements for a Hope/FHA loan, even though the sheet says FHA loans were okay. We do not even go inside the house.

However I asked her a few questions about what to look for in pictures, or finding these obvious things out first so I do not waste anybody’s time. Well one thing led to another and we got onto the subject of the inspector I used on the house I liked, and she said from what my realtor told her the person I used was just too nitpicky and likened him to another inspector realtors call the “deal breaker”.

Honestly I do not know quite what to think about the conversation. I mean I should want an inspector who does a good job, but the way this relator made it sound that I would never get a Hope/FHA loan approved with an inspector like that. 

Shouldn’t I want an inspector who will be thorough at his job? I mean the appraiser will just come out later and could note those same problems, and then I am out more money than just the inspection.

So what is sub’s experiences with home inspections?","&lt;!-- SC_OFF --&gt;&lt;div class=""md""&gt;&lt;p&gt;First time home buyer here, and recently backed out from buying a house because of the inspector’s report. The inspector I used was the guy with the best reviews on a google search, all the people on a list my relator gave me were all booked solid for well over a week.&lt;/p&gt;

&lt;p&gt;So the inspector does his inspection and there was a multitude of expensive fixes that needed to be done, and more than I wanted to take on as a first time home buyer. Honestly I really liked how thorough and no nonsense the inspector was, thought that was what inspectors were supposed to do.&lt;/p&gt;

&lt;p&gt;So I am back at the house hunt, and I ask the realtor (a fill in because my relator is out of town until Saturday) if I could see a house that just came on the market (shopping in the range of 120-150k and houses are moving fast). So I get to the house before my relator and noticed that paint was chipping really bad under the roof, the detached garage had rotten boards, and see that the house probably wouldn’t work either.&lt;/p&gt;

&lt;p&gt;The stand in realtor shows up and agrees with me that the home probably wouldn’t meet the requirements for a Hope/FHA loan, even though the sheet says FHA loans were okay. We do not even go inside the house.&lt;/p&gt;

&lt;p&gt;However I asked her a few questions about what to look for in pictures, or finding these obvious things out first so I do not waste anybody’s time. Well one thing led to another and we got onto the subject of the inspector I used on the house I liked, and she said from what my realtor told her the person I used was just too nitpicky and likened him to another inspector realtors call the “deal breaker”.&lt;/p&gt;

&lt;p&gt;Honestly I do not know quite what to think about the conversation. I mean I should want an inspector who does a good job, but the way this relator made it sound that I would never get a Hope/FHA loan approved with an inspector like that. &lt;/p&gt;

&lt;p&gt;Shouldn’t I want an inspector who will be thorough at his job? I mean the appraiser will just come out later and could note those same problems, and then I am out more money than just the inspection.&lt;/p&gt;

&lt;p&gt;So what is sub’s experiences with home inspections?&lt;/p&gt;
&lt;/div&gt;&lt;!-- SC_ON --&gt;",True,False,False,personalfinance,t5_2qstm,r/personalfinance,13779950,public,,,A relator told me the inspector I used was too nitpicky after I backed out of buying a house based on the report.,0,173,https://www.reddit.com/r/personalfinance/comments/c9agu4/a_relator_told_me_the_inspector_i_used_was_too/,[],,False,all_ads,6
4,[],True,,,False,Esani,,,,[],,,,text,t2_djdbk,False,,,False,False,,False,,False,1562304732.0,1562275932.0,,,self.personalfinance,0,False,0,{},False,False,c97z5c,False,False,False,False,True,True,False,,,Unset,[],,Other,dark,text,False,,{},False,,,,[],t3_c97z5c,False,85,0,,False,all_ads,/r/personalfinance/comments/c97z5c/i_think_a_bad_college_choice_may_have_destroyed/,False,6,False,,,False,57,,{},"This is a bit of a long story. I chose an out-of-state college because none of my state colleges had my intended major, linguistics. And, looking back on it, I was also following what my friends were doing and going to an out of state college. The state I went to for college is very far away and has a climate that I have now learned makes me depressed the majority of the time that I am there. Also while taking my linguistics classes there I began to realize that I did not really like linguistics that much (and, looking back, certainly not enough to warrant losing my in-state college scholarships). However, I learned that I am really passionate about teaching English as a foreign language and hope to do that after college for a couple years, save up some money, and use that to travel the world before I head back to the United States. 

The problem is that I am terrified that debt will hold me back from teaching English and traveling the world afterwards. I have finished my first year at the out-of-state college and despite having a really good scholarship am $6500 in debt because of a school and a major that I don't really like that much. I am considering transferring. The problem is, though, that if I rush the linguistics major next year it is possible for me to graduate with only 2 years in college. This is a feasible plan but the thought of going back to that school scares me. I would not go back if I had to stay for much longer. Also linguistics isn't the most marketable major and you don't even need a linguistics major to teach abroad.

My other choices are to go to one of my state colleges. My choices are a large state college that seems pretty good for my intended major (Global Studies) and costs more than the college I am transferring out of. I will probably be there for 2-3 more years. The other in state option is a smaller school that doesn't have as much opportunities for my intended major but is within driving distance from my parents' house and I would not have to pay for housing. Transferring also gives me to try out other fields that interest me like CS and Architecture.

I am very scared and anxious about this decision. It keeps me up all night and I know that making a decision and sticking to it will be best but I am the worst at making decisions. I can't even order off of menus without taking a long time. If anyone has any insight or thinks teaching abroad is feasible for me, I would love to hear.","&lt;!-- SC_OFF --&gt;&lt;div class=""md""&gt;&lt;p&gt;This is a bit of a long story. I chose an out-of-state college because none of my state colleges had my intended major, linguistics. And, looking back on it, I was also following what my friends were doing and going to an out of state college. The state I went to for college is very far away and has a climate that I have now learned makes me depressed the majority of the time that I am there. Also while taking my linguistics classes there I began to realize that I did not really like linguistics that much (and, looking back, certainly not enough to warrant losing my in-state college scholarships). However, I learned that I am really passionate about teaching English as a foreign language and hope to do that after college for a couple years, save up some money, and use that to travel the world before I head back to the United States. &lt;/p&gt;

&lt;p&gt;The problem is that I am terrified that debt will hold me back from teaching English and traveling the world afterwards. I have finished my first year at the out-of-state college and despite having a really good scholarship am $6500 in debt because of a school and a major that I don&amp;#39;t really like that much. I am considering transferring. The problem is, though, that if I rush the linguistics major next year it is possible for me to graduate with only 2 years in college. This is a feasible plan but the thought of going back to that school scares me. I would not go back if I had to stay for much longer. Also linguistics isn&amp;#39;t the most marketable major and you don&amp;#39;t even need a linguistics major to teach abroad.&lt;/p&gt;

&lt;p&gt;My other choices are to go to one of my state colleges. My choices are a large state college that seems pretty good for my intended major (Global Studies) and costs more than the college I am transferring out of. I will probably be there for 2-3 more years. The other in state option is a smaller school that doesn&amp;#39;t have as much opportunities for my intended major but is within driving distance from my parents&amp;#39; house and I would not have to pay for housing. Transferring also gives me to try out other fields that interest me like CS and Architecture.&lt;/p&gt;

&lt;p&gt;I am very scared and anxious about this decision. It keeps me up all night and I know that making a decision and sticking to it will be best but I am the worst at making decisions. I can&amp;#39;t even order off of menus without taking a long time. If anyone has any insight or thinks teaching abroad is feasible for me, I would love to hear.&lt;/p&gt;
&lt;/div&gt;&lt;!-- SC_ON --&gt;",True,False,False,personalfinance,t5_2qstm,r/personalfinance,13779950,public,,,I think a bad college choice may have destroyed my chances of achieving my dream. Any advice is welcome,0,57,https://www.reddit.com/r/personalfinance/comments/c97z5c/i_think_a_bad_college_choice_may_have_destroyed/,[],,False,all_ads,6
5,[],True,,,False,MoronTaxThrowaway,,,,[],,,,text,t2_42u2bwh6,False,,,False,False,,False,,False,1562286699.0,1562257899.0,,,self.personalfinance,0,False,0,{},False,False,c94ky1,False,False,False,False,True,True,False,,#375861,Taxes,[],3a006744-c078-11e4-87bd-22000b3e820a,Taxes,light,text,False,,{},False,,,,[],t3_c94ky1,False,17,0,,False,all_ads,/r/personalfinance/comments/c94ky1/personal_savings_were_invested_into_stock_which_i/,False,6,False,,,False,59,,{},"So this starts around 2004 where my mom bought stocks in her company using my savings up until 2009. The total that was invested into those stocks was about $15,000. About 5 years ago the company went public. I sold my stocks for $32,000. I was a bit concerned with filing taxes and asked my mom if I needed to file anything. She's usually on top of things like this and treated my question like it was absurd. This is where I fucked up. I didn't file any thing regarding the money that year and now I have the IRS asking for their share equal to $7,500. 

&amp;#x200B;

Am I beyond fucked? Or is this something that can be resolved. I'm going to be calling a CPA tomorrow to see what can be done. I was just looking to post here to see if there's any option of how to deal with this(like if CPA costs + having to pay for damages). I appreciate any comments &amp; I understand if I have to pay taxes for being a moron.","&lt;!-- SC_OFF --&gt;&lt;div class=""md""&gt;&lt;p&gt;So this starts around 2004 where my mom bought stocks in her company using my savings up until 2009. The total that was invested into those stocks was about $15,000. About 5 years ago the company went public. I sold my stocks for $32,000. I was a bit concerned with filing taxes and asked my mom if I needed to file anything. She&amp;#39;s usually on top of things like this and treated my question like it was absurd. This is where I fucked up. I didn&amp;#39;t file any thing regarding the money that year and now I have the IRS asking for their share equal to $7,500. &lt;/p&gt;

&lt;p&gt;&amp;#x200B;&lt;/p&gt;

&lt;p&gt;Am I beyond fucked? Or is this something that can be resolved. I&amp;#39;m going to be calling a CPA tomorrow to see what can be done. I was just looking to post here to see if there&amp;#39;s any option of how to deal with this(like if CPA costs + having to pay for damages). I appreciate any comments &amp;amp; I understand if I have to pay taxes for being a moron.&lt;/p&gt;
&lt;/div&gt;&lt;!-- SC_ON --&gt;",True,False,False,personalfinance,t5_2qstm,r/personalfinance,13779950,public,,,"Personal savings were invested into stock which I sold a few years back. IRS wants $7,000.",0,59,https://www.reddit.com/r/personalfinance/comments/c94ky1/personal_savings_were_invested_into_stock_which_i/,[],,False,all_ads,6
