182,[],True,,,False,linysB,,,,[],,,,text,t2_2u6inbd2,False,,,False,False,,False,,False,1562289175.0,1562260375.0,,,self.personalfinance,0,False,0,{},False,False,c9525f,False,False,False,False,True,True,False,,,Housing,[],,Housing,dark,text,False,,{},False,,,,[],t3_c9525f,True,6,0,,False,all_ads,/r/personalfinance/comments/c9525f/options_for_saving_for_a_house/,False,6,False,,,False,1,,{},"I am 19 and make around $400 weekly after taxes, I opened up a Roth IRA and have a portion of each check (around $174) going towards the 2065 Retirement Fund with Vanguard which I set to max it out. I have around 5k in my savings just sitting there doing nothing. I don't have to pay rent and my only expenses are my phone bill and food which average about $250 per month. Should I just leave the money I have now and money I get in the future in my Chase savings account or is there better options out there that aren't risky? I would like to have my own house by 25.","&lt;!-- SC_OFF --&gt;&lt;div class=""md""&gt;&lt;p&gt;I am 19 and make around $400 weekly after taxes, I opened up a Roth IRA and have a portion of each check (around $174) going towards the 2065 Retirement Fund with Vanguard which I set to max it out. I have around 5k in my savings just sitting there doing nothing. I don&amp;#39;t have to pay rent and my only expenses are my phone bill and food which average about $250 per month. Should I just leave the money I have now and money I get in the future in my Chase savings account or is there better options out there that aren&amp;#39;t risky? I would like to have my own house by 25.&lt;/p&gt;
&lt;/div&gt;&lt;!-- SC_ON --&gt;",True,False,False,personalfinance,t5_2qstm,r/personalfinance,13779951,public,,,Options for saving for a house?,0,1,https://www.reddit.com/r/personalfinance/comments/c9525f/options_for_saving_for_a_house/,[],,False,all_ads,6
183,[],False,,,False,AmbitiousExcuse,,,,[],,,,text,t2_pcuub5f,False,,,False,False,,False,,False,1562288645.0,1562259845.0,,,self.personalfinance,0,False,0,{},False,False,c94ydg,False,False,False,False,True,True,False,,,Investing,[],,Investing,dark,text,False,,{},False,,,,[],t3_c94ydg,True,11,0,,False,all_ads,/r/personalfinance/comments/c94ydg/where_should_i_passively_invest_a_small_amount_of/,False,6,False,,,False,1,,{},"I’m a junior in college and am looking to invest the money from scholarships that were in excess of my tuition. Roughly $8,000. Should I open a brokerage account? I was told to look into ETFs and Mutual Funds. My investment goal is long term but don’t want to use a robo advisor.

I’m looking to fund the account initially with the $8000 and transfer $1000-$1500 monthly into the account. I have a retirement 401(k) with my employer and will try to max the contribution, they also match 7%.","&lt;!-- SC_OFF --&gt;&lt;div class=""md""&gt;&lt;p&gt;I’m a junior in college and am looking to invest the money from scholarships that were in excess of my tuition. Roughly $8,000. Should I open a brokerage account? I was told to look into ETFs and Mutual Funds. My investment goal is long term but don’t want to use a robo advisor.&lt;/p&gt;

&lt;p&gt;I’m looking to fund the account initially with the $8000 and transfer $1000-$1500 monthly into the account. I have a retirement 401(k) with my employer and will try to max the contribution, they also match 7%.&lt;/p&gt;
&lt;/div&gt;&lt;!-- SC_ON --&gt;",True,False,False,personalfinance,t5_2qstm,r/personalfinance,13779951,public,,,Where should I passively invest a small amount of money?,0,1,https://www.reddit.com/r/personalfinance/comments/c94ydg/where_should_i_passively_invest_a_small_amount_of/,[],,False,all_ads,6
184,[],False,,,False,queen_clean,,,,[],,,,text,t2_2rema7v8,False,,,False,False,,False,,False,1562287681.0,1562258881.0,,,self.personalfinance,0,False,0,{},False,False,c94ro8,False,False,False,False,True,True,False,,#4743eb,Debt,[],f794391c-c077-11e4-b569-22000bb2680d,Debt,light,text,False,,{},False,,,,[],t3_c94ro8,True,4,0,,False,all_ads,/r/personalfinance/comments/c94ro8/gone_over_my_overdraft/,False,6,False,,,False,1,,{},"I’ve gone over my overdraft by £1 and I literally have no way to get it, does anyone know a quick way I could make money that can be withdrawn to my account today to avoid the extra charges ? 
Thanks","&lt;!-- SC_OFF --&gt;&lt;div class=""md""&gt;&lt;p&gt;I’ve gone over my overdraft by £1 and I literally have no way to get it, does anyone know a quick way I could make money that can be withdrawn to my account today to avoid the extra charges ? 
Thanks&lt;/p&gt;
&lt;/div&gt;&lt;!-- SC_ON --&gt;",True,False,False,personalfinance,t5_2qstm,r/personalfinance,13779951,public,,,Gone over my overdraft,0,1,https://www.reddit.com/r/personalfinance/comments/c94ro8/gone_over_my_overdraft/,[],,False,all_ads,6
185,[],False,,,False,manigambler,,,,[],,,,text,t2_lb28k,False,,,False,False,,False,,False,1562286705.0,1562257905.0,,,self.personalfinance,0,False,0,{},False,False,c94kzp,False,False,False,False,True,True,False,,,Debt,[],,Debt,dark,text,False,,{},False,,,,[],t3_c94kzp,True,3,0,,False,all_ads,/r/personalfinance/comments/c94kzp/question_on_a_collection_from_2_years_6_months_ago/,False,6,False,,,False,1,,{},"Hello, I have a debt collection on my credit report in the amount of $194 from 2.5 years ago. It's the only derogatory mark on my credit report. It was from a previous insurance company. I had moved and didn't know I had a balance, they sent it to a collection agency. It's from January of 2017 to be exact. 

My question is, should I just pay this off (I'm able to) or should I just let it sit and drop off eventually, 

&amp;#x200B;

Thank you all for any help with this, it's really appreciated.","&lt;!-- SC_OFF --&gt;&lt;div class=""md""&gt;&lt;p&gt;Hello, I have a debt collection on my credit report in the amount of $194 from 2.5 years ago. It&amp;#39;s the only derogatory mark on my credit report. It was from a previous insurance company. I had moved and didn&amp;#39;t know I had a balance, they sent it to a collection agency. It&amp;#39;s from January of 2017 to be exact. &lt;/p&gt;

&lt;p&gt;My question is, should I just pay this off (I&amp;#39;m able to) or should I just let it sit and drop off eventually, &lt;/p&gt;

&lt;p&gt;&amp;#x200B;&lt;/p&gt;

&lt;p&gt;Thank you all for any help with this, it&amp;#39;s really appreciated.&lt;/p&gt;
&lt;/div&gt;&lt;!-- SC_ON --&gt;",True,False,False,personalfinance,t5_2qstm,r/personalfinance,13779951,public,,,"Question on a collection from 2 years, 6 months ago",0,1,https://www.reddit.com/r/personalfinance/comments/c94kzp/question_on_a_collection_from_2_years_6_months_ago/,[],,False,all_ads,6
186,[],False,,,False,jatznic,,,,[],,,,text,t2_65ovn,False,,,False,False,,False,,False,1562285710.0,1562256910.0,,,self.personalfinance,0,False,0,{},False,False,c94ec4,False,False,False,False,True,True,False,,,Debt,[],,Debt,dark,text,False,,{},False,,,,[],t3_c94ec4,True,6,0,,False,all_ads,/r/personalfinance/comments/c94ec4/consolidating_debt_with_a_15_year_mortgage/,False,6,False,,,False,1,,{},"I've been contemplating something for a few months now and I can't come to a decision on if this would be a smart financial move or not.  

I currently have a 30-year fixed rate at 4.125 which originated in May of 2013.  I also have a single auto loan and a single small personal loan and no other debt to speak of.  I have credit cards however I pay them off monthly.  

I've been debating if it would make financial sense to consolidate my auto loan and personal loan into a new, 15-year mortgage instead.  I have a large amount of equity in my home so the amount would not be an issue.  The new monthly payment would be $250 cheaper than my combined payments now.

I should mention that I have no need to do this as I can make my current payments just fine.  It's more that i'm interested in a 15-year mortgage but would not want to add to my monthly costs in the process. 

Would there be an advantage do this or would it be better to leave everything the way it is, or perhaps to just pay down the auto/personal loans faster instead?","&lt;!-- SC_OFF --&gt;&lt;div class=""md""&gt;&lt;p&gt;I&amp;#39;ve been contemplating something for a few months now and I can&amp;#39;t come to a decision on if this would be a smart financial move or not.  &lt;/p&gt;

&lt;p&gt;I currently have a 30-year fixed rate at 4.125 which originated in May of 2013.  I also have a single auto loan and a single small personal loan and no other debt to speak of.  I have credit cards however I pay them off monthly.  &lt;/p&gt;

&lt;p&gt;I&amp;#39;ve been debating if it would make financial sense to consolidate my auto loan and personal loan into a new, 15-year mortgage instead.  I have a large amount of equity in my home so the amount would not be an issue.  The new monthly payment would be $250 cheaper than my combined payments now.&lt;/p&gt;

&lt;p&gt;I should mention that I have no need to do this as I can make my current payments just fine.  It&amp;#39;s more that i&amp;#39;m interested in a 15-year mortgage but would not want to add to my monthly costs in the process. &lt;/p&gt;

&lt;p&gt;Would there be an advantage do this or would it be better to leave everything the way it is, or perhaps to just pay down the auto/personal loans faster instead?&lt;/p&gt;
&lt;/div&gt;&lt;!-- SC_ON --&gt;",True,False,False,personalfinance,t5_2qstm,r/personalfinance,13779951,public,,,Consolidating debt with a 15 year Mortgage,0,1,https://www.reddit.com/r/personalfinance/comments/c94ec4/consolidating_debt_with_a_15_year_mortgage/,[],,False,all_ads,6
187,[],False,,,False,actherk,,,,[],,,,text,t2_33dztjic,False,,,False,False,,False,,False,1562284800.0,1562256000.0,,,self.personalfinance,0,1562256625.0,0,{},False,False,c947yr,False,False,False,False,True,True,False,,,Retirement,[],,Retirement,dark,text,False,,{},False,,,,[],t3_c947yr,True,8,0,,False,all_ads,/r/personalfinance/comments/c947yr/401k_rollover_to_ira_question/,False,6,False,,,False,1,,{},"So let’s say  have $50k pretax, $40k post tax, and $10k Roth in my 401k. I decide to leave and roll this over. Will I get one check and I figure out how much to each category, or will I get multiple checks in the amounts I contributed to each category?

Edit: I meant getting checks made out to the ira accounts that I’m rolling over to or direct deposit, not made to me.","&lt;!-- SC_OFF --&gt;&lt;div class=""md""&gt;&lt;p&gt;So let’s say  have $50k pretax, $40k post tax, and $10k Roth in my 401k. I decide to leave and roll this over. Will I get one check and I figure out how much to each category, or will I get multiple checks in the amounts I contributed to each category?&lt;/p&gt;

&lt;p&gt;Edit: I meant getting checks made out to the ira accounts that I’m rolling over to or direct deposit, not made to me.&lt;/p&gt;
&lt;/div&gt;&lt;!-- SC_ON --&gt;",True,False,False,personalfinance,t5_2qstm,r/personalfinance,13779951,public,,,401k rollover to ira question,0,1,https://www.reddit.com/r/personalfinance/comments/c947yr/401k_rollover_to_ira_question/,[],,False,all_ads,6
188,[],False,,,False,throwawaypefinance,,,,[],,,,text,t2_42tnx9jg,False,,,False,False,,False,,False,1562282379.0,1562253579.0,,,self.personalfinance,0,False,0,{},False,False,c93s10,False,False,False,False,True,True,False,,,Auto,[],,Auto,dark,text,False,,{},False,,,,[],t3_c93s10,True,2,0,,False,all_ads,/r/personalfinance/comments/c93s10/22_yo_in_college_new_job_sell_car_keep_it_buy/,False,6,False,,,False,1,,{},"Hey everyone.

&amp;#x200B;

A little bit of context. I'm a 22yo living with his parents. I'm in Business School, specializing in Entrepreneurship on the weekends. I just got a new job (internship) that pays almost 3x what I was making before, but it's also further away from where I live and study, so I'll have around 2:30 to 3h in public transport everyday, compared to the 20 min I had before. That means I have little to no free time during the week, and part of the weekend.

&amp;#x200B;

I own a car that my father gave to me. I love it, but I sometimes feel it's a little too much for me.

&amp;#x200B;

I used to use my car everyday. With this new job, I don't think I'll be able to use my car during the week, so it would be basically a weekend car only. We only have one parking spot where we live, so we're currently paying a decent sum of money for a parking spot a couple of blocks away, so it's expensive and a pain to walk there everytime I have to use my car.

&amp;#x200B;

Now, my father pays for all the costs of the car. He's not exactly complaining, but I'm sure he would be grateful if I reduced a few of those costs.

&amp;#x200B;

I'm in a serious internal debate now. Having a car gives me the freedom to go anywhere I want with little trouble, and I might still use my car for work once in a while. But having an ""expensive"" car with little use feels a bit like a waste to me.

&amp;#x200B;

As a reference, my car is worth around R$ 53.000 on the used market (\~US$ 15.000, or around 53 minimum wages here). I could sell my car, Uber around when needed and invest the money (even to purchase another car when I feel the need to have one). Or I could sell my car and purchase a cheaper, smaller one that I could leave parked on the street. Or maybe just keep it, since my father is willing to cover the costs of maintaining the car?

&amp;#x200B;

Anyone faced a similar situation, selling their car due to not being able to use it enough? I really enjoy driving, so that's kind of a big factor for me as well :(

&amp;#x200B;

Thanks!","&lt;!-- SC_OFF --&gt;&lt;div class=""md""&gt;&lt;p&gt;Hey everyone.&lt;/p&gt;

&lt;p&gt;&amp;#x200B;&lt;/p&gt;

&lt;p&gt;A little bit of context. I&amp;#39;m a 22yo living with his parents. I&amp;#39;m in Business School, specializing in Entrepreneurship on the weekends. I just got a new job (internship) that pays almost 3x what I was making before, but it&amp;#39;s also further away from where I live and study, so I&amp;#39;ll have around 2:30 to 3h in public transport everyday, compared to the 20 min I had before. That means I have little to no free time during the week, and part of the weekend.&lt;/p&gt;

&lt;p&gt;&amp;#x200B;&lt;/p&gt;

&lt;p&gt;I own a car that my father gave to me. I love it, but I sometimes feel it&amp;#39;s a little too much for me.&lt;/p&gt;

&lt;p&gt;&amp;#x200B;&lt;/p&gt;

&lt;p&gt;I used to use my car everyday. With this new job, I don&amp;#39;t think I&amp;#39;ll be able to use my car during the week, so it would be basically a weekend car only. We only have one parking spot where we live, so we&amp;#39;re currently paying a decent sum of money for a parking spot a couple of blocks away, so it&amp;#39;s expensive and a pain to walk there everytime I have to use my car.&lt;/p&gt;

&lt;p&gt;&amp;#x200B;&lt;/p&gt;

&lt;p&gt;Now, my father pays for all the costs of the car. He&amp;#39;s not exactly complaining, but I&amp;#39;m sure he would be grateful if I reduced a few of those costs.&lt;/p&gt;

&lt;p&gt;&amp;#x200B;&lt;/p&gt;

&lt;p&gt;I&amp;#39;m in a serious internal debate now. Having a car gives me the freedom to go anywhere I want with little trouble, and I might still use my car for work once in a while. But having an &amp;quot;expensive&amp;quot; car with little use feels a bit like a waste to me.&lt;/p&gt;

&lt;p&gt;&amp;#x200B;&lt;/p&gt;

&lt;p&gt;As a reference, my car is worth around R$ 53.000 on the used market (~US$ 15.000, or around 53 minimum wages here). I could sell my car, Uber around when needed and invest the money (even to purchase another car when I feel the need to have one). Or I could sell my car and purchase a cheaper, smaller one that I could leave parked on the street. Or maybe just keep it, since my father is willing to cover the costs of maintaining the car?&lt;/p&gt;

&lt;p&gt;&amp;#x200B;&lt;/p&gt;

&lt;p&gt;Anyone faced a similar situation, selling their car due to not being able to use it enough? I really enjoy driving, so that&amp;#39;s kind of a big factor for me as well :(&lt;/p&gt;

&lt;p&gt;&amp;#x200B;&lt;/p&gt;

&lt;p&gt;Thanks!&lt;/p&gt;
&lt;/div&gt;&lt;!-- SC_ON --&gt;",True,False,False,personalfinance,t5_2qstm,r/personalfinance,13779951,public,,,"22 yo in college + new job - sell car, keep it, buy cheaper one?",0,1,https://www.reddit.com/r/personalfinance/comments/c93s10/22_yo_in_college_new_job_sell_car_keep_it_buy/,[],,False,all_ads,6
189,[],False,,,False,satthereonashelf,,,,[],,,,text,t2_10kfo5,False,,,False,False,,False,,False,1562366217.0,1562337417.0,,,self.personalfinance,0,False,0,{},False,True,c9gnts,False,False,False,False,True,True,False,,#da333f,Investing,[],1c57f8a6-c078-11e4-9e41-22000b39cb96,Investing,light,text,False,,{},False,,,,[],t3_c9gnts,True,0,0,,False,all_ads,/r/personalfinance/comments/c9gnts/500_a_month_in_extra_income_how_to_save_for/,False,6,False,,,False,0,,{},"Am 19. Lucky enough to have college paid for by parents, savings and scholarship. I’ve established a small emergency fund paid off after debts and want to start saving for life after graduation. I am able to put approximately $500-600 a month aside for the next 3 years so almost $18k-20k over that time period. 

I’m looking into opening a HYSA and just depositing what I can in each month. Anything better than that? I looked into Vanguard funds and brokerage accounts but the fees seem steep. I already am set with my budgeting and regular savings, but I wanted to do something different and build towards my future.","&lt;!-- SC_OFF --&gt;&lt;div class=""md""&gt;&lt;p&gt;Am 19. Lucky enough to have college paid for by parents, savings and scholarship. I’ve established a small emergency fund paid off after debts and want to start saving for life after graduation. I am able to put approximately $500-600 a month aside for the next 3 years so almost $18k-20k over that time period. &lt;/p&gt;

&lt;p&gt;I’m looking into opening a HYSA and just depositing what I can in each month. Anything better than that? I looked into Vanguard funds and brokerage accounts but the fees seem steep. I already am set with my budgeting and regular savings, but I wanted to do something different and build towards my future.&lt;/p&gt;
&lt;/div&gt;&lt;!-- SC_ON --&gt;",True,False,False,personalfinance,t5_2qstm,r/personalfinance,13779951,public,,,~$500 a month in extra income - how to save for graduation?,0,0,https://www.reddit.com/r/personalfinance/comments/c9gnts/500_a_month_in_extra_income_how_to_save_for/,[],,False,all_ads,6
190,[],False,,,False,shifty_bench,,,,[],,,,text,t2_3bo3ngvm,False,,,False,False,,False,,False,1562363458.0,1562334658.0,,,self.personalfinance,0,False,0,{},False,True,c9g67c,False,False,False,False,True,True,False,,,Employment,[],,Employment,dark,text,False,,{},False,,,,[],t3_c9g67c,True,1,0,,False,all_ads,/r/personalfinance/comments/c9g67c/hsa_employer_contributions/,False,6,False,,,False,0,,{},"I can't seem to find the answer to this... I assume I will need to call my insurance company if/when this happens...

My husband is currently on my HSA. My company gave a flat contribution to my HSA at the start of the year - $1250 for the family (vs. $625 if it had just been me). My husband just graduated school and is applying for jobs. When he finds a job, he will likely take his employer-provided insurance (which will likely be better than mine given the industry).

I know I'd do a Life Event change to remove him from my insurance, but my question is - will I be obligated to pay back some/all of the additional $625 in my HSA that was contributed by my employer for my husband?","&lt;!-- SC_OFF --&gt;&lt;div class=""md""&gt;&lt;p&gt;I can&amp;#39;t seem to find the answer to this... I assume I will need to call my insurance company if/when this happens...&lt;/p&gt;

&lt;p&gt;My husband is currently on my HSA. My company gave a flat contribution to my HSA at the start of the year - $1250 for the family (vs. $625 if it had just been me). My husband just graduated school and is applying for jobs. When he finds a job, he will likely take his employer-provided insurance (which will likely be better than mine given the industry).&lt;/p&gt;

&lt;p&gt;I know I&amp;#39;d do a Life Event change to remove him from my insurance, but my question is - will I be obligated to pay back some/all of the additional $625 in my HSA that was contributed by my employer for my husband?&lt;/p&gt;
&lt;/div&gt;&lt;!-- SC_ON --&gt;",True,False,False,personalfinance,t5_2qstm,r/personalfinance,13779951,public,,,HSA Employer Contributions,0,0,https://www.reddit.com/r/personalfinance/comments/c9g67c/hsa_employer_contributions/,[],,False,all_ads,6
191,[],False,,,False,sheisaeval,True,,,[],,,,text,t2_5h08u,False,,,False,False,,False,,False,1562363228.0,1562334428.0,,,self.personalfinance,0,False,0,{},False,True,c9g4wq,False,False,False,False,True,True,False,,,Retirement,[],,Retirement,dark,text,False,,{},False,,,,[],t3_c9g4wq,True,5,0,,False,all_ads,/r/personalfinance/comments/c9g4wq/inherited_ira_both_roth_and_trad_moving_from_one/,False,6,False,,,False,0,,{},"So husband inherited some IRAs from his grandparents. One Roth and one trad, from Edward Jones. From my research, I think that taking out RMD over our lifetime (we're both mid 30s) would probably be the best option (but please let me know if any other options are better).

&amp;#x200B;

First question- Would it be easy to move the entire inherited amount from Edward Jones to another financial company like Fidelity or Vanguard, which we currently have our own IRAs in? Right now the inherited amount from Edward Jones has a mixture of funds in cash and in mutual funds.  

&amp;#x200B;

Second question - since we have to take a certain amount out from RMD each year, can we just take that amount and put it into another brokerage account (that we will open) and invest that again? Would that be the best option? 

&amp;#x200B;

Thanks","&lt;!-- SC_OFF --&gt;&lt;div class=""md""&gt;&lt;p&gt;So husband inherited some IRAs from his grandparents. One Roth and one trad, from Edward Jones. From my research, I think that taking out RMD over our lifetime (we&amp;#39;re both mid 30s) would probably be the best option (but please let me know if any other options are better).&lt;/p&gt;

&lt;p&gt;&amp;#x200B;&lt;/p&gt;

&lt;p&gt;First question- Would it be easy to move the entire inherited amount from Edward Jones to another financial company like Fidelity or Vanguard, which we currently have our own IRAs in? Right now the inherited amount from Edward Jones has a mixture of funds in cash and in mutual funds.  &lt;/p&gt;

&lt;p&gt;&amp;#x200B;&lt;/p&gt;

&lt;p&gt;Second question - since we have to take a certain amount out from RMD each year, can we just take that amount and put it into another brokerage account (that we will open) and invest that again? Would that be the best option? &lt;/p&gt;

&lt;p&gt;&amp;#x200B;&lt;/p&gt;

&lt;p&gt;Thanks&lt;/p&gt;
&lt;/div&gt;&lt;!-- SC_ON --&gt;",True,False,False,personalfinance,t5_2qstm,r/personalfinance,13779951,public,,,Inherited IRA (Both Roth and Trad) - moving from one financial company to another? RMD?,0,0,https://www.reddit.com/r/personalfinance/comments/c9g4wq/inherited_ira_both_roth_and_trad_moving_from_one/,[],,False,all_ads,6
