id,tweet,tokenized,lemmatized,stemmed,label
901097446566133764,high doses of vitamin b tied to lung cancer risk  study says  ah6n,high doses of vitamin b tied to lung cancer risk study says ah6n,high dos of vitamin b tied to lung cancer risk study say ah6n,high dose of vitamin b tie to lung cancer risk studi say ah6n,0
901096927810420737,high doses of vitamin b tied to lung cancer risk  study says  ah6y,high doses of vitamin b tied to lung cancer risk study says ah6y,high dos of vitamin b tied to lung cancer risk study say ah6y,high dose of vitamin b tie to lung cancer risk studi say ah6i,0
901096834172669953,happy bi hday to rupert  the other man in my life  baby boy turns 5 today   bluecatlounge,happy bi hday to rupert the other man in my life baby boy turns 5 today bluecatlounge,happy bi hday to rupert the other man in my life baby boy turn 5 today bluecatlounge,happi bi hday to rupert the other man in my life babi boy turn 5 today bluecatloung,0
901096650013380610,pasadena  texas,pasadena texas,pasadena texas,pasadena texa,0
901096496027881472,high doses of vitamin b tied to lung cancer risk  study says  ah6n,high doses of vitamin b tied to lung cancer risk study says ah6n,high dos of vitamin b tied to lung cancer risk study say ah6n,high dose of vitamin b tie to lung cancer risk studi say ah6n,0
901096409339965445,high doses of vitamin b tied to lung cancer risk  study says  ah6l,high doses of vitamin b tied to lung cancer risk study says ah6l,high dos of vitamin b tied to lung cancer risk study say ah6l,high dose of vitamin b tie to lung cancer risk studi say ah6l,0
901096406890532865,what it be like right na  westside  houston  texas,what it be like right na westside houston texas,what it be like right na westside houston texas,what it be like right na westsid houston texa,0
901096188866424832,eye exam    university eye institute in houston  tx  grof5pu8hbm,eye exam university eye institute in houston tx grof5pu8hbm,eye exam university eye institute in houston tx grof5pu8hbm,eye exam univers eye institut in houston tx grof5pu8hbm,0
901096151881048066,high doses of vitamin b tied to lung cancer risk  study says  ah6d,high doses of vitamin b tied to lung cancer risk study says ah6d,high dos of vitamin b tied to lung cancer risk study say ah6d,high dose of vitamin b tie to lung cancer risk studi say ah6d,0
901095979885228032,high doses of vitamin b tied to lung cancer risk  study says  ah65,high doses of vitamin b tied to lung cancer risk study says ah65,high dos of vitamin b tied to lung cancer risk study say ah65,high dose of vitamin b tie to lung cancer risk studi say ah65,0
901095933726920704,got my own heavy hands  i m official now   memorial athletic club,got my own heavy hands i m official now memorial athletic club,got my own heavy hand i m official now memorial athletic club,got my own heavi hand i m offici now memori athlet club,0
901095723026051076,high doses of vitamin b tied to lung cancer risk  study says  ah5v,high doses of vitamin b tied to lung cancer risk study says ah5v,high dos of vitamin b tied to lung cancer risk study say ah5v,high dose of vitamin b tie to lung cancer risk studi say ah5v,0
901095510299344896,the show must go on     join me  the jazz on the que note with the men of the nu phi chapter of,the show must go on join me the jazz on the que note with the men of the nu phi chapter of,the show must go on join me the jazz on the que note with the men of the nu phi chapter of,the show must go on join me the jazz on the que note with the men of the nu phi chapter of,0
901095378379997185,high doses of vitamin b tied to lung cancer risk  study says  ah5c,high doses of vitamin b tied to lung cancer risk study says ah5c,high dos of vitamin b tied to lung cancer risk study say ah5c,high dose of vitamin b tie to lung cancer risk studi say ah5c,0
901095182678069250,this is dishea ening  901077870197559296,this is dishea ening 901077870197559296,this is dishea ening 901077870197559296,thi is dishea ene 901077870197559296,0
901094808680361984,especially when as a race they re looking to us straight black men for suppo  of their orientation  they ll always have an ally in me for 1,especially when as a race they re looking to us straight black men for suppo of their orientation they ll always have an ally in me for 1,especially when a a race they re looking to u straight black men for suppo of their orientation they ll always have an ally in me for 1,especi when as a race they re look to us straight black men for suppo of their orient they ll alway have an alli in me for 1,0
901094434913300482,high doses of vitamin b tied to lung cancer risk  study says  ah59,high doses of vitamin b tied to lung cancer risk study says ah59,high dos of vitamin b tied to lung cancer risk study say ah59,high dose of vitamin b tie to lung cancer risk studi say ah59,0
901094379363946500,mood for the storm  houston  texas,mood for the storm houston texas,mood for the storm houston texas,mood for the storm houston texa,2
901094089940226048,high doses of vitamin b tied to lung cancer risk  study says  ah4x,high doses of vitamin b tied to lung cancer risk study says ah4x,high dos of vitamin b tied to lung cancer risk study say ah4x,high dose of vitamin b tie to lung cancer risk studi say ah4x,0
901094002925219840,high doses of vitamin b tied to lung cancer risk  study says  ah4r,high doses of vitamin b tied to lung cancer risk study says ah4r,high dos of vitamin b tied to lung cancer risk study say ah4r,high dose of vitamin b tie to lung cancer risk studi say ah4r,0
901093720891805698,tipoftheday brush your lashes daily to keep them looking bomb ladies have fab u lash day,tipoftheday brush your lashes daily to keep them looking bomb ladies have fab u lash day,tipoftheday brush your lash daily to keep them looking bomb lady have fab u lash day,tipoftheday brush your lash daili to keep them look bomb ladi have fab u lash day,0
901093658757402624,high doses of vitamin b tied to lung cancer risk  study says  ah4h,high doses of vitamin b tied to lung cancer risk study says ah4h,high dos of vitamin b tied to lung cancer risk study say ah4h,high dose of vitamin b tie to lung cancer risk studi say ah4h,0
901093482793664512,a look  adorable   university of houston,a look adorable university of houston,a look adorable university of houston,a look ador univers of houston,0
901092946199576576,suzie s in style catering will be catering this fantastic event   e out and jam  these men are,suzie s in style catering will be catering this fantastic event e out and jam these men are,suzie s in style catering will be catering this fantastic event e out and jam these men are,suzi s in style cater will be cater thi fantast event e out and jam these men are,0
901092936829485056,be safe everyone   9round houston galleria,be safe everyone 9round houston galleria,be safe everyone 9round houston galleria,be safe everyon 9round houston galleria,1
901092800653135876,high doses of vitamin b tied to lung cancer risk  study says  ah4l,high doses of vitamin b tied to lung cancer risk study says ah4l,high dos of vitamin b tied to lung cancer risk study say ah4l,high dose of vitamin b tie to lung cancer risk studi say ah4l,0
901092714460184576,high doses of vitamin b tied to lung cancer risk  study says  ah4i,high doses of vitamin b tied to lung cancer risk study says ah4i,high dos of vitamin b tied to lung cancer risk study say ah4i,high dose of vitamin b tie to lung cancer risk studi say ah4i,0
901092675444539392,rest in heaven we still miss you    aaliyah  restinheaven  angel  houston  texas,rest in heaven we still miss you aaliyah restinheaven angel houston texas,rest in heaven we still miss you aaliyah restinheaven angel houston texas,rest in heaven we still miss you aaliyah restinheaven angel houston texa,0
901092628774760448,high doses of vitamin b tied to lung cancer risk  study says  ah4g,high doses of vitamin b tied to lung cancer risk study says ah4g,high dos of vitamin b tied to lung cancer risk study say ah4g,high dose of vitamin b tie to lung cancer risk studi say ah4g,0
901092599649501184,repost of avenidahouston   minimurals at grb convention center by pilotfx   project by,repost of avenidahouston minimurals at grb convention center by pilotfx project by,repost of avenidahouston minimurals at grb convention center by pilotfx project by,repost of avenidahouston minimur at grb convent center by pilotfx project by,0
901092542955085825,high doses of vitamin b tied to lung cancer risk  study says  ah4e,high doses of vitamin b tied to lung cancer risk study says ah4e,high dos of vitamin b tied to lung cancer risk study say ah4e,high dose of vitamin b tie to lung cancer risk studi say ah4,0
901091889579008000,assistam at  o final  deslize para o lado e veja segunda parte     o verdadeiro,assistam at o final deslize para o lado e veja segunda parte o verdadeiro,assistam at o final deslize para o lado e veja segunda parte o verdadeiro,assistam at o final desliz para o lado e veja segunda part o verdadeiro,0
901091770435588096,what s your favorite  tag someone who would like the fresh smell    realtor  realtoring,what s your favorite tag someone who would like the fresh smell realtor realtoring,what s your favorite tag someone who would like the fresh smell realtor realtoring,what s your favorit tag someon who would like the fresh smell realtor realtor,0
901091481053782016,please remember to keep your pets safe during the storm   bring them indoors with you   if you,please remember to keep your pets safe during the storm bring them indoors with you if you,please remember to keep your pet safe during the storm bring them indoors with you if you,pleas rememb to keep your pet safe dure the storm bring them indoor with you if you,2
901091336409026561,the next international adventure of  adventuresofcjnjc brought to,the next international adventure of adventuresofcjnjc brought to,the next international adventure of adventuresofcjnjc brought to,the next intern adventur of adventuresofcjnjc brought to,0
901091332738994177,kitten04  regram     that s what i m talking about    classichits  texasweather  whiskey,kitten04 regram that s what i m talking about classichits texasweather whiskey,kitten04 regram that s what i m talking about classichits texasweather whiskey,kitten04 regram that s what i m talk about classichit texasweath whiskey,0
901091321699586049,harvey storm coverage  day 1 out of     channel 2   nbc  kprc tv     kprc2 in houston  tx  jkwkrvwnqvc,harvey storm coverage day 1 out of channel 2 nbc kprc tv kprc2 in houston tx jkwkrvwnqvc,harvey storm coverage day 1 out of channel 2 nbc kprc tv kprc2 in houston tx jkwkrvwnqvc,harvey storm coverag day 1 out of channel 2 nbc kprc tv kprc2 in houston tx jkwkrvwnqvc,1
901090986075578368,yay  new beginnings    god ain t done with me yet   backupplan,yay new beginnings god ain t done with me yet backupplan,yay new beginning god ain t done with me yet backupplan,yay new begin god ain t done with me yet backupplan,0
901090946825179137,business oppo unity learn how you can run your own home based business around your current,business oppo unity learn how you can run your own home based business around your current,business oppo unity learn how you can run your own home based business around your current,busi oppo uniti learn how you can run your own home base busi around your current,0
901090825643446272,i believe the official term is  bug out   see ya  hurricaneharvey   george bush intercontinental airpo   ftvrgxoekhm,i believe the official term is bug out see ya hurricaneharvey george bush intercontinental airpo ftvrgxoekhm,i believe the official term is bug out see ya hurricaneharvey george bush intercontinental airpo ftvrgxoekhm,i believ the offici term is bug out see ya hurricaneharvey georg bush intercontinent airpo ftvrgxoekhm,0
901090825492471810,an amazing way to sta  my extended and forced weekend thanks to,an amazing way to sta my extended and forced weekend thanks to,an amazing way to sta my extended and forced weekend thanks to,an amaz way to sta my extend and forc weekend thank to,0
901090764574392321,i m just going to be channeling yesterday s sunshine and positive vibes for today please,i m just going to be channeling yesterday s sunshine and positive vibes for today please,i m just going to be channeling yesterday s sunshine and positive vibe for today please,i m just go to be channel yesterday s sunshin and posit vibe for today pleas,0
901090746257813504,but they re right rt  shottyisms  this publication is not owned by black people btw  900535973557276672,but they re right rt shottyisms this publication is not owned by black people btw 900535973557276672,but they re right rt shottyisms this publication is not owned by black people btw 900535973557276672,but they re right rt shottyism thi public is not own by black peopl btw 900535973557276672,0
901090400806592512,harvey  hurricanharvey  kindermusikwithmserynn  musicwithmserynn  baytown  music with ms  erynn,harvey hurricanharvey kindermusikwithmserynn musicwithmserynn baytown music with ms erynn,harvey hurricanharvey kindermusikwithmserynn musicwithmserynn baytown music with m erynn,harvey hurricanharvey kindermusikwithmserynn musicwithmserynn baytown music with ms erynn,0
901090331508256768,all lanes blocked  in  southside on hwy 288 s fwy outbound after the s sam houston tollway to mchard  stopped traffic back to almeda genoa,all lanes blocked in southside on hwy 288 s fwy outbound after the s sam houston tollway to mchard stopped traffic back to almeda genoa,all lane blocked in southside on hwy 288 s fwy outbound after the s sam houston tollway to mchard stopped traffic back to almeda genoa,all lane block in southsid on hwi 288 s fwi outbound after the s sam houston tollway to mchard stop traffic back to almeda genoa,0
901090278798352384,meals for days stay fueled with the quick and easy perfectfitmeals  healthyfood  food,meals for days stay fueled with the quick and easy perfectfitmeals healthyfood food,meal for day stay fueled with the quick and easy perfectfitmeals healthyfood food,meal for day stay fuel with the quick and easi perfectfitm healthyfood food,0
901090065434025984,i m usually with harvey specter on this one  but harvey the hurricane has something else to say,i m usually with harvey specter on this one but harvey the hurricane has something else to say,i m usually with harvey specter on this one but harvey the hurricane ha something else to say,i m usual with harvey specter on thi one but harvey the hurrican ha someth els to say,2
901089549866201089,byeeeee    william p  hobbyairpo  in houston  tx  iviozndwt2n,byeeeee william p hobbyairpo in houston tx iviozndwt2n,byeeeee william p hobbyairpo in houston tx iviozndwt2n,byeeeee william p hobbyairpo in houston tx iviozndwt2n,0
901089460187738112,warning    warning    psa from mr  bow tie shiny shoes heaux listen up,warning warning psa from mr bow tie shiny shoes heaux listen up,warning warning psa from mr bow tie shiny shoe heaux listen up,warn warn psa from mr bow tie shini shoe heaux listen up,0
901089311029948416,fantastic weather aggregator   mike s spaghetti models,fantastic weather aggregator mike s spaghetti models,fantastic weather aggregator mike s spaghetti model,fantast weather aggreg mike s spaghetti model,0
901089070293540865,i love this makeover that i did on this beautiful mother  her daughter was getting married and,i love this makeover that i did on this beautiful mother her daughter was getting married and,i love this makeover that i did on this beautiful mother her daughter wa getting married and,i love thi makeov that i did on thi beauti mother her daughter wa get marri and,0
901087906017574912,see a vi ual tour of one of our newest  listings 9327 reagan meadow court  houston  tx  d0wy0bqxm3,see a vi ual tour of one of our newest listings 9327 reagan meadow court houston tx d0wy0bqxm3,see a vi ual tour of one of our newest listing 9327 reagan meadow court houston tx d0wy0bqxm3,see a vi ual tour of one of our newest list 9327 reagan meadow court houston tx d0wy0bqxm3,0
901087786106851329,hurricaneharvey be safe and don t misjudge standing water  sandbag and board up windows where,hurricaneharvey be safe and don t misjudge standing water sandbag and board up windows where,hurricaneharvey be safe and don t misjudge standing water sandbag and board up window where,hurricaneharvey be safe and don t misjudg stand water sandbag and board up window where,1
901087729085288449,harvey is pushing up to get ready      i m so grateful my hea  was fixed on what it means to,harvey is pushing up to get ready i m so grateful my hea was fixed on what it means to,harvey is pushing up to get ready i m so grateful my hea wa fixed on what it mean to,harvey is push up to get readi i m so grate my hea wa fix on what it mean to,0
901087643139702784,tipoftheday brush your lashes daily to keep them looking bomb ladies have fab u lash day,tipoftheday brush your lashes daily to keep them looking bomb ladies have fab u lash day,tipoftheday brush your lash daily to keep them looking bomb lady have fab u lash day,tipoftheday brush your lash daili to keep them look bomb ladi have fab u lash day,0
901087208903397381,16 years ago today we lost one of the most beautiful  sweetest and talented young women we have,16 years ago today we lost one of the most beautiful sweetest and talented young women we have,16 year ago today we lost one of the most beautiful sweetest and talented young woman we have,16 year ago today we lost one of the most beauti sweetest and talent young women we have,0
901087094151532546,yes we will be closed until fu her notice   be safe out there texas    world famous texas,yes we will be closed until fu her notice be safe out there texas world famous texas,yes we will be closed until fu her notice be safe out there texas world famous texas,ye we will be close until fu her notic be safe out there texa world famou texa,0
901086446135783424,just posted a photo  westside  houston  texas,just posted a photo westside houston texas,just posted a photo westside houston texas,just post a photo westsid houston texa,0
901086258331570178,coffee   couldn t look at new models they are preppin for harvey but they did have coffee  f9xj3jlebop,coffee couldn t look at new models they are preppin for harvey but they did have coffee f9xj3jlebop,coffee couldn t look at new model they are preppin for harvey but they did have coffee f9xj3jlebop,coffe couldn t look at new model they are preppin for harvey but they did have coffe f9xj3jlebop,0
901086098557980674,accident cleared in  no hside on 610 n lp wb before ella  stop and go traffic back to n  main  delay of 7 mins  traffic,accident cleared in no hside on 610 n lp wb before ella stop and go traffic back to n main delay of 7 mins traffic,accident cleared in no hside on 610 n lp wb before ella stop and go traffic back to n main delay of 7 min traffic,accid clear in no hside on 610 n lp wb befor ella stop and go traffic back to n main delay of 7 min traffic,0
901086065875865602,attention  in respect to all the twin and flooding  texasbodya  will be closed until further,attention in respect to all the twin and flooding texasbodya will be closed until further,attention in respect to all the twin and flooding texasbodya will be closed until further,attent in respect to all the twin and flood texasbodya will be close until further,2
901086062239514624,y dijeron que s lo era un poco de lluvia     harvey  uracan  houston  texas,y dijeron que s lo era un poco de lluvia harvey uracan houston texas,y dijeron que s lo era un poco de lluvia harvey uracan houston texas,y dijeron que s lo era un poco de lluvia harvey uracan houston texa,0
901086009273847810,stay safe in hurricane harvey houston people  i know this has nothing to do with the,stay safe in hurricane harvey houston people i know this has nothing to do with the,stay safe in hurricane harvey houston people i know this ha nothing to do with the,stay safe in hurrican harvey houston peopl i know thi ha noth to do with the,2
901085958157746177,just posted a photo  westside  houston  texas,just posted a photo westside houston texas,just posted a photo westside houston texas,just post a photo westsid houston texa,0
901085511527276544,a lot of women suffer from alopecia  there s always a solution   e in for a consultation,a lot of women suffer from alopecia there s always a solution e in for a consultation,a lot of woman suffer from alopecia there s always a solution e in for a consultation,a lot of women suffer from alopecia there s alway a solut e in for a consult,0
901085498818547712,just posted a photo  westside  houston  texas,just posted a photo westside houston texas,just posted a photo westside houston texas,just post a photo westsid houston texa,0
901085368681889792,google  ballin  yung herc and steam from your favorite source  50,google ballin yung herc and steam from your favorite source 50,google ballin yung herc and steam from your favorite source 50,googl ballin yung herc and steam from your favorit sourc 50,0
901085056147611648,just posted a photo  westside  houston  texas,just posted a photo westside houston texas,just posted a photo westside houston texas,just post a photo westsid houston texa,0
901084723925200896,when you look at this picture what do you see  westside  houston  texas,when you look at this picture what do you see westside houston texas,when you look at this picture what do you see westside houston texas,when you look at thi pictur what do you see westsid houston texa,0
901084639309303808,a classic haircut never goes out of style  rock on   barber  classichaircut  picoftheday,a classic haircut never goes out of style rock on barber classichaircut picoftheday,a classic haircut never go out of style rock on barber classichaircut picoftheday,a classic haircut never goe out of style rock on barber classichaircut picoftheday,0
901084306113667072,the pa y not stopping     hurricaneharveykickback tonight  epic22lounge  5 hurricane day,the pa y not stopping hurricaneharveykickback tonight epic22lounge 5 hurricane day,the pa y not stopping hurricaneharveykickback tonight epic22lounge 5 hurricane day,the pa y not stop hurricaneharveykickback tonight epic22loung 5 hurrican day,2
901084056472956928,accident repo ed in  nwside on 290 nw fwy outbound at 43rd  stop and go traffic back to the w lp  delay of 10 mins  traffic,accident repo ed in nwside on 290 nw fwy outbound at 43rd stop and go traffic back to the w lp delay of 10 mins traffic,accident repo ed in nwside on 290 nw fwy outbound at 43rd stop and go traffic back to the w lp delay of 10 min traffic,accid repo ed in nwside on 290 nw fwi outbound at 43rd stop and go traffic back to the w lp delay of 10 min traffic,0
901083969709420544,behindthescenes bbbutchers with the pr boutique stylishly showcasing the stunning  emerald,behindthescenes bbbutchers with the pr boutique stylishly showcasing the stunning emerald,behindthescenes bbbutchers with the pr boutique stylishly showcasing the stunning emerald,behindthescen bbbutcher with the pr boutiqu stylishli showcas the stun emerald,0
901083897877991426,terkadang saya merasa kalo di dunia ini ga ada yg namanya,terkadang saya merasa kalo di dunia ini ga ada yg namanya,terkadang saya merasa kalo di dunia ini ga ada yg namanya,terkadang saya merasa kalo di dunia ini ga ada yg namanya,0
901083880202969093,i m dying  buyallthealcohol  hurricaneharvey  gulfcoastweather  lomax  texas,i m dying buyallthealcohol hurricaneharvey gulfcoastweather lomax texas,i m dying buyallthealcohol hurricaneharvey gulfcoastweather lomax texas,i m die buyallthealcohol hurricaneharvey gulfcoastweath lomax texa,0
901083828072189952,just posted a photo  westside  houston  texas,just posted a photo westside houston texas,just posted a photo westside houston texas,just post a photo westsid houston texa,0
901083686400962561,google it   press play  buy it   suppo  the movement where you,google it press play buy it suppo the movement where you,google it press play buy it suppo the movement where you,googl it press play buy it suppo the movement where you,0
901083299405279232,gwala gap  i do this fir you   videoshoot  cinelens  houstonstreetkings  director,gwala gap i do this fir you videoshoot cinelens houstonstreetkings director,gwala gap i do this fir you videoshoot cinelens houstonstreetkings director,gwala gap i do thi fir you videoshoot cinelen houstonstreetk director,0
901082974766198789,helping film some stuff today   setlife  starnolds  rainyday  saint arnold brewing  pany,helping film some stuff today setlife starnolds rainyday saint arnold brewing pany,helping film some stuff today setlife starnolds rainyday saint arnold brewing pany,help film some stuff today setlif starnold rainyday saint arnold brew pani,0
901082944252542976,set the tone w  one of our amazing candles  sometimes you just have to ignite your own fire,set the tone w one of our amazing candles sometimes you just have to ignite your own fire,set the tone w one of our amazing candle sometimes you just have to ignite your own fire,set the tone w one of our amaz candl sometim you just have to ignit your own fire,0
901082907724226561,see a vi ual tour of one of our newest  listings 3427 louvre  houston  tx  xvncux8dzh,see a vi ual tour of one of our newest listings 3427 louvre houston tx xvncux8dzh,see a vi ual tour of one of our newest listing 3427 louvre houston tx xvncux8dzh,see a vi ual tour of one of our newest list 3427 louvr houston tx xvncux8dzh,0
901082785150009344,any nigga i know from houston in vegas and i see u  u better show me some love  cuz i m,any nigga i know from houston in vegas and i see u u better show me some love cuz i m,any nigga i know from houston in vega and i see u u better show me some love cuz i m,ani nigga i know from houston in vega and i see u u better show me some love cuz i m,0
