,id,username,date,text,hashtags,geo,type
617,901464743755472897,martin_tzoc,2017-08-26 15:21:57+00:00,Hi guys good morning estamos viendo Telemundo news en roku att. La directiva Centro Cristiano la… https://www.instagram.com/p/BYQwa9kA_OO/,,,official
618,901464616215207936,egross,2017-08-26 15:21:27+00:00,"Affects of the hurricane where we are, so far. If we keep getting… https://www.instagram.com/p/BYQwgRPAXFH2FevjWshw9HYYUWVOeaOWV4yN940/ …",,,official
619,901464586418892801,martin_tzoc,2017-08-26 15:21:20+00:00,Hi guys good morning estamos viendo Telemundo news en roku att. La directiva Centro Cristiano la… https://www.instagram.com/p/BYQwa9kA_OO/,,,official
620,901463930396184576,LadyCrochet,2017-08-26 15:18:44+00:00,#BONNERBROS. #NRG. #TBWE. #LadyCrochet. #GALLERIA77063. #YOURCROCHETDESIGNER. #crochetcreator.… https://www.instagram.com/p/BYQwMJAARJy/,#BONNERBROS #NRG #TBWE #LadyCrochet #GALLERIA77063 #YOURCROCHETDESIGNER #crochetcreator,,official
621,901463543228321792,JBsOutlawSaloon,2017-08-26 15:17:11+00:00,"Every Saturday night at the all new ""Johnny B's Outlaw Saloon"" !!! We've got $1.50 Drafts and… https://www.instagram.com/p/BYQwAbQHNtm/",,,official
622,901462525581111297,Gamer74360,2017-08-26 15:13:09+00:00,"Me right now @Northeast Houston, Houston, Texas https://www.instagram.com/p/BYQviVcnfBt/",,,official
623,901462407805104128,rastamma,2017-08-26 15:12:41+00:00,"Some citrus so I don't get scurvy. #HurricaneHarvey @Houston, Texas https://www.instagram.com/p/BYQvfoZBhgO/",#HurricaneHarvey,,official
624,901462038039408640,el_dontx,2017-08-26 15:11:12+00:00,Phones are ringing like crazy! Yes! 24 hour fitness on Fairmont is OPEN! Only classes and… https://www.instagram.com/p/BYQvVAmlbin/,,,official
625,901461926735040512,rachparker,2017-08-26 15:10:46+00:00,Stepped out to run an errand -- it's like the opening scene of a zombie flick. #hurricaneharvey… https://www.instagram.com/p/BYQvR3MgIUz/,#hurricaneharvey,,official
626,901461915339280387,laranamara,2017-08-26 15:10:43+00:00,"I'm at Tacos la Bala in Houston, TXhttps://www.swarmapp.com/c/0DcZKbu5PWO",,,official
627,901461878181814272,LadyCrochet,2017-08-26 15:10:34+00:00,Lady Crochet & Geneice! My Personal Assistant is invaluable to me! Thank you Jesus! #godsent @… https://www.instagram.com/p/BYQvQOmgC5D/,#godsent,,official
628,901461819050532864,realtalkjunkies,2017-08-26 15:10:20+00:00,"Proud listening to Mayor Sylvester Turner making Houstonians feel safe and saying they’re looking out for low income, homeless and seniors",,,official
629,901460711049658368,ocuellar10,2017-08-26 15:05:56+00:00,Great for my wallet Not so great for my waistline!! #htown #hurricaneharvey #alwayshungry… https://www.instagram.com/p/BYQuulOH0_J/,#htown #hurricaneharvey #alwayshungry,,official
630,901460521660141568,bzygo,2017-08-26 15:05:11+00:00,"Don't look directly at Hurricane Harvey @Alief, Houston https://www.instagram.com/p/BYQum9ehIDj/",,,official
631,901460124572798976,sophianicolee_,2017-08-26 15:03:36+00:00,"Good morning friends, let's talk BODY RECOMPOSITION May 25, 2017 August, 2017 I'm about ~127… https://www.instagram.com/p/BYQuc7zlJ3O/",,,official
632,901460041475252224,absolutrunnr,2017-08-26 15:03:16+00:00,It's not raining right now in Upper Kirby. The clouds are part of the outer-band of Harvey… https://www.instagram.com/p/BYQuXEbHi3c/,,,official
633,901459980502650880,Millk_ChocoLate,2017-08-26 15:03:02+00:00,Just posted a photo @Houston/N https://www.instagram.com/p/BYQuZOShINeZsj-uOT-A5xOAhHxdkQ9sHgAtec0/ …,,,official
634,901459738277421061,AtomicLabRat,2017-08-26 15:02:04+00:00,1960s Bulova Accutron Spaceview at the 2017 All Texas Chapters Regional. Very lightly… https://www.instagram.com/p/BYQuR_wFlFY/,,,official
635,901459655758561286,GallerLindaRuth,2017-08-26 15:01:44+00:00,Super ER team! Nobody gets to go home because Hurricane Harvey is out and about!!! As long as… https://www.instagram.com/p/BYQuO_xBQ5x/,,,official
636,901459532924289025,BLifeWestU,2017-08-26 15:01:15+00:00,Blogging for Profits Series Part 6: 6 Surefire Ways to Make Money From Your Blog http://bubly.us/aIRR,,,official
637,901459188332802048,AtomicLabRat,2017-08-26 14:59:53+00:00,1920s Art Deco Gustav Becker coffin clock. 2017 All Texas Chapters Regional. #watches… https://www.instagram.com/p/BYQt5xflFpa/,#watches,,official
638,901459012377554946,RonaldCGreen,2017-08-26 14:59:11+00:00,"Happy Saturday! Hold on...this too shall pass. #BeGreatAnyway #TeamGreen @Third Ward, Houston https://www.instagram.com/p/BYQt8E4Ab-C/",#BeGreatAnyway #TeamGreen,,official
639,901459010372722689,SummerwoodBL,2017-08-26 14:59:11+00:00,Blogging for Profits Series Part 6: 6 Surefire Ways to Make Money From Your Blog http://bubly.us/aIR9,,,official
640,901458829858267136,TotalTrafficHOU,2017-08-26 14:58:27+00:00,High water on frontage rd in #JerseyVillage on 290 NW Fwy Frontage rd Outbound at W Rd #traffic http://bit.ly/17hsIjn,#JerseyVillage #traffic,,official
641,901458664451706881,SouthHoustonBL,2017-08-26 14:57:48+00:00,Blogging for Profits Series Part 6: 6 Surefire Ways to Make Money From Your Blog http://bubly.us/aIQx,,,official
642,901458578627756032,BLifeSheldon,2017-08-26 14:57:28+00:00,Blogging for Profits Series Part 6: 6 Surefire Ways to Make Money From Your Blog http://bubly.us/aIQw,,,official
643,901458541583532033,AtomicLabRat,2017-08-26 14:57:19+00:00,2017 All Texas Chapters Regional. No one showed. Very lightly attended. #watches… https://www.instagram.com/p/BYQtutzFl8D/,#watches,,official
644,901458457471180801,ocuellar10,2017-08-26 14:56:59+00:00,Just posted a photo @Downtown Houston https://www.instagram.com/p/BYQtsx6nFPk/,,,official
645,901458315837878277,BLifeRiverOaks,2017-08-26 14:56:25+00:00,Blogging for Profits Series Part 6: 6 Surefire Ways to Make Money From Your Blog http://bubly.us/aIQo,,,official
646,901458227870789633,MyAmericanRoof,2017-08-26 14:56:04+00:00,Current conditions on Harvey. Don't drive into standing water #harvey #hurricaneharvey… https://www.instagram.com/p/BYQtl5VgG_O/,#harvey #hurricaneharvey,,official
647,901458142856400896,BLifePineyPoint,2017-08-26 14:55:44+00:00,Blogging for Profits Series Part 6: 6 Surefire Ways to Make Money From Your Blog http://bubly.us/aIQk,,,official
648,901458142634160129,cryswallbaby,2017-08-26 14:55:44+00:00,Hurricane Party this morning @mixfitzstudio! Come #leaveitonthefloor with me 11am! Be safe out… https://www.instagram.com/p/BYQtj8OnlEA/,#leaveitonthefloor,,official
649,901457886202744833,BLifeMontrose,2017-08-26 14:54:43+00:00,Blogging for Profits Series Part 6: 6 Surefire Ways to Make Money From Your Blog http://bubly.us/aIQf,,,official
650,901457604148248577,PastorJ_HigherD,2017-08-26 14:53:35+00:00,Our physical location worship experiences are cancelled at our SW and Katy location this… https://www.instagram.com/p/BYQtUEin-RU/,,,official
651,901457540126584832,BLifeMemorial,2017-08-26 14:53:20+00:00,Blogging for Profits Series Part 6: 6 Surefire Ways to Make Money From Your Blog http://bubly.us/aIQX,,,official
652,901457458698256384,ocuellar10,2017-08-26 14:53:01+00:00,Luv it!! @Downtown Houston https://www.instagram.com/p/BYQtPuBnP9S/,,,official
653,901457413865394176,jayjay0123,2017-08-26 14:52:50+00:00,Get at me they are going 2 foe a 1$cum on trying to get it on… https://www.instagram.com/p/BYQtKp6D8oFQ4qBnAHqTkhAU3uj8O3GVr6l3wY0/ …,,,official
654,901457213654487041,jayjay0123,2017-08-26 14:52:02+00:00,"Point blank period frr frr fuck a hater @Third Ward, Houston https://www.instagram.com/p/BYQtIXFDOosiKjKuIoxnOnmnu8dYbOiiwvdZQA0/ …",,,official
655,901456672291532800,JacintoCityBL,2017-08-26 14:49:53+00:00,Blogging for Profits Series Part 6: 6 Surefire Ways to Make Money From Your Blog http://bubly.us/aIQB,,,official
656,901456554930692098,OrigenYTradicio,2017-08-26 14:49:25+00:00,Hoy queremos felicitar a nuestro compañero y Arpista del Mariachi Origen y Tradición Arpa Rojas… https://www.instagram.com/p/BYQs0lUnNII/,,,official
657,901456465608802304,alhllwy,2017-08-26 14:49:04+00:00,"I'm at Peet's Coffee & Tea in Houston, TXhttps://www.swarmapp.com/c/cNTT5xKDQu1",,,official
658,901456397824667649,alhllwy,2017-08-26 14:48:48+00:00,"I'm at Terminal B - @united in Houston, TXhttps://www.swarmapp.com/c/aVD3fiFmTYd",,,official
659,901456325800071168,BLifeGalenaPark,2017-08-26 14:48:30+00:00,Blogging for Profits Series Part 6: 6 Surefire Ways to Make Money From Your Blog http://bubly.us/aIQ1,,,official
660,901456226541854720,_LeSeul,2017-08-26 14:48:07+00:00,"Dear Harvey. . @Houston, Texas https://www.instagram.com/p/BYQsr1Jg_kYvzTqR3P53lVusvUphPtI7k3zxPc0/ …",,,official
661,901456225862389761,higherdchurch,2017-08-26 14:48:07+00:00,Our physical location worship experiences are cancelled at our SW and Katy location this… https://www.instagram.com/p/BYQsqwtBgYG/,,,official
662,901456170422075393,VintageContessa,2017-08-26 14:47:53+00:00,"Sending thoughts, #prayers and #love to everyone in the wake of #hurricaneharvey especially… https://www.instagram.com/p/BYQslNfAsMS/",#prayers #love #hurricaneharvey,,official
663,901456154534043648,BLifeFresno,2017-08-26 14:47:50+00:00,Blogging for Profits Series Part 6: 6 Surefire Ways to Make Money From Your Blog http://bubly.us/aIPw,,,official
664,901455808747241472,BLifeDeerPark,2017-08-26 14:46:27+00:00,Blogging for Profits Series Part 6: 6 Surefire Ways to Make Money From Your Blog http://bubly.us/aIPl,,,official
665,901455807035957253,BLifeDeerPark,2017-08-26 14:46:27+00:00,"1124 Ellen Dr, Deer Park, TX 77536, $150,000 3 beds, 2 baths http://bubly.us/aIPk",,,official
666,901455584448266240,McubedCosplay,2017-08-26 14:45:34+00:00,"""Sometimes all you need is a little splash of color"" : @theleilalewis Lingerie:… https://www.instagram.com/p/BYQsZH-luDr/",,,official
667,901455539561013248,TotalTrafficHOU,2017-08-26 14:45:23+00:00,High water on frontage rd in #Houston on 69 Eastex Fwy Frontage rd Inbound at Aldine Mail Rte #traffic http://bit.ly/17hsIjn,#Houston #traffic,,official
668,901455363601567745,ai3mcgrady,2017-08-26 14:44:41+00:00,Hurricane Harvey @Fall Creek https://www.instagram.com/p/BYQsLLPlowF/,,,official
669,901455215592976386,haileyheck,2017-08-26 14:44:06+00:00,"Don't worry! Hurricane Harvey got nothing on us!! #hurricane #harvey #dogsofinstagram @Houston,… https://www.instagram.com/p/BYQsObNggpv/",#hurricane #harvey #dogsofinstagram,,official
670,901455185846849536,UEscissorhands,2017-08-26 14:43:59+00:00,If you're looking for something to watch during this storm... Then check out my full video of… https://www.instagram.com/p/BYQsNmjA95F/,,,official
671,901455001469558785,BrooksandDavis,2017-08-26 14:43:15+00:00,"#PrayforHouston #PrayforTexas @Pearland, Texas https://www.instagram.com/p/BYQsHsJgOlf/",#PrayforHouston #PrayforTexas,,official
672,901454948407418880,BLifeAlief,2017-08-26 14:43:02+00:00,Blogging for Profits Series Part 6: 6 Surefire Ways to Make Money From Your Blog http://bubly.us/aIPK,,,official
673,901454862717771776,BLifeAldine,2017-08-26 14:42:42+00:00,Blogging for Profits Series Part 6: 6 Surefire Ways to Make Money From Your Blog http://bubly.us/aIPG,,,official
674,901454861182660611,BLifeAftonOaks,2017-08-26 14:42:41+00:00,Blogging for Profits Series Part 6: 6 Surefire Ways to Make Money From Your Blog http://bubly.us/aIPD,,,official
675,901454775107149825,BLifeAcresHomes,2017-08-26 14:42:21+00:00,Blogging for Profits Series Part 6: 6 Surefire Ways to Make Money From Your Blog http://bubly.us/aIPC,,,official
676,901454747072421889,USGS_TexasRain,2017-08-26 14:42:14+00:00,"#USGS08072000 - Lk Houston nr Sheldon, TX Heavy Rain (1.96 in/hr) over the last 15 minutes http://waterdata.usgs.gov/tx/nwis/uv?site_no=08072000&t=20170826093000 …",#USGS08072000,,official
677,901454746849951744,BNICE_PHG,2017-08-26 14:42:14+00:00,#RAREPAIRALERT AIN'T GONNA LET A LIL RAIN STOP THE WEEKEND $$$... #AJ4s KILLIN EM!!!… https://www.instagram.com/p/BYQsA69BFpV/,#RAREPAIRALERT #AJ4s,,official
678,901454528351944704,idreaminstereo,2017-08-26 14:41:22+00:00,"a few days of this will be no bueno @Newport, Crosby, Texas https://www.instagram.com/p/BYQr1vMFEnI/",,,official
679,901454215134011392,NailsLavish,2017-08-26 14:40:07+00:00,"Due to Hurricane Harvey, we will open at 1 pm today Saturday 08/26/2017. Please call us at… https://www.instagram.com/p/BYQrxdilWiD/",,,official
680,901454072632528897,TotalTrafficHOU,2017-08-26 14:39:33+00:00,High water on the frontage rd. in #Houston on I-45 N Fwy Frontage rd Inbound before E Tidwell Rd #traffic http://bit.ly/17hsIjn,#Houston #traffic,,official
681,901453863953223685,AprilLButcher,2017-08-26 14:38:44+00:00,I am so thankful for the last 4 weeks of my life! I have learned so much about myself and… https://www.instagram.com/p/BYQrlwGHwI_/,,,official
682,901453270513852418,o0FlanK0o,2017-08-26 14:36:22+00:00,I got jokes! #hurricaneharvey #hurricane #harvey #power #netflix #jokes #goodmorningpost… https://www.instagram.com/p/BYQrV5snyeV/,#hurricaneharvey #hurricane #harvey #power #netflix #jokes #goodmorningpost,,official
683,901453197088362496,syncynlyn_cyndi,2017-08-26 14:36:05+00:00,"Still have to walk the baby! #harvey #yorkiepoo #gotsoaked @Houston, Texas https://www.instagram.com/p/BYQrTiyFMQW/",#harvey #yorkiepoo #gotsoaked,,official
684,901452528742789120,marconestor10,2017-08-26 14:33:25+00:00,I'm going home ・・・ Outfit of the day! Hangover chic! #mensfashion #manfashion #guysfashion… https://www.instagram.com/p/BYQq_cWABtL/,#mensfashion #manfashion #guysfashion,,official
685,901451972124999680,itzmeyvonne,2017-08-26 14:31:12+00:00,"Make sure you are prepared, I hope everyone is safe and okay. #hurricanharvey #hurricane #harvey… https://www.instagram.com/p/BYQqwSUBjvK/",#hurricanharvey #hurricane #harvey,,official
686,901451792386592769,Urbanpaths,2017-08-26 14:30:30+00:00,"Walked the dogs, checked on Buffalo Bayou, saw a toad laying eggs in a puddle. Now coffee.… https://www.instagram.com/p/BYQqqathvqj/",,,official
687,901451650132459520,JWWTHIRD,2017-08-26 14:29:56+00:00,Finishing this great box of five year old Juan Lopez Seleccion #2s (favorite regular production… https://www.instagram.com/p/BYQqmgKg-9k/,#2s,,official
688,901451197327998976,guttulus,2017-08-26 14:28:08+00:00,My foster dog attempts to escape during hurricane Harvey. #dog #dogs #l4l #ff #houston #pet… https://www.instagram.com/p/BYQqV3PHPWZ/,#dog #dogs #l4l #ff #houston #pet,,official
689,901451114410786816,Iamtharealtre,2017-08-26 14:27:48+00:00,"Its not Starbucks, but it will do. #McCafe @Westside, Houston, Texas https://www.instagram.com/p/BYQqXT4B5j0/",#McCafe,,official
690,901450671676731394,tonyazzaro,2017-08-26 14:26:02+00:00,Thoughts are prayers to all of those in my Lone Star State. #PrayForTexas #HurricaneHarvey @… https://www.instagram.com/p/BYQqI-rgoLe/,#PrayForTexas #HurricaneHarvey,,official
691,901450589439184896,Riceboxed,2017-08-26 14:25:43+00:00,"**Updated schedule for today Saturday 8/26.** We will be closing doors due to road conditions,… https://www.instagram.com/p/BYQqD8BB4zE/",,,official
692,901450226581606400,peacelveaggie,2017-08-26 14:24:16+00:00,Well we may still be waiting for rain from #HurricaneHarvey I would… https://www.instagram.com/p/BYQp5poh2WNgV6Yqwo8dfhnfOs1VUuNzx_C8bA0/ …,#HurricaneHarvey,,official
693,901450181127831552,bgintx,2017-08-26 14:24:05+00:00,Lots of rain throughout the night and the electricity flicked off… https://www.instagram.com/p/BYQp5TnhK23ossftE5NsZvlXXUrjYV7rklTQAo0/ …,,,official
694,901449876755681280,HayMerchant,2017-08-26 14:22:53+00:00,"We're closed for brunch, but will open at 3pm. Stay safe! @The Hay Merchant https://www.instagram.com/p/BYQpzNqgLvW/",,,official
695,901449757641461760,mr_trixt3r,2017-08-26 14:22:25+00:00,#MinistryOfMusic #TheLIBERATIONStation. #TheSoundManipulators. #TheSoundDesigners. … https://www.instagram.com/p/BYQpvzNhafn/,#MinistryOfMusic #TheLIBERATIONStation #TheSoundManipulators #TheSoundDesigners,,official
696,901449749362085889,ColinYarbrough,2017-08-26 14:22:23+00:00,Break in the storm. Staying safe and (mostly) dry. #harvey… https://www.instagram.com/p/BYQpvJcAsp-GF8lUHkwouYrRd0PAWPF9_fxs4k0/ …,#harvey,,official
697,901449705565155329,ragupesto,2017-08-26 14:22:12+00:00,tell us what is the perfect taste for you..? #houstonfood #houstofoodie #houstoneats #houston… https://www.instagram.com/p/BYQposugdoI/,#houstonfood #houstofoodie #houstoneats #houston,,official
698,901449282351321088,dannyela_garcya,2017-08-26 14:20:31+00:00,Delicioso snack saludable para empezar el día ! When you stay… https://www.instagram.com/p/BYQpffgB_Fo08MnYP_2ZY1CMru-0EJjkjrmF3M0/ …,,,official
699,901449173844631554,alisoncook,2017-08-26 14:20:05+00:00,I am the grateful owner of the very last pack of AAA batteries from the S Wayside Walmart. @… https://www.instagram.com/p/BYQpaXFhtCe/,,,official
700,901449103015632896,TotalTrafficHOU,2017-08-26 14:19:48+00:00,High water on frontage rd in #Houston on 69 Eastex Fwy Frontage rd NB at Aldine Mail Rte #traffic http://bit.ly/17hsIjn,#Houston #traffic,,official
701,901449058451161093,LonestarCryo,2017-08-26 14:19:38+00:00,Closed today IG! Tomorrow is TBD. Stay safe and don't do anything ezzellrobert & I wouldn't… https://www.instagram.com/p/BYQjAL0ATkC/,,,official
702,901448466228011008,HelmRed,2017-08-26 14:17:17+00:00,Riding the storm out with my rabbit friend @Ben Taub General Hospital https://www.instagram.com/p/BYQobu7hwxO/,,,official
703,901448159242727428,alhllwy,2017-08-26 14:16:03+00:00,"I was at George Bush Intercontinental Airport in Houston, TXhttps://www.swarmapp.com/alhllwy/checkin/59a17f52acb00b48c527d6bc?s=aKgqeAUhK7ipfeLqMLM61YkmEGE&ref=tw …",,,official
704,901448141869809665,PetiteSweetsHTX,2017-08-26 14:15:59+00:00,For those braving this weather!! #hurricaneharvey #prepfood #sweets @Petite Sweets https://www.instagram.com/p/BYQo_3NAF8E/,#hurricaneharvey #prepfood #sweets,,official
705,901447600234037248,Jensavery24,2017-08-26 14:13:50+00:00,"""Then he got up and rebuked the winds and the waves, and it was… https://www.instagram.com/p/BYQoqBKjQLcGqzk6eB8fEHGoMzLhmAcR-Vpjhs0/ …",,,official
706,901447238227984388,jellius,2017-08-26 14:12:24+00:00,"Mom's having surgery. Please Leo her in your prayers. (@Houston Methodist Hospital - @hmdigitalmkt in Houston, TX) https://www.swarmapp.com/c/6KpUBWtEOud",,,official
707,901442492956110848,TotalTrafficHOU,2017-08-26 13:53:32+00:00,High water on the frontage rd in #EastSide on I-10 E Fwy Frontage rd. EB at Federal #traffic http://bit.ly/17hsIjn,#EastSide #traffic,,official
708,901442092928565248,TotalTrafficHOU,2017-08-26 13:51:57+00:00,High water on the frontage rd. in #EastSide on I-10 E Fwy Frontage rd. WB at Federal #traffic http://bit.ly/17hsIjn,#EastSide #traffic,,official
709,901441299655643136,TotalTrafficHOU,2017-08-26 13:48:48+00:00,High water across all main lanes in #NorthSide on N Sam Houston Pkwy EB after Aldine Westfeild and before Vickery Dr #traffic,#NorthSide #traffic,,official
710,901440896964669440,TotalTrafficHOU,2017-08-26 13:47:12+00:00,High water across all main lanes in #NorthSide on N Sam Houston Pkwy WB after Vickery Dr and before Aldine Westfeild #traffic,#NorthSide #traffic,,official
711,901440573638402048,_ClutchCity,2017-08-26 13:45:55+00:00,Almost forgot it's #TexansGameday,#TexansGameday,,official
712,901439931863715840,cjordanhouston,2017-08-26 13:43:22+00:00,shareacoke (Checked-in @Corner Store 926 Westheimer Rd https://qpn.io/mIna3A ) @CornerStore4U,,,official
713,901439456145797121,TotalTrafficHOU,2017-08-26 13:41:28+00:00,High water on entrance ramp in #NeSide on N Sam Houston Pkwy EB at Lee Rd #traffic http://bit.ly/17hsIjn,#NeSide #traffic,,official
714,901438275226939392,TotalTrafficHOU,2017-08-26 13:36:47+00:00,High water in #Harris on Gessner Dr. SB at US 290 #traffic http://bit.ly/17hsIjn,#Harris #traffic,,official
715,901438141734809600,TotalTrafficHOU,2017-08-26 13:36:15+00:00,High water in #Harris on Gessner Dr. NB at US 290 #traffic http://bit.ly/17hsIjn,#Harris #traffic,,official
716,901436961130414080,TotalTrafficHOU,2017-08-26 13:31:34+00:00,High water on exit ramp in #EastSide on E Sam Houston Tollway NB at Pasadena Blvd #traffic http://bit.ly/17hsIjn,#EastSide #traffic,,official
717,901436567230840833,TotalTrafficHOU,2017-08-26 13:30:00+00:00,High water on exit ramp in #EastSide on E Sam Houston Tollway SB at Pasadena Blvd #traffic http://bit.ly/17hsIjn,#EastSide #traffic,,official
718,901435526573633536,TotalTrafficHOU,2017-08-26 13:25:52+00:00,High water. all mainlanes blocked. in #EastSide on E Sam Houston Tollway SB after Pasadena Blvd and before Fairmont Pkwy #traffic,#EastSide #traffic,,official
719,901435354686775297,djplayboi713,2017-08-26 13:25:11+00:00,"Trying to enjoy the electricity before it goes out @Northeast Houston, Houston, Texas https://www.instagram.com/p/BYQjMOpjz3q/",,,official
720,901435273913016321,cdleblanc3,2017-08-26 13:24:51+00:00,"White oak bayou near our apartment. @Jersey Village, Texas https://www.instagram.com/p/BYQjJE1AiFGQM2-_3Grny7FltheUMVhLsYmnrg0/ …",,,official
721,901435088143097856,DCtheComedian5,2017-08-26 13:24:07+00:00,We at work!!! @Southmore Post Office https://www.instagram.com/p/BYQjE6hBAC2/,,,official
722,901434694562189312,JJ_Htown,2017-08-26 13:22:33+00:00,"Getting out of Dodge #harvey (@William P @HobbyAirport in Houston, TX)https://www.swarmapp.com/c/iKnZGAFfFIW",#harvey,,official
723,901431501119782912,MrWiredUpOhBoy,2017-08-26 13:09:52+00:00,#Repost @GoDJHiC (get_repost) ・・・ NEW MUSIC ALERT Here is a good look at the AUGUST… https://www.instagram.com/p/BYQhb7HDM-s/,#Repost,,official
724,901430559133626369,wynnlyrasings,2017-08-26 13:06:07+00:00,Downtown Houston Update: It's ALL good for now. We baked a cake last night and our lights stayed… https://www.instagram.com/p/BYQhBK2AFrk/,,,official
725,901430478456205313,SugarLand_TX,2017-08-26 13:05:48+00:00,Sugar Land TX Sat Aug 26th AM Forecast: TODAY Tropical Storm Conditions TONIGHT Tropical Storm Conditions Lo 75,,,official
726,901430465718099971,SharpstownTX,2017-08-26 13:05:45+00:00,Sharpstown TX Sat Aug 26th AM Forecast: TODAY Tropical Storm Conditions Hi 81 TONIGHT Tropical Storm Conditions Lo 75,,,official
727,901430380221411328,HoustonTX_,2017-08-26 13:05:25+00:00,Houston TX Sat Aug 26th AM Forecast: TODAY Tropical Storm Conditions Hi 81 TONIGHT Tropical Storm Conditions Lo 75,,,official
728,901429120931950592,tvaldez88,2017-08-26 13:00:24+00:00,"#HurricaneHarvey #Shipleys @Southbelt - Ellington, Houston https://www.instagram.com/p/BYQgXNEFi11uWtBauLDpP33k423G1neo9chgag0/ …",#HurricaneHarvey #Shipleys,,official
729,901429018641260544,AV8PIX,2017-08-26 13:00:00+00:00,"Fire alarm in a church (@Pasadena Fire Dept. Station #8 in Pasadena, TX) https://www.swarmapp.com/c/c7RLM8sOFwt pic.twitter.com/OVRvAuuc8S",#8,,official
730,901428777011556352,lqfenty,2017-08-26 12:59:02+00:00,All weekend in this thang #hurricaneharvey #ootd #goodmorning #goodnight #mirror #instagood @… https://www.instagram.com/p/BYQgNRSHefR/,#hurricaneharvey #ootd #goodmorning #goodnight #mirror #instagood,,official
731,901428735697670145,jimmyEEE,2017-08-26 12:58:52+00:00,drains. #jimmyephotography #hurricaneharvey #stormdrain #sony #sonya7sii #sonyzeiss #sonyalpha… https://www.instagram.com/p/BYQgMDQHbKM/,#jimmyephotography #hurricaneharvey #stormdrain #sony #sonya7sii #sonyzeiss #sonyalpha,,official
732,901428494982303744,laurin_lindsey,2017-08-26 12:57:55+00:00,Quiet Saturday morning 8am. #streetlights on! #harvey #dirtyside #hurricane #dark #wet #rainy… https://www.instagram.com/p/BYQgBazFpz9/,#streetlights #harvey #dirtyside #hurricane #dark #wet #rainy,,official
733,901427181032800256,JudithLisacHome,2017-08-26 12:52:42+00:00,It really hasn't been too bad ... continues prayers ... #sandiegogirlintexas… https://www.instagram.com/p/BYQfevLF7aB/,#sandiegogirlintexas,,official
734,901427078498791424,hopheim,2017-08-26 12:52:17+00:00,Day 13- one leg kick http://www.hilaryopheim.com/pilates/2017/8/26/day-13-one-leg-kick …,,,official
735,901427004720820224,ink_n_beard281,2017-08-26 12:52:00+00:00,"We got a mini lake #HurricaneHarvey @Sugar Land, Texas https://www.instagram.com/p/BYQfZRljnjv/",#HurricaneHarvey,,official
736,901426961465081856,biglydt,2017-08-26 12:51:49+00:00,We woke up stupid early bc the power went out and it got hot....so… https://www.instagram.com/p/BYQfYUWnm8nwMqFOpVdZlqHRIyA2Z3VMhil7NI0/ …,,,official
737,901426891327807489,khobretti,2017-08-26 12:51:33+00:00,No skating this morning thanks to #hurricaneharvey but you can still listen to the playlist.… https://www.instagram.com/p/BYQfV9XgWOv/,#hurricaneharvey,,official
738,901426872323633153,fatrat282,2017-08-26 12:51:28+00:00,Just posted a photo @Studio Movie Grill https://www.instagram.com/p/BYQfVnOAVgitvcLtcVP_59PWKICnRlBdWxE0OU0/ …,,,official
739,901426316079230976,zenobia_reed,2017-08-26 12:49:16+00:00,#hurricaneharvey Mood #goodmorning #goodmorningpost #saturdaymorning #idontwanttoadult… https://www.instagram.com/p/BYQfFYHDmzR/,#hurricaneharvey #goodmorning #goodmorningpost #saturdaymorning #idontwanttoadult,,official
740,901426090811543552,hopheim,2017-08-26 12:48:22+00:00,Day 13- one leg kick http://www.wapilates.com/washington-ave-pilates-1/day-13-one-leg-kick/2017/8/26 …,,,official
741,901425924138307584,ThunderSOULFunk,2017-08-26 12:47:42+00:00,"@Fifth Ward, Houston https://www.instagram.com/p/BYQe6B4j4fl-KNuOybGDTSr6ok01crg1BgweVg0/ …",,,official
742,901425844345872384,TotalTrafficHOU,2017-08-26 12:47:23+00:00,Closed due to accident in #EastSide on E Sam Houston Pky SB after US-90 to Wallisville Rd #traffic http://bit.ly/17hsIjn,#EastSide #traffic,,official
743,901425237035765760,_ClutchCity,2017-08-26 12:44:58+00:00,Been tryna go back to sleep for an hour,,,official
