,id,username,date,text,hashtags,geo,type
2008,901090825643446272,crwesthofen,2017-08-25 14:36:08+00:00,"I believe the official term is ""bug out"". See ya #hurricaneharvey (@George Bush Intercontinental Airport)https://www.swarmapp.com/c/fTvRGxoekHM",#hurricaneharvey,,official
2009,901090825492471810,EDITHMCCLURE,2017-08-25 14:36:08+00:00,An amazing way to start my extended and forced weekend thanks to… https://www.instagram.com/p/BYOGhIwHsahOALFkxrh0EDejZ1pcxAzZqVmRYY0/ …,,,official
2010,901090764574392321,theartwerks,2017-08-25 14:35:54+00:00,I'm just going to be channeling yesterday's sunshine and positive vibes for today Please… https://www.instagram.com/p/BYOGfYyFIp_/,,,official
2011,901090746257813504,WinkWestwood,2017-08-25 14:35:50+00:00,But they're right RT @SHOTTYISMS: This publication is not owned by black people btw.https://twitter.com/theaffinitymag/status/900535973557276672 …,,,official
2012,901090400806592512,mserynn_music,2017-08-25 14:34:27+00:00,#harvey #hurricanharvey #kindermusikwithmserynn #musicwithmserynn #baytown @Music with Ms. Erynn https://www.instagram.com/p/BYOGUuqn5Wo/,#harvey #hurricanharvey #kindermusikwithmserynn #musicwithmserynn #baytown,,official
2013,901090331508256768,TotalTrafficHOU,2017-08-25 14:34:11+00:00,"All lanes blocked. in #SouthSide on Hwy 288 S Fwy Outbound after The S Sam Houston Tollway to Mchard, stopped traffic back to Almeda Genoa",#SouthSide,,official
2014,901090278798352384,caity_heap,2017-08-25 14:33:58+00:00,Meals for days Stay fueled with the quick and easy perfectfitmeals #healthyfood #food… https://www.instagram.com/p/BYOGRFpjaxO/,#healthyfood #food,,official
2015,901090065434025984,pauliepetro,2017-08-25 14:33:07+00:00,"I'm usually with Harvey Specter on this one, but Harvey the Hurricane has something else to say.… https://www.instagram.com/p/BYOGLDIg8b9/",,,official
2016,901089549866201089,cnwooldridge,2017-08-25 14:31:04+00:00,"Byeeeee! (@William P @HobbyAirport in Houston, TX)https://www.swarmapp.com/c/ivioznDWt2n",,,official
2017,901089460187738112,TrillyPolk,2017-08-25 14:30:43+00:00,Warning!!! Warning!!! PSA From Mr. Bow-Tie Shiny Shoes Heaux Listen Up… https://www.instagram.com/p/BYOF5wrBJnI/,,,official
2018,901089311029948416,highspeedphoto,2017-08-25 14:30:07+00:00,"Fantastic weather aggregator. ""Mike's Spaghetti Models"" http://spaghettimodels.com/ @J3… https://www.instagram.com/p/BYOF1Xtjw3A/",,,official
2019,901089070293540865,makeupbysheila,2017-08-25 14:29:10+00:00,I love this makeover that I did on this beautiful mother! Her daughter was getting married and… https://www.instagram.com/p/BYOFueUjOKO/,,,official
2020,901087906017574912,atKWMemorial,2017-08-25 14:24:32+00:00,See a virtual tour of one of our newest #listings 9327 Reagan Meadow Court #Houston #TX http://tour.circlepix.com/home/C933CP pic.twitter.com/d0wY0bQXm3,#listings #Houston #TX,,official
2021,901087786106851329,ILLTRILLNEIL,2017-08-25 14:24:04+00:00,#HurricaneHarvey Be safe and don't misjudge standing water. Sandbag and board up windows where… https://www.instagram.com/p/BYOFIrhhQuh/,#HurricaneHarvey,,official
2022,901087729085288449,JotinaB,2017-08-25 14:23:50+00:00,#HARVEY is pushing up to get READY! • • I'm so grateful my heart was fixed on what it means to… https://www.instagram.com/p/BYOFHLelwWt/,#HARVEY,,official
2023,901087643139702784,IamMonea2,2017-08-25 14:23:30+00:00,#tipoftheday Brush your lashes daily to keep them looking bomb ladies Have Fab-U-Lash Day… https://www.instagram.com/p/BYOFEndDuQk/,#tipoftheday,,official
2024,901087208903397381,Angiewanted,2017-08-25 14:21:46+00:00,"16 years ago today we lost one of the most beautiful, sweetest and talented young women we have… https://www.instagram.com/p/BYOE3wRnmxi/",,,official
2025,901087094151532546,texasbodyart,2017-08-25 14:21:19+00:00,Yes we will be closed until further notice . Be safe out there Texas ! @World Famous Texas… https://www.instagram.com/p/BYOEzUnlkdS/,,,official
2026,901086446135783424,tman245633,2017-08-25 14:18:44+00:00,"Just posted a photo @Westside, Houston, Texas https://www.instagram.com/p/BYOEhwUlB4s/",,,official
2027,901086258331570178,jackallenwomack,2017-08-25 14:18:00+00:00,Coffee - couldn't look at new models they are preppin for Harvey but they did have coffee https://www.swarmapp.com/c/f9xJ3jleboP,,,official
2028,901086098557980674,TotalTrafficHOU,2017-08-25 14:17:21+00:00,"Accident cleared in #NorthSide on 610 N Lp WB before Ella, stop and go traffic back to N. Main, delay of 7 mins #traffic",#NorthSide #traffic,,official
2029,901086065875865602,Mr_Inkaholik,2017-08-25 14:17:14+00:00,ATTENTION: In respect to all the twin and flooding @texasbodyart will be closed until further… https://www.instagram.com/p/BYOEWuzFP-s/,,,official
2030,901086062239514624,sandyx_17,2017-08-25 14:17:13+00:00,"Y dijeron que sólo era un poco de lluvia!!! #harvey #uracan @Houston, Texas https://www.instagram.com/p/BYOEWZADIGB/",#harvey #uracan,,official
2031,901086009273847810,jemarble,2017-08-25 14:17:00+00:00,Stay safe in hurricane Harvey Houston people. I know this has nothing to do with the… https://www.instagram.com/p/BYOEVV0lJHY/,,,official
2032,901085958157746177,tman245633,2017-08-25 14:16:48+00:00,"Just posted a photo @Westside, Houston, Texas https://www.instagram.com/p/BYOET8VFEhj/",,,official
2033,901085511527276544,ShunStyles,2017-08-25 14:15:01+00:00,A lot of women suffer from alopecia. There's always a solution. Come in for a consultation.… https://www.instagram.com/p/BYOEGuqAmb7/,,,official
2034,901085498818547712,tman245633,2017-08-25 14:14:58+00:00,"Just posted a photo @Westside, Houston, Texas https://www.instagram.com/p/BYOEGk8lZXb/",,,official
2035,901085368681889792,TonyWrecks,2017-08-25 14:14:27+00:00,"Google ""Ballin"" Yung Herc and steam from your favorite source..50%… https://www.instagram.com/p/BYOECV3jgH_7vgFKmKkZRFNQ78blIOPiqJO8Dg0/ …",,,official
2036,901085056147611648,tman245633,2017-08-25 14:13:13+00:00,"Just posted a photo @Westside, Houston, Texas https://www.instagram.com/p/BYOD5cGlcV8/",,,official
2037,901084723925200896,tman245633,2017-08-25 14:11:54+00:00,"When you look at this picture what do YOU see @Westside, Houston, Texas https://www.instagram.com/p/BYODqxdFteN/",,,official
2038,901084639309303808,Edmanvoice,2017-08-25 14:11:34+00:00,A classic haircut never goes out of style. Rock on! #barber #classichaircut #picoftheday… https://www.instagram.com/p/BYODtNpA-UK/,#barber #classichaircut #picoftheday,,official
2039,901084306113667072,gvolounge713,2017-08-25 14:10:14+00:00,The party not stopping!!! #HurricaneHarveyKickback TONIGHT @epic22lounge $5 HURRICANE DAY &… https://www.instagram.com/p/BYODjSpnGwp/,#HurricaneHarveyKickback,,official
2040,901084056472956928,TotalTrafficHOU,2017-08-25 14:09:15+00:00,"Accident reported in #NwSide on 290 NW Fwy Outbound at 43rd, stop and go traffic back to The W Lp, delay of 10 mins #traffic",#NwSide #traffic,,official
2041,901083969709420544,VintageContessa,2017-08-25 14:08:54+00:00,#behindthescenes bbbutchers with the PR Boutique stylishly showcasing the stunning #emerald… https://www.instagram.com/p/BYODZzygb9B/,#behindthescenes #emerald,,official
2042,901083897877991426,niqhe,2017-08-25 14:08:37+00:00,Terkadang saya merasa kalo di dunia ini ga ada yg namanya… https://www.instagram.com/p/BYODXkKgDM509WirywpeJP4RUUWNXyZW_GlozQ0/ …,,,official
2043,901083880202969093,April_flowers87,2017-08-25 14:08:33+00:00,"I'm dying #buyallthealcohol #hurricaneharvey #gulfcoastweather @Lomax, Texas https://www.instagram.com/p/BYODXELB40p/",#buyallthealcohol #hurricaneharvey #gulfcoastweather,,official
2044,901083828072189952,tman245633,2017-08-25 14:08:20+00:00,"Just posted a photo @Westside, Houston, Texas https://www.instagram.com/p/BYODV6alm9I/",,,official
2045,901083686400962561,TonyWrecks,2017-08-25 14:07:46+00:00,Google it...press play..buy it...support the movement where you… https://www.instagram.com/p/BYODRd7jg7CMqJWJrk-o8rmkyBgzPS7NgrhPKY0/ …,,,official
2046,901083299405279232,Gridiron_Ron,2017-08-25 14:06:14+00:00,"@Gwala_Gap ""I Do This Fir You"" #videoshoot #cinelens #houstonstreetkings #director… https://www.instagram.com/p/BYODGJPjI_a/",#videoshoot #cinelens #houstonstreetkings #director,,official
2047,901082974766198789,BrianMakesJokes,2017-08-25 14:04:57+00:00,Helping film some stuff today. #setlife #starnolds #rainyday @Saint Arnold Brewing Company https://www.instagram.com/p/BYOC8y1ggSE/,#setlife #starnolds #rainyday,,official
2048,901082944252542976,_heavenlyaroma,2017-08-25 14:04:49+00:00,set the tone w| one of our amazing candles *sometimes you just have to ignite your own fire*… https://www.instagram.com/p/BYOC761gXZ_/,,,official
2049,901082907724226561,atKWMemorial,2017-08-25 14:04:41+00:00,See a virtual tour of one of our newest #listings 3427 Louvre #Houston #TX http://tour.circlepix.com/home/BRLEG2 pic.twitter.com/XvNcUX8Dzh,#listings #Houston #TX,,official
2050,901082785150009344,TrillGladiator2,2017-08-25 14:04:11+00:00,Any nigga I know from Houston in Vegas and I see u. U better show me some love. Cuz I'm… https://www.instagram.com/p/BYOC3Wij7DB/,,,official
2051,901082631755976705,Piker73,2017-08-25 14:03:35+00:00,Some appropriate music for the drive to work. Harvey Danger! #harvey #harveydanger… https://www.instagram.com/p/BYOCzGfHFpq/,#harvey #harveydanger,,official
2052,901082253500993538,addsugar117,2017-08-25 14:02:05+00:00,ユニクロの自動販売機となんだかなあって思った壁 場所: George Bush Intercontinental Airporthttps://www.instagram.com/p/BYOAzcmjI02/,,,official
2053,901082216473776128,TotalTrafficHOU,2017-08-25 14:01:56+00:00,All lanes blocked. in #SouthSide on Hwy 288 S Fwy Outbound after The S Sam Houston Tollway to Mchard #traffic http://bit.ly/17hsIjn,#SouthSide #traffic,,official
2054,901081609977212928,HoustonCookies,2017-08-25 13:59:31+00:00,"To give our employees an opportunity to safely prepare for the hurricane, we are announcing… https://www.instagram.com/p/BYOCU-5noUS/",,,official
2055,901081305978478592,Mike_Caprio,2017-08-25 13:58:19+00:00,"Need to get out before #Harvey comes through! (@George Bush Intercontinental Airport in Houston, TX)https://www.swarmapp.com/c/aepgWbJRUsF",#Harvey,,official
2056,901080584629440512,AtomicLabRat,2017-08-25 13:55:27+00:00,Houston waiting on #hurricaneharvey @Harris County Civil Justice Center https://www.instagram.com/p/BYOB3FCFrzY/,#hurricaneharvey,,official
2057,901080356589154305,kristinanoogen,2017-08-25 13:54:32+00:00,Just posted a photo @Inversion Coffee & Art https://www.instagram.com/p/BYOBwvNlsAEDU9osSk20MJudyfbSVSHOgMQXGs0/ …,,,official
2058,901080137747255297,allie_sle,2017-08-25 13:53:40+00:00,Good Morning All!! I pray everyone is safe during this storm! Stay prayed up!! #professyourfaith… https://www.instagram.com/p/BYOBqjcAnqr/,#professyourfaith,,official
2059,901080079819825152,LATRHOOPS,2017-08-25 13:53:26+00:00,Thanks storm for no school and thanks lashawndmccoy for opening up… https://www.instagram.com/p/BYOBoy8D9HskgzdNsw1s-6PvdeYWnXKUwN9DHI0/ …,,,official
2060,901079999150686208,bishop_bekah,2017-08-25 13:53:07+00:00,Join me at the #ChampionsLuncheon brought to you by @bishoptstewart!!! If you are a leader in… https://www.instagram.com/p/BYOBly2AMUh/,#ChampionsLuncheon,,official
2061,901079782653382657,revrodhtx,2017-08-25 13:52:16+00:00,Praying over our City this morning! Sundays 10am | 2800 antoine @unionhouston… https://www.instagram.com/p/BYOBgM-h0Oo/,,,official
2062,901079545624711168,revrodhtx,2017-08-25 13:51:19+00:00,"Look! I stand at the door and knock. If you hear my voice and open the door, I will come in, and… https://www.instagram.com/p/BYOBZC5hSMI/",,,official
2063,901079506806595585,TotalTrafficHOU,2017-08-25 13:51:10+00:00,"Two left lanes blocked. in #SouthSide on Hwy 288 S Fwy Outbound before Mchard, stop and go traffic back to The S Sam Houston Tollway",#SouthSide,,official
2064,901079384924213249,Edward_Brinkley,2017-08-25 13:50:41+00:00,Hurricane Preparedness #hurricaneharvey #hurricaneparty #floodparty @Downtown Houston https://www.instagram.com/p/BYOBULyls4j/,#hurricaneharvey #hurricaneparty #floodparty,,official
2065,901079343769817088,revrodhtx,2017-08-25 13:50:31+00:00,"Look! I stand at the door and knock. If you hear my voice and open the door, I will come in, and… https://www.instagram.com/p/BYOBTIeBLaq/",,,official
2066,901079215461867520,DedricWalker,2017-08-25 13:50:00+00:00,I am appreciating how symmetrical and colorful Hurricane Harvey appears on radar. I do not miss… https://www.instagram.com/p/BYOBPOVh2uc/,,,official
2067,901079157672738816,BigB_HOU,2017-08-25 13:49:47+00:00,That time I had sushi with #DarthVader... #fbf #SushiTora #UseTheForceNotChopsticks #bruh @… https://www.instagram.com/p/BYOBNt-A2ET/,#DarthVader #fbf #SushiTora #UseTheForceNotChopsticks #bruh,,official
2068,901079017121382400,LakerGang_619,2017-08-25 13:49:13+00:00,"First rain bands starting to move in! #hurricaneharvey @Houston, Texas https://www.instagram.com/p/BYN64fmDyXw/",#hurricaneharvey,,official
2069,901078581220003840,pinktotango,2017-08-25 13:47:29+00:00,Happy Friday! We are ready for you #hurricaneharvey We try not to watch the news a lot… https://www.instagram.com/p/BYOA8zED3Aj/,#hurricaneharvey,,official
2070,901078396867928065,AtomicLabRat,2017-08-25 13:46:45+00:00,Tunnel doors close at 1800hrs. #harvey @Harris County Civil Justice Center https://www.instagram.com/p/BYOA3tBFVTE/,#harvey,,official
2071,901078097860206593,eatarabella,2017-08-25 13:45:34+00:00,We will be closed today as we brace for Hurricane #harvey with our fellow Houstonians. Stay safe… https://www.instagram.com/p/BYOAu6bAMJN/,#harvey,,official
2072,901077720771080194,TrillGladiator2,2017-08-25 13:44:04+00:00,Praying for traveling grace and for my family in Houston. Please lord watch over my jones...… https://www.instagram.com/p/BYOAkGED3Vy/,,,official
2073,901077516642902016,StonesiferAmy,2017-08-25 13:43:15+00:00,"Sugar land WF has 11 pallets of water 8am friday (@Whole Foods Market - @wholefoodshou in Sugar Land, TX) https://www.swarmapp.com/c/0OhvcDwt7Pz",,,official
2074,901076535691452416,UrfirstChoice1,2017-08-25 13:39:21+00:00,For Lease 2 bedroom 1 bathroom home on Heights Blvd. the house is on a prime location minutes… https://www.instagram.com/p/BYOAA2GjSza/,,,official
2075,901076519019094016,mariyol_arreaza,2017-08-25 13:39:17+00:00,RAGE by #anastasiabeverlyhills #norvina #abhrage #ABH… https://www.instagram.com/p/BYOAA0khcX4/,#anastasiabeverlyhills #norvina #abhrage #ABH,,official
2076,901076324239933440,BusbyTrish,2017-08-25 13:38:31+00:00,Heavenly FATHER...we're thanking YOU in advance for safety &… https://www.instagram.com/p/BYN_yC5lw-AkU5Ucl7Uo0aAdygP1plOpCYhTZw0/ …,,,official
2077,901076201321750531,MrGhettoCNN,2017-08-25 13:38:02+00:00,May the #GroceryWars begin... • Grocery wars! #Amazon and #Walmart crush #Kroger! But why… https://www.instagram.com/p/BYN_wvKl6J3/,#GroceryWars #Amazon #Walmart #Kroger,,official
2078,901075949487177729,hardcorespin,2017-08-25 13:37:02+00:00,Our 3rd Annual Back-2-School Drive was a blast God was great! Stay tuned and stop by A.J's… https://www.instagram.com/p/BYN_uPChFvZ/,,,official
2079,901075409613332480,hardcorespin,2017-08-25 13:34:53+00:00,Our 3rd Annual Back-2-School Drive was a blast God was great! Stay tuned and stop by A.J's… https://www.instagram.com/p/BYN_efFBUH4/,,,official
2080,901074893667672064,SofiiaStrykova,2017-08-25 13:32:50+00:00,This weekend is promising to be the most extraordinary So while normal folks are trying… https://www.instagram.com/p/BYN_RbljBKf/,,,official
2081,901074797014138880,lalalovespie,2017-08-25 13:32:27+00:00,#evenonacloudyday her magic can be seen from miles away! #blackgirlmagic #melaninpoppin… https://www.instagram.com/p/BYN_OtHh-Jg/,#evenonacloudyday #blackgirlmagic #melaninpoppin,,official
2082,901074611034521600,rastamma,2017-08-25 13:31:43+00:00,They are rationing water. Meanwhile these are just chilling. #MmmmGMOs. @Kroger https://www.instagram.com/p/BYN_Ja9BTuG/,#MmmmGMOs,,official
2083,901074536745095170,Drewdaprettyboi,2017-08-25 13:31:25+00:00,Good morning #Fam and #Fanz I hve #Klass on this… https://www.instagram.com/p/BYN_HT9AE7Mm77YGi2n3VG1IXgM63SLhy6nziQ0/ …,#Fam #Fanz #Klass,,official
2084,901074260827021312,SweetzDyvaToniJ,2017-08-25 13:30:19+00:00,#Day3 #Scrub Yourself Clean Green Smoothie… https://www.instagram.com/p/BYN-_NCjlecmD-3sn1fGnTQp8bcDtwqul0tEsY0/ …,#Day3 #Scrub,,official
2085,901073698731556864,hardcorespin,2017-08-25 13:28:05+00:00,Our 3rd Annual Back-2-School Drive was a blast God was great! Stay tuned and stop by A.J's… https://www.instagram.com/p/BYN-r6khmk2/,,,official
2086,901073494913556480,theabegarcia,2017-08-25 13:27:16+00:00,Flashback to 2008's Ike Hurrication. Great idea until you wake up… https://www.instagram.com/p/BYN4_sDDih_QdZ6tIK12eunV951OD8DkVioBCQ0/ …,,,official
2087,901073237156777985,HankOnFood,2017-08-25 13:26:15+00:00,"I'm at @Walgreens in Houston, TXhttps://www.swarmapp.com/c/gQiMiMuLeXc",,,official
2088,901073022978740224,TyBeezy11,2017-08-25 13:25:24+00:00,S/O TO THE CAMERA MAN FROM LAST NIGHT @shootemchris HE BE WORKING @University of Houston https://www.instagram.com/p/BYN-bR6FIeS/,,,official
2089,901072924328640514,RebekahFife_,2017-08-25 13:25:00+00:00,Yesterday I saw Galatians 5:13 pop up on my bible app. I read it and honestly didn't think too… https://www.instagram.com/p/BYN-YABnEzl/,,,official
2090,901072910546157568,CamilleCashMD,2017-08-25 13:24:57+00:00,Good morning! Just a reminder that we are open until further notice. Check back with us on our… https://www.instagram.com/p/BYN-I-nFECu/,,,official
2091,901072630278569984,MoFromPromo,2017-08-25 13:23:50+00:00,Thank you Lord for traveling grace! Be safe and please exercise the… https://www.instagram.com/p/BYN-PCKgvCYIt0QSFjIhPhkbd7bconZHJXU5S40/ …,,,official
2092,901072553472667650,jebowers87,2017-08-25 13:23:32+00:00,"I'm at Fix Coffeebar in Houston, TXhttps://www.swarmapp.com/c/4THm46jbmxa",,,official
2093,901072451806691330,CrashDunlap,2017-08-25 13:23:08+00:00,Go away Harvey! #hurricane #harvey #hurricaneharvey #solocup #flood #houston @The Abby At… https://www.instagram.com/p/BYN-KicgD7U/,#hurricane #harvey #hurricaneharvey #solocup #flood #houston,,official
2094,901072184164188160,mimitamia,2017-08-25 13:22:04+00:00,7:30 am here in Houston! It's coming!! Stay safe Southeast Texas… https://www.instagram.com/p/BYN-DF0FmREwZ-ddMrAuqx1FjXRLU4HIOyITK00/ …,,,official
2095,901071907189133312,ericaleigh33,2017-08-25 13:20:58+00:00,4th floor should be high enough if it floods. Ha. #hurricaneharvey (@PreFlight Airport Parking - @preflighthou)https://www.swarmapp.com/c/dg4ZHV0OhGE,#hurricaneharvey,,official
2096,901071753841168384,ericaleigh33,2017-08-25 13:20:21+00:00,Tried to get out for before the rain .... nope. 1 hour delayed right now. Let's hope that's it. #hurricaneharveyhttps://www.swarmapp.com/c/iwVp6VP2NUc,#hurricaneharveyhttps,,official
2097,901071687801749504,Alist_Muzik_Jay,2017-08-25 13:20:06+00:00,MERCH ALERT #chaseyourgoalsnotthesehoes #jhaynes #alistmuzik @University of Houston https://www.instagram.com/p/BYN90lahgCO/,#chaseyourgoalsnotthesehoes #jhaynes #alistmuzik,,official
2098,901071634731282433,KATonTV,2017-08-25 13:19:53+00:00,"Helping you through Hurricane Harvey - if you are in a mandatory evacuation zone, it is time to… https://www.instagram.com/p/BYN9y3lg1Ky/",,,official
2099,901071454074281990,DJREADI,2017-08-25 13:19:10+00:00,"#inline #htx #routine #nativehoustonian #stormaintshit #GFC @North Houston, Texas https://www.instagram.com/p/BYN9tonlEjM/",#inline #htx #routine #nativehoustonian #stormaintshit #GFC,,official
2100,901071341230538753,AdoredbyAlex,2017-08-25 13:18:43+00:00,Hunkering down for #HurricaneHarvey so opting to stay comfy in my new cute workout gear… https://www.instagram.com/p/BYN9pwYBFFT/,#HurricaneHarvey,,official
2101,901071084719448064,TheBabyChick,2017-08-25 13:17:42+00:00,Today I'm sharing my top 10 favorite things about my #babyshower! Come check out our #coastal… https://www.instagram.com/p/BYN9ZAjBFdH/,#babyshower #coastal,,official
2102,901070974870835200,YaliSTX,2017-08-25 13:17:16+00:00,*sigh* To be 22 again. What would you do differently if you knew what you know… https://www.instagram.com/p/BYN9fjBjODr/,,,official
2103,901070587405238272,PamelaRAYE_,2017-08-25 13:15:43+00:00,Book your next appointment with me on StyleSeat. It's super easy! http://styleseat.com/i/pamelaraye … https://www.instagram.com/p/BYN9UY8AQbs/,,,official
2104,901070480559534080,LuisGonzalezJ83,2017-08-25 13:15:18+00:00,"The calm before the storm! #hurricaneharvey #houston #texas @Houston, Texas https://www.instagram.com/p/BYN9RLWA178/",#hurricaneharvey #houston #texas,,official
2105,901070353094541312,LETHALWEAPONMV,2017-08-25 13:14:47+00:00,"Close at 1 today (@Capital One Bank in Houston, TX)https://www.swarmapp.com/c/k1pEFRzBxOI",,,official
2106,901070076614463488,djbuddhaTX,2017-08-25 13:13:41+00:00,"#prayfortexas @Houston, Texas https://www.instagram.com/p/BYN9FZzl2Hytff8G9zn6Aw31kZWXhGxKkylWQY0/ …",#prayfortexas,,official
2107,901069574027784196,Starrwith2rrz,2017-08-25 13:11:42+00:00,The smile i had when My job said we r closed and we still get… https://www.instagram.com/p/BYN823LB6T3mX6Umji8MiIid1wdCmcV7wC3G180/ …,,,official
2108,901069491337089024,RickStarPhoto1,2017-08-25 13:11:22+00:00,Flashback Friday image of the day w/the beautiful Katie! #flashbackfriday #sunset #portrait… https://www.instagram.com/p/BYN80GMFNDQ/,#flashbackfriday #sunset #portrait,,official
2109,901069378942377984,SofiiaStrykova,2017-08-25 13:10:55+00:00,"#loveisintheair When landing tonight #travel #love #happiness #travels #fly @Houston, Texas https://www.instagram.com/p/BYN8xL0Dj6c/",#loveisintheair #travel #love #happiness #travels #fly,,official
2110,901069313867747328,wickedharajuku,2017-08-25 13:10:40+00:00,"Work flow on this rainy Friday. (@JTB Services in Houston, TX)https://www.swarmapp.com/c/hvxkJHn9QUU",,,official
2111,901068774329131008,GUUDBELLYY,2017-08-25 13:08:31+00:00,TODAYS RAINY DAY MENU! The rain has started coming down over here in the Heights around… https://www.instagram.com/p/BYN8fd4nrOS/,,,official
2112,901068555776557057,SofiiaStrykova,2017-08-25 13:07:39+00:00,Such a pleasure to get off the airplane and bump into what you would think ?) Beauty is chasing… https://www.instagram.com/p/BYN8Ym9DiTS/,,,official
2113,901068384552587265,tbaudin,2017-08-25 13:06:58+00:00,"Got hurricane supplies for joshua_baudin taken care of! @Westside, Houston, Texas https://www.instagram.com/p/BYN8KRhFkxP/",,,official
2114,901068198690344960,alexginda,2017-08-25 13:06:14+00:00,I just finished running 7.06 km in 41m:48s with #Endomondo #endorphins https://goo.gl/ufpVFG,#Endomondo #endorphins,,official
2115,901068098081632256,SugarLand_TX,2017-08-25 13:05:50+00:00,Sugar Land TX Fri Aug 25th AM Forecast: TODAY Thunder Storms Hi 85 TONIGHT Tropical Storm Conditions Lo 79,,,official
2116,901068084378824705,SharpstownTX,2017-08-25 13:05:47+00:00,Sharpstown TX Fri Aug 25th AM Forecast: TODAY Thunder Storms Hi 85 TONIGHT Tropical Storm Conditions Lo 79,,,official
2117,901067997871304704,HoustonTX_,2017-08-25 13:05:26+00:00,Houston TX Fri Aug 25th AM Forecast: TODAY Thunder Storms Hi 85 TONIGHT Tropical Storm Conditions Lo 79,,,official
2118,901067990975881218,douglaswilson,2017-08-25 13:05:24+00:00,"Here we go again... another bloody hurricane! (@Randalls in Bellaire, TX)https://www.swarmapp.com/c/caMeZ7RkAtb",,,official
2119,901067072867880960,Gina_Murphy,2017-08-25 13:01:45+00:00,"Be authentic. #besomeone (@Be Someone graffiti in Houston, TX) https://www.swarmapp.com/c/fqK31p0Go08 pic.twitter.com/ALv3a9484e",#besomeone,,official
2120,901066942697660418,SeperatedSelf,2017-08-25 13:01:14+00:00,Hello Harvey. This is these DiSomma's first hurricane. We are… https://www.instagram.com/p/BYN7qNMHzbir1DdSWbntxfY1cKudUWaE4XSuFY0/ …,,,official
2121,901066489049956353,anikeboy,2017-08-25 12:59:26+00:00,"#hurricaneharvey @Houston, Texas https://www.instagram.com/p/BYN7dVIn4Re/",#hurricaneharvey,,official
2122,901066381600411649,tracesmith,2017-08-25 12:59:01+00:00,"My morning commute into Houston! Where's everyone going? #hurricaneharvey @Houston, Texas https://www.instagram.com/p/BYN7Z2Aj04W/",#hurricaneharvey,,official
2123,901066171000270848,TyBeezy11,2017-08-25 12:58:10+00:00,If was over for you other niggas along time ago @University of Houston https://www.instagram.com/p/BYN7TcJFI2X/,,,official
2124,901065577074241537,jellius,2017-08-25 12:55:49+00:00,"Very late getting here. Let's see what is left (@McDonald's in Pearland, TX)https://www.swarmapp.com/c/eHqNrQACHMR",,,official
2125,901065527946358784,BetitoJavie,2017-08-25 12:55:37+00:00,#TheCalmBeforeTheStorm. God help us. Everyone be safe. #TurnAroundDontDrown… https://www.instagram.com/p/BYN7A-xDl3i/,#TheCalmBeforeTheStorm #TurnAroundDontDrown,,official
2126,901065382211072000,ajmx83,2017-08-25 12:55:02+00:00,"I'm at McDonald's in Houston, TX https://www.swarmapp.com/c/idVPUZwM95s",,,official
2127,901065065796972545,DHCalling,2017-08-25 12:53:47+00:00,#tropicalstorm #harvey #hurricaneharvey @Downtown Houston https://www.instagram.com/p/BYN6zrRF5EXAlXyEYyb1_640i2IqVTQQTQKkOo0/ …,#tropicalstorm #harvey #hurricaneharvey,,official
2128,901064770496999426,karmart,2017-08-25 12:52:36+00:00,"I'm at El Bolillo Bakery #2 in Pasadena, TX https://www.swarmapp.com/c/9esBk7gS1wm pic.twitter.com/bheOtOe8Yb",#2,,official
2129,901064335820238848,PearlandTX,2017-08-25 12:50:53+00:00,light rain -> thunderstorm with heavy rain humidity down 100% -> 88% wind 8mph -> 16mph,,,official
