id,tweet,tokenized,lemmatized,stemmed,label
901210089125793794,accident blocks 2 right lanes in  no hside on i 45 n fwy inbound at the 610 n lp  stop and go traffic back to crosstimbers  delay of 3 mins,accident blocks 2 right lanes in no hside on i 45 n fwy inbound at the 610 n lp stop and go traffic back to crosstimbers delay of 3 mins,accident block 2 right lane in no hside on i 45 n fwy inbound at the 610 n lp stop and go traffic back to crosstimbers delay of 3 min,accid block 2 right lane in no hside on i 45 n fwi inbound at the 610 n lp stop and go traffic back to crosstimb delay of 3 min,0
901210052245078016,congrats to my little bro eric aguilar99 and  jess phdmommy     it s,congrats to my little bro eric aguilar99 and jess phdmommy it s,congrats to my little bro eric aguilar99 and jess phdmommy it s,congrat to my littl bro eric aguilar99 and jess phdmommi it s,0
901209484739182592,probably the only water in houston     you re wel e   walma  houston   dunvale rd,probably the only water in houston you re wel e walma houston dunvale rd,probably the only water in houston you re wel e walma houston dunvale rd,probabl the onli water in houston you re wel e walma houston dunval rd,0
901209475868229635,i m at bubba s 33    texasroadhouse in pasadena  tx jswqooe9kde,i m at bubba s 33 texasroadhouse in pasadena tx jswqooe9kde,i m at bubba s 33 texasroadhouse in pasadena tx jswqooe9kde,i m at bubba s 33 texasroadhous in pasadena tx jswqooe9kd,0
901209066869071875,had to pick up my funny books for the week  little light reading will get us through it   bedrock city  ic co   a9c3ntq2dnq,had to pick up my funny books for the week little light reading will get us through it bedrock city ic co a9c3ntq2dnq,had to pick up my funny book for the week little light reading will get u through it bedrock city ic co a9c3ntq2dnq,had to pick up my funni book for the week littl light read will get us through it bedrock citi ic co a9c3ntq2dnq,0
901208737024585728,grindmode  imbigjohnbitch  downtown houston,grindmode imbigjohnbitch downtown houston,grindmode imbigjohnbitch downtown houston,grindmod imbigjohnbitch downtown houston,0
901208707547238401,8200 ways 2 win vol 1 my new album is out everywhere make sure you check it out  8200ways2win,8200 ways 2 win vol 1 my new album is out everywhere make sure you check it out 8200ways2win,8200 way 2 win vol 1 my new album is out everywhere make sure you check it out 8200ways2win,8200 way 2 win vol 1 my new album is out everywher make sure you check it out 8200ways2win,0
901208527942946817,i want to travel the world   perform with my band  myoaband   thankful for these super talented,i want to travel the world perform with my band myoaband thankful for these super talented,i want to travel the world perform with my band myoaband thankful for these super talented,i want to travel the world perform with my band myoaband thank for these super talent,0
901208282303406080,the aviator hub has been busy this first week of school   kidslovebooks  lovethelibrary  frms,the aviator hub has been busy this first week of school kidslovebooks lovethelibrary frms,the aviator hub ha been busy this first week of school kidslovebooks lovethelibrary frms,the aviat hub ha been busi thi first week of school kidslovebook lovethelibrari frm,0
901207875820806144,hurricane food    alief  houston,hurricane food alief houston,hurricane food alief houston,hurrican food alief houston,2
901207580307070978,si tienes planes de boda  no dejes a  ltima hora la reservaci n del mariachi  si quieres buena,si tienes planes de boda no dejes a ltima hora la reservaci n del mariachi si quieres buena,si tienes plane de boda no dejes a ltima hora la reservaci n del mariachi si quieres buena,si tien plane de boda no deje a ltima hora la reservaci n del mariachi si quier buena,0
901207434508869633,great weather for some pho   pho saigon,great weather for some pho pho saigon,great weather for some pho pho saigon,great weather for some pho pho saigon,0
901207190349824000,there s a hurricane  ing  well that s not stopping kyla from getting a juice cleanse,there s a hurricane ing well that s not stopping kyla from getting a juice cleanse,there s a hurricane ing well that s not stopping kyla from getting a juice cleanse,there s a hurrican ing well that s not stop kyla from get a juic cleans,1
901207183253135360,history lesson with the fam in houston  yes karolyn01963 you do,history lesson with the fam in houston yes karolyn01963 you do,history lesson with the fam in houston yes karolyn01963 you do,histori lesson with the fam in houston ye karolyn01963 you do,0
901206981301719040,weathering the storm by seeking refuge from  hurricaneharvey in a bottle of soundbrewery triple,weathering the storm by seeking refuge from hurricaneharvey in a bottle of soundbrewery triple,weathering the storm by seeking refuge from hurricaneharvey in a bottle of soundbrewery triple,weather the storm by seek refug from hurricaneharvey in a bottl of soundbreweri tripl,1
901206925647499264,ready for hurricane      around the corner    arnd thecorner in houston  tx w   mellymtz  chandrawest  dtjjxr6q0b2,ready for hurricane around the corner arnd thecorner in houston tx w mellymtz chandrawest dtjjxr6q0b2,ready for hurricane around the corner arnd thecorner in houston tx w mellymtz chandrawest dtjjxr6q0b2,readi for hurrican around the corner arnd thecorn in houston tx w mellymtz chandrawest dtjjxr6q0b2,1
901206676744933377,wine time     at  beckrewwine house in houston  tx w   mellymtz  5nqocnb2exx,wine time at beckrewwine house in houston tx w mellymtz 5nqocnb2exx,wine time at beckrewwine house in houston tx w mellymtz 5nqocnb2exx,wine time at beckrewwin hous in houston tx w mellymtz 5nqocnb2exx,0
901206548541841411,the parents said we needed a puppy latte because we may get cabin fever this weekend so we,the parents said we needed a puppy latte because we may get cabin fever this weekend so we,the parent said we needed a puppy latte because we may get cabin fever this weekend so we,the parent said we need a puppi latt becaus we may get cabin fever thi weekend so we,0
901206543819046916,baby  b  and i are rocking our  hurricaneharvey outfit we did some errands early in the,baby b and i are rocking our hurricaneharvey outfit we did some errands early in the,baby b and i are rocking our hurricaneharvey outfit we did some errand early in the,babi b and i are rock our hurricaneharvey outfit we did some errand earli in the,0
901206497757212672,yum     at  sushiking htown in houston  tx w   chandrawest  kevj9akwig7,yum at sushiking htown in houston tx w chandrawest kevj9akwig7,yum at sushiking htown in houston tx w chandrawest kevj9akwig7,yum at sushik htown in houston tx w chandrawest kevj9akwig7,0
901206483278409728,we have a dream team of sous chefs on the line tonight  and even  cshepherd13 is working a,we have a dream team of sous chefs on the line tonight and even cshepherd13 is working a,we have a dream team of sou chef on the line tonight and even cshepherd13 is working a,we have a dream team of sou chef on the line tonight and even cshepherd13 is work a,0
901206308459827201,bootcamp   bring it   dontbeaverage  levelonefitness,bootcamp bring it dontbeaverage levelonefitness,bootcamp bring it dontbeaverage levelonefitness,bootcamp bring it dontbeaverag levelonefit,0
901206204956909568,hurricane pa y starts now    hurricane  harvey  hurricaneparty,hurricane pa y starts now hurricane harvey hurricaneparty,hurricane pa y start now hurricane harvey hurricaneparty,hurrican pa y start now hurrican harvey hurricaneparti,1
901205788341010434,tonight s sin city sinners show in houston  tx has been cancelled due to hurricane harvey  we,tonight s sin city sinners show in houston tx has been cancelled due to hurricane harvey we,tonight s sin city sinner show in houston tx ha been cancelled due to hurricane harvey we,tonight s sin citi sinner show in houston tx ha been cancel due to hurrican harvey we,2
901205695420346370,fbf to two weeks ago when william and leigh we re in  houston having a bang up time  planning,fbf to two weeks ago when william and leigh we re in houston having a bang up time planning,fbf to two week ago when william and leigh we re in houston having a bang up time planning,fbf to two week ago when william and leigh we re in houston have a bang up time plan,0
901205607298019329,now we re ready for  hurricaneharvey  in and out at killensbbq in less than 10 minutes  like,now we re ready for hurricaneharvey in and out at killensbbq in less than 10 minutes like,now we re ready for hurricaneharvey in and out at killensbbq in le than 10 minute like,now we re readi for hurricaneharvey in and out at killensbbq in less than 10 minut like,0
901205597969760256,repost  dchamberzciw you see it   we back on that top box  wshh    qworldstar  indabuildin,repost dchamberzciw you see it we back on that top box wshh qworldstar indabuildin,repost dchamberzciw you see it we back on that top box wshh qworldstar indabuildin,repost dchamberzciw you see it we back on that top box wshh qworldstar indabuildin,0
901205300711235584,hsmselfie    erykahbadu   her daughter aka twin   houston style magazine,hsmselfie erykahbadu her daughter aka twin houston style magazine,hsmselfie erykahbadu her daughter aka twin houston style magazine,hsmselfi erykahbadu her daughter aka twin houston style magazin,0
901205134029410304,we made it through the hurricane  harvey to see the houston nasa space center earlier today,we made it through the hurricane harvey to see the houston nasa space center earlier today,we made it through the hurricane harvey to see the houston nasa space center earlier today,we made it through the hurrican harvey to see the houston nasa space center earlier today,2
901204372834705411,enter to win a free beacon with full year service on our website  never leave home without my,enter to win a free beacon with full year service on our website never leave home without my,enter to win a free beacon with full year service on our website never leave home without my,enter to win a free beacon with full year servic on our websit never leav home without my,0
901204359236734976,sugar land tx fri aug 25th pm forecast  tonight tropical storm conditions lo 79 saturday tropical storm conditions hi 85,sugar land tx fri aug 25th pm forecast tonight tropical storm conditions lo 79 saturday tropical storm conditions hi 85,sugar land tx fri aug 25th pm forecast tonight tropical storm condition lo 79 saturday tropical storm condition hi 85,sugar land tx fri aug 25th pm forecast tonight tropic storm condit lo 79 saturday tropic storm condit hi 85,1
901204342467854336,sharpstown tx fri aug 25th pm forecast  tonight tropical storm conditions lo 75 saturday tropical storm conditions hi 81,sharpstown tx fri aug 25th pm forecast tonight tropical storm conditions lo 75 saturday tropical storm conditions hi 81,sharpstown tx fri aug 25th pm forecast tonight tropical storm condition lo 75 saturday tropical storm condition hi 81,sharpstown tx fri aug 25th pm forecast tonight tropic storm condit lo 75 saturday tropic storm condit hi 81,1
901204228735217666,houston tx fri aug 25th pm forecast  tonight tropical storm conditions lo 75 saturday tropical storm conditions hi 81,houston tx fri aug 25th pm forecast tonight tropical storm conditions lo 75 saturday tropical storm conditions hi 81,houston tx fri aug 25th pm forecast tonight tropical storm condition lo 75 saturday tropical storm condition hi 81,houston tx fri aug 25th pm forecast tonight tropic storm condit lo 75 saturday tropic storm condit hi 81,1
901203704061149184,los espero a las 5 en  somos texas   por azteca51  conozca los famosos tratamientos   terapia en,los espero a las 5 en somos texas por azteca51 conozca los famosos tratamientos terapia en,los espero a la 5 en somos texas por azteca51 conozca los famosos tratamientos terapia en,lo espero a la 5 en somo texa por azteca51 conozca lo famoso tratamiento terapia en,0
901203684478132224,houseattheriver 2017  september 24th  bananabendbeach1 featuring     far too loud,houseattheriver 2017 september 24th bananabendbeach1 featuring far too loud,houseattheriver 2017 september 24th bananabendbeach1 featuring far too loud,houseattheriv 2017 septemb 24th bananabendbeach1 featur far too loud,0
901203613208293377,youknowyoureintexaswhen      hurricaneharvey  houston  texas,youknowyoureintexaswhen hurricaneharvey houston texas,youknowyoureintexaswhen hurricaneharvey houston texas,youknowyoureintexaswhen hurricaneharvey houston texa,0
901203032318197760,as  mi vista     houston huracan hurricaneharvey2017  hurricane huracanharvey timelapse en,as mi vista houston huracan hurricaneharvey2017 hurricane huracanharvey timelapse en,a mi vista houston huracan hurricaneharvey2017 hurricane huracanharvey timelapse en,as mi vista houston huracan hurricaneharvey2017 hurrican huracanharvey timelaps en,1
901203013959905289,all set  now  a couple of helpful little pills and a stiff cocktail     hurricaneharvey,all set now a couple of helpful little pills and a stiff cocktail hurricaneharvey,all set now a couple of helpful little pill and a stiff cocktail hurricaneharvey,all set now a coupl of help littl pill and a stiff cocktail hurricaneharvey,0
901202972738285568,i m at  checkersrallys in houston  tx 5y5eczgtjgn,i m at checkersrallys in houston tx 5y5eczgtjgn,i m at checkersrallys in houston tx 5y5eczgtjgn,i m at checkersr in houston tx 5y5eczgtjgn,0
901202966648061954,we look forward to seeing your smile post  hurricaneharvey stay safe from your friends,we look forward to seeing your smile post hurricaneharvey stay safe from your friends,we look forward to seeing your smile post hurricaneharvey stay safe from your friend,we look forward to see your smile post hurricaneharvey stay safe from your friend,0
901202682001620992,new valued friend client let s wel e delia to the herbalife family she came in and got,new valued friend client let s wel e delia to the herbalife family she came in and got,new valued friend client let s wel e delia to the herbalife family she came in and got,new valu friend client let s wel e delia to the herbalif famili she came in and got,0
901202644139749376,belvefridays tonight  belvedere  uptownpark  houston  texas  tonight  belvedere latin thursdays,belvefridays tonight belvedere uptownpark houston texas tonight belvedere latin thursdays,belvefridays tonight belvedere uptownpark houston texas tonight belvedere latin thursday,belvefriday tonight belveder uptownpark houston texa tonight belveder latin thursday,0
901202575265017857,how i roll when there is a hurricane brewing outside the airpo    hurricane  hurricaneharvey,how i roll when there is a hurricane brewing outside the airpo hurricane hurricaneharvey,how i roll when there is a hurricane brewing outside the airpo hurricane hurricaneharvey,how i roll when there is a hurrican brew outsid the airpo hurrican hurricaneharvey,2
901202129531977728,if you  e upon a road block  don t bother turn back   thievery,if you e upon a road block don t bother turn back thievery,if you e upon a road block don t bother turn back thievery,if you e upon a road block don t bother turn back thieveri,0
901201566325243905,ep2   getting ready to hit the road with danceswithsharkjackson next week   first up,ep2 getting ready to hit the road with danceswithsharkjackson next week first up,ep2 getting ready to hit the road with danceswithsharkjackson next week first up,ep2 get readi to hit the road with danceswithsharkjackson next week first up,0
901201141706391553,i m at  gamestop in houston  tx w   84cagla  87wwc4omuhz,i m at gamestop in houston tx w 84cagla 87wwc4omuhz,i m at gamestop in houston tx w 84cagla 87wwc4omuhz,i m at gamestop in houston tx w 84cagla 87wwc4omuhz,0
901200772347568128,run and get  realromadowney s new book as soon as you can  it will lift you up and bless you,run and get realromadowney s new book as soon as you can it will lift you up and bless you,run and get realromadowney s new book a soon a you can it will lift you up and bless you,run and get realromadowney s new book as soon as you can it will lift you up and bless you,0
901200761249562624,safe landing  it was rocky with a lot of turbulence but we made it,safe landing it was rocky with a lot of turbulence but we made it,safe landing it wa rocky with a lot of turbulence but we made it,safe land it wa rocki with a lot of turbul but we made it,0
901200579770425344,neverunderestimate the  hea ofachampion  houston  texas,neverunderestimate the hea ofachampion houston texas,neverunderestimate the hea ofachampion houston texas,neverunderestim the hea ofachampion houston texa,0
901200505048883200,drinking a cold brew ipa by  rogueales  420 lounge    c495678359  photo,drinking a cold brew ipa by rogueales 420 lounge c495678359 photo,drinking a cold brew ipa by rogueales 420 lounge c495678359 photo,drink a cold brew ipa by rogueal 420 loung c495678359 photo,0
901200368503324672,this one is for my girl  athenzmedia   thanks for bringing me out yesterday to play with you at,this one is for my girl athenzmedia thanks for bringing me out yesterday to play with you at,this one is for my girl athenzmedia thanks for bringing me out yesterday to play with you at,thi one is for my girl athenzmedia thank for bring me out yesterday to play with you at,0
901200130040320000,standing by      pasadena fire dept  station  8 in pasadena  tx   96y849uwuh,standing by pasadena fire dept station 8 in pasadena tx 96y849uwuh,standing by pasadena fire dept station 8 in pasadena tx 96y849uwuh,stand by pasadena fire dept station 8 in pasadena tx 96y849uwuh,0
901199880600735744,just listed by nancy epley in  houston  tx  1527 johanna drive c  please retweet   hhrn4lmr6q,just listed by nancy epley in houston tx 1527 johanna drive c please retweet hhrn4lmr6q,just listed by nancy epley in houston tx 1527 johanna drive c please retweet hhrn4lmr6q,just list by nanci epley in houston tx 1527 johanna drive c pleas retweet hhrn4lmr6q,0
901199691408449536,more hotness with  ladyleger and the viper out at imperialcollision  for all my se texas peeps,more hotness with ladyleger and the viper out at imperialcollision for all my se texas peeps,more hotness with ladyleger and the viper out at imperialcollision for all my se texas peep,more hot with ladyleg and the viper out at imperialcollis for all my se texa peep,0
901199434452574209,1501 ce ified ent presents   heavy by  psyco sid  produced by  llljumadedabeat  ramythebeast,1501 ce ified ent presents heavy by psyco sid produced by llljumadedabeat ramythebeast,1501 ce ified ent present heavy by psyco sid produced by llljumadedabeat ramythebeast,1501 ce ifi ent present heavi by psyco sid produc by llljumadedabeat ramythebeast,0
901199407034638338,someone please  e and get me back to  louisiana,someone please e and get me back to louisiana,someone please e and get me back to louisiana,someon pleas e and get me back to louisiana,0
901198706082500608,mountitup  tvinstall  ad  slightwork  houston  itsjustdifferent  rainsleetorsnow  we working,mountitup tvinstall ad slightwork houston itsjustdifferent rainsleetorsnow we working,mountitup tvinstall ad slightwork houston itsjustdifferent rainsleetorsnow we working,mountitup tvinstal ad slightwork houston itsjustdiffer rainsleetorsnow we work,0
901198519389872128,be safe my friends   myhouston  repost  nasa     from his vantage point on the international,be safe my friends myhouston repost nasa from his vantage point on the international,be safe my friend myhouston repost nasa from his vantage point on the international,be safe my friend myhouston repost nasa from hi vantag point on the intern,0
901198507964473344,prayfo exas  hurricaneharvey  houston  texas,prayfo exas hurricaneharvey houston texas,prayfo exas hurricaneharvey houston texas,prayfo exa hurricaneharvey houston texa,0
901198467212685313,my mood   mystery  read  reading  bookstagram  books  usedbookstore  htx  houston  bookstore,my mood mystery read reading bookstagram books usedbookstore htx houston bookstore,my mood mystery read reading bookstagram book usedbookstore htx houston bookstore,my mood mysteri read read bookstagram book usedbookstor htx houston bookstor,0
901198460950528000,looking real good  ls430  ls430club  ls430vip  gskingz tx  gskingz  houston  texas,looking real good ls430 ls430club ls430vip gskingz tx gskingz houston texas,looking real good ls430 ls430club ls430vip gskingz tx gskingz houston texas,look real good ls430 ls430club ls430vip gskingz tx gskingz houston texa,0
901198193064517632,last trip to the grocery store  pleted  hurricane supplies  hurricaneharveyprep,last trip to the grocery store pleted hurricane supplies hurricaneharveyprep,last trip to the grocery store pleted hurricane supply hurricaneharveyprep,last trip to the groceri store plete hurrican suppli hurricaneharveyprep,1
901197857881030656,hurricane harvey  houston  texas,hurricane harvey houston texas,hurricane harvey houston texas,hurrican harvey houston texa,2
901197851535003648,found me some propane    now i m gon be grilling steaks  skrimps  chittlins  and beans during,found me some propane now i m gon be grilling steaks skrimps chittlins and beans during,found me some propane now i m gon be grilling steak skrimps chittlins and bean during,found me some propan now i m gon be grill steak skrimp chittlin and bean dure,0
901197537289400322,f friday s     if you re ready to get wet n  wild the place to be is johnny b s    we ll,f friday s if you re ready to get wet n wild the place to be is johnny b s we ll,f friday s if you re ready to get wet n wild the place to be is johnny b s we ll,f friday s if you re readi to get wet n wild the place to be is johnni b s we ll,0
901197380099334149,when in doubt     legday  struggle  quadsfordays  hilton americas houston,when in doubt legday struggle quadsfordays hilton americas houston,when in doubt legday struggle quadsfordays hilton america houston,when in doubt legday struggl quadsforday hilton america houston,0
901197375422816256,catch me behind the bar not your average happy hour  happiesthour   friday s at,catch me behind the bar not your average happy hour happiesthour friday s at,catch me behind the bar not your average happy hour happiesthour friday s at,catch me behind the bar not your averag happi hour happiesthour friday s at,0
901197178017853440,no rationing in houston  glad we filled up last night and i only wanted to top off   savage,no rationing in houston glad we filled up last night and i only wanted to top off savage,no rationing in houston glad we filled up last night and i only wanted to top off savage,no ration in houston glad we fill up last night and i onli want to top off savag,0
901197146589982720,drinking a watermelon wheat by  gbaybeer  casa de tidalwave   c495668980,drinking a watermelon wheat by gbaybeer casa de tidalwave c495668980,drinking a watermelon wheat by gbaybeer casa de tidalwave c495668980,drink a watermelon wheat by gbaybeer casa de tidalwav c495668980,0
901196978658439170,since there s a break from tornado warnings with  harvey  i figure a,since there s a break from tornado warnings with harvey i figure a,since there s a break from tornado warning with harvey i figure a,sinc there s a break from tornado warn with harvey i figur a,2
901196752782577664,i m at franks cleaners in baytown  tx gnssrnvlfce,i m at franks cleaners in baytown tx gnssrnvlfce,i m at frank cleaner in baytown tx gnssrnvlfce,i m at frank cleaner in baytown tx gnssrnvlfce,0
901196733207543808,houston  harvey  weather  hurricane en rag    pesto,houston harvey weather hurricane en rag pesto,houston harvey weather hurricane en rag pesto,houston harvey weather hurrican en rag pesto,1
901196704795570176,the pretty dragonfly says  hello   he waited and let me go in the,the pretty dragonfly says hello he waited and let me go in the,the pretty dragonfly say hello he waited and let me go in the,the pretti dragonfli say hello he wait and let me go in the,0
901196428093132804,3 51 mi run   arms  back   abs hiit workout   1088caloriesburned  luvfest  fridayfunnery,3 51 mi run arms back abs hiit workout 1088caloriesburned luvfest fridayfunnery,3 51 mi run arm back ab hiit workout 1088caloriesburned luvfest fridayfunnery,3 51 mi run arm back ab hiit workout 1088caloriesburn luvfest fridayfunneri,0
901196221708152833,that s all folks  cvs,that s all folks cvs,that s all folk cv,that s all folk cv,0
901196131551641605,my young fella 6 8 f c  blockingbeast had an great summer developmenting his game with me and,my young fella 6 8 f c blockingbeast had an great summer developmenting his game with me and,my young fella 6 8 f c blockingbeast had an great summer developmenting his game with me and,my young fella 6 8 f c blockingbeast had an great summer develop hi game with me and,0
901196121883774980,johnny b s outlaw saloon    e by and check us out       drink specials every day of the week,johnny b s outlaw saloon e by and check us out drink specials every day of the week,johnny b s outlaw saloon e by and check u out drink special every day of the week,johnni b s outlaw saloon e by and check us out drink special everi day of the week,0
901195670593433600,my fat boy senses are tingling rt  goodfulvids  for the love of chicken and waffles   1,my fat boy senses are tingling rt goodfulvids for the love of chicken and waffles 1,my fat boy sens are tingling rt goodfulvids for the love of chicken and waffle 1,my fat boy sens are tingl rt goodfulvid for the love of chicken and waffl 1,0
901195577307869184,harvey  baytown  texas,harvey baytown texas,harvey baytown texas,harvey baytown texa,0
