,id,username,date,text,hashtags,geo,type
1253,901223962893467648,wong_studio,2017-08-25 23:25:11+00:00,Hurricane on its way but am V. excited to play Billy Bragg & Bowie vinyl (in protective plastic… https://www.instagram.com/p/BYPC3ukBlEY/,,,official
1254,901223927950823428,realtalkjunkies,2017-08-25 23:25:03+00:00,I believe one of the most ignorant statements someone can make is that they can’t support another’s plight because the person has money,,,official
1255,901223845536968709,hkmart3,2017-08-25 23:24:43+00:00,Coming down quickly. @Baytown Little Theater https://www.instagram.com/p/BYPC8pCDeAi/,,,official
1256,901223785541578752,MikePuckettDDM,2017-08-25 23:24:29+00:00,I enjoyed #CraftBeerFriday at Liberty Taco today... BYOB for the time being! So grab your… https://www.instagram.com/p/BYPC5q5g8d4/,#CraftBeerFriday,,official
1257,901223658718466050,jellius,2017-08-25 23:23:58+00:00,Pain came back is unbearable for her. So we back. (@Houston Methodist Hospital Emergency Room - @hmdigitalmkt)https://www.swarmapp.com/c/4KwqanDcTqi,,,official
1258,901223540535566336,isiahcareyFOX26,2017-08-25 23:23:30+00:00,#Harvey just got himself upgraded to bottle service at the club... he's straight Cat 4 now!… https://www.instagram.com/p/BYPC39QDhLl/,#Harvey,,official
1259,901223353389854720,TamekaRonne,2017-08-25 23:22:46+00:00,At HEB in #houston I'm like no more water all the potatoes chips are gone! What did I miss?… https://www.instagram.com/p/BYPCydYDD4A/,#houston,,official
1260,901223267750391808,DessiiWorld,2017-08-25 23:22:25+00:00,"Aye man say man , Catch us at the birthday party Sept 3rd gahdam for amorigabrielle fine asss...… https://www.instagram.com/p/BYPCmCinXKg/",,,official
1261,901223187966566401,mamaeli05,2017-08-25 23:22:06+00:00,Prayers for friends and family both in the path of #HurricaneHarvey and those with the @redcross… https://www.instagram.com/p/BYPCtlVAYID/,#HurricaneHarvey,,official
1262,901223006546087939,Run_Pattie_Run1,2017-08-25 23:21:23+00:00,"Pineapple Apple Pattie reporting from HTX, and accepting the umbrella challenge kellyfigs1… https://www.instagram.com/p/BYPCoWhHOtI/",,,official
1263,901222824207110145,cdleblanc3,2017-08-25 23:20:39+00:00,It's 6 pm on a Friday night in August and its only 79 degrees. You… https://www.instagram.com/p/BYPCjMQAwc5XW89Lh6EctqD0rxawdwML3yceVY0/ …,,,official
1264,901222153043005440,thxdts,2017-08-25 23:17:59+00:00,Beef fajitas at Escalante's #HarveypostponedColdplayConcert #HurricaneHarvey @Escalante's… https://www.instagram.com/p/BYPCGoDAVhV/,#HarveypostponedColdplayConcert #HurricaneHarvey,,official
1265,901221967675654146,JenniferLynnW14,2017-08-25 23:17:15+00:00,"Please read my post, The Anchor - Edition 20! TIA. #anchoredinhope #breastcancerwarrior… https://www.instagram.com/p/BYPCJ09hRJQ/",#anchoredinhope #breastcancerwarrior,,official
1266,901221484676263936,MrWiredUpOhBoy,2017-08-25 23:15:20+00:00,#Repost @elvisfReShley (get_repost) ・・・ 8/26 #PETTY ft @50cent & @2chainz WORLD PREMIERE … https://www.instagram.com/p/BYPB7Zmj8SM/,#Repost #PETTY,,official
1267,901221448588685312,SoSouth,2017-08-25 23:15:11+00:00,"Hurricane Ike 2008. @Houston, Texas https://www.instagram.com/p/BYPB6zSD3rw/",,,official
1268,901221447858663424,EGHtown,2017-08-25 23:15:11+00:00,"Chillin, waiting for these events to unfold. I hope everyone is doing well and gets through all… https://www.instagram.com/p/BYPB60aHSNj/",,,official
1269,901221266757042176,BarriMedia,2017-08-25 23:14:28+00:00,BREAKING: #Harvey now a category 4 hurricane with 130 mph winds. And slowing down a bit. Moving… https://www.instagram.com/p/BYPB1fUgHCG/,#Harvey,,official
1270,901221118304026625,HoustonFashions,2017-08-25 23:13:53+00:00,Houston sky before the rain. @Downtown Houston https://www.instagram.com/p/BYPBrEaB5tA/,,,official
1271,901221080957956098,SCoftheWrG,2017-08-25 23:13:44+00:00,Update from our on the scene Apollo. @Roger Deards Texas BBQ and All Other Grub https://www.instagram.com/p/BYPAGqDAY3I/,,,official
1272,901221070744813570,SCoftheWrG,2017-08-25 23:13:41+00:00,Update on hurricane Harvey with our on the scene Apollo. @Roger Deards Texas BBQ and All… https://www.instagram.com/p/BYPBsgSAswD/,,,official
1273,901220840720683009,MelodramaBTQ,2017-08-25 23:12:46+00:00,Happy Hour Friday today til 8 hosted by @_becameraready #melodramaboutique @Melodrama Boutique https://www.instagram.com/p/BYPBpGpjRre/,#melodramaboutique,,official
1274,901220590778023936,moedabarber2010,2017-08-25 23:11:47+00:00,"Sometimes u have to take it one Step up a notch .....I'm willing to show my work ,put it out… https://www.instagram.com/p/BK9cqoLAjr3/",,,official
1275,901220377052971009,jorge_ordaz,2017-08-25 23:10:56+00:00,"Made it thank G-d Shabbat shalom (@Beth Yeshurun in Houston, TX) https://www.swarmapp.com/c/4SxmUfMGnNQ",,,official
1276,901220357817991169,SunIsShining,2017-08-25 23:10:51+00:00,setting up to play #vinylrecords tonight at @theflathouston ( @fxboxolmos & _melodic_ join… https://www.instagram.com/p/BYPBanTn9Cu/,#vinylrecords,,official
1277,901220231263211521,KiMMie_jR,2017-08-25 23:10:21+00:00,"Just posted a photo @Southeast Houston, Houston, Texas https://www.instagram.com/p/BYPBXo9nkJmHwUbrrjC06YF2EPC5DXIYMyE6440/ …",,,official
1278,901220209998090241,mgearthman,2017-08-25 23:10:16+00:00,"Mary, Star of the Sea, pray for us! #hurricaneharveyhttps://youtu.be/KXT58rNzn2U",#hurricaneharveyhttps,,official
1279,901220150497640449,UEscissorhands,2017-08-25 23:10:02+00:00,Her hair games has stepped up by 100 percent #houstonhair #houstonhairstylist #balayage #ombre… https://www.instagram.com/p/BYPBUJkABXn/,#houstonhair #houstonhairstylist #balayage #ombre,,official
1280,901219738797342720,mgearthman,2017-08-25 23:08:24+00:00,Stay safe yall! #hurricaneharveyhttps://twitter.com/NWSHouston/status/901219173422026754 …,#hurricaneharveyhttps,,official
1281,901219365839929345,L_DesignGroup,2017-08-25 23:06:55+00:00,The calm before the #storm #harvey #hurricaneharvey #home #theheights #houston #shadyacres… https://www.instagram.com/p/BYPA-OVnZNl/,#storm #harvey #hurricaneharvey #home #theheights #houston #shadyacres,,official
1282,901219327017238529,homesteadraised,2017-08-25 23:06:46+00:00,#FU#@@#HARVEY @Downtown Houston https://www.instagram.com/p/BYPA8FHAEDz/,#FU # #HARVEY,,official
1283,901219110511685632,OmarSpluga,2017-08-25 23:05:54+00:00,#Repost @fusionfmhouston (get_repost) ・・・ Durante El Paso de… https://www.instagram.com/p/BYPA28tg2eRqGP7YSnObbHTy3jtDY12pCH1jfU0/ …,#Repost,,official
1284,901219021881618432,BarriMedia,2017-08-25 23:05:33+00:00,"There are still more questions than answers, but the latest forecast has Hurricane Harvey… https://www.instagram.com/p/BYPAx40AY54/",,,official
1285,901218916722237441,dj_staso,2017-08-25 23:05:08+00:00,"***Link to Tickets in Bio*** CONCERT ALERTAugust 31st!! HOUSTON, TEXAS!! L.O.U.D. MUZIK… https://www.instagram.com/p/BYPAxeUAAhV/",,,official
1286,901218882001805316,jcarrillo65,2017-08-25 23:04:59+00:00,"Pug cupcakes for daughter's birthday party. #pugsrule @Bellaire, Texas https://www.instagram.com/p/BYPAwQkj7g0/",#pugsrule,,official
1287,901218864956157952,Amanda_RaeC,2017-08-25 23:04:55+00:00,Finished up a strong first week of school and training. #riceowls #hurricaneharvey #hunkereddown… https://www.instagram.com/p/BYPAvpsHAMn/,#riceowls #hurricaneharvey #hunkereddown,,official
1288,901218825538031617,HankOnFood,2017-08-25 23:04:46+00:00,"I'm at Starbucks Coffee in Houston, TXhttps://www.swarmapp.com/c/1T5KvcYvmgV",,,official
1289,901218775122313216,dj_staso,2017-08-25 23:04:34+00:00,"***Link to Tickets in Bio*** CONCERT ALERTAugust 31st!! HOUSTON, TEXAS!! L.O.U.D. MUZIK… https://www.instagram.com/p/BYPAlthA7kK/",,,official
1290,901218732411805697,jessicaschulte,2017-08-25 23:04:24+00:00,No bread to be found in the grocery store… so I made some from… https://www.instagram.com/p/BYPArllHjbvxYib7OeFc8Z3_CAuuKQqJdrXXws0/ …,,,official
1291,901218619639681024,philjon21,2017-08-25 23:03:57+00:00,"I'm at Capital One Bank in Houston, TX https://www.swarmapp.com/c/iSoR2EkLQu9",,,official
1292,901218440043798528,Lett14,2017-08-25 23:03:14+00:00,I'm ready for #HurricaneHarvey thank you Tia sustaitaedna for my… https://www.instagram.com/p/BYPAjbsAsTXsrg7y5GydaExirUTgrhgcesab-E0/ …,#HurricaneHarvey,,official
1293,901217919014776833,RedShoesRedWine,2017-08-25 23:01:10+00:00,"Here in Texas, we've been watching Hurricane Harvey intensify and head towards our coast over… https://www.instagram.com/p/BYPAUK1D7uV/",,,official
1294,901217782410473477,TXBreastBody,2017-08-25 23:00:37+00:00,Our new BodyTite procedure results in much tighter skin than traditional liposuction. Don't miss our 20% off special- book before August 31!pic.twitter.com/kAEkBafPlX,,,official
1295,901217473609048065,TotalTrafficHOU,2017-08-25 22:59:24+00:00,"Accident cleared in #SwSide on 69 SW Fwy Outbound at Gessner, stop and go traffic back to Bellaire Blvd, delay of 3 mins #traffic",#SwSide #traffic,,official
1296,901217252262920193,chickabrava,2017-08-25 22:58:31+00:00,Ha! #repost #hurricane #harvey #hunkerdown #houston #htown @… https://www.instagram.com/p/BYPABE0AH0OHKe3z6maWZalHXZPg_4scrXYHv80/ …,#repost #hurricane #harvey #hunkerdown #houston #htown,,official
1297,901216906438483978,miss_Roniee,2017-08-25 22:57:08+00:00,"For someone who does not care so much fore baseball, I had a nice time with my #CRUfam last… https://www.instagram.com/p/BYO_2cGAqF_/",#CRUfam,,official
1298,901216692193439744,Dannyboy1112,2017-08-25 22:56:17+00:00,#TACOTIME @Taqueria La Borrega https://www.instagram.com/p/BYO_sAvj5dU/,#TACOTIME,,official
1299,901216649021243392,magicfishbones,2017-08-25 22:56:07+00:00,The adobo abides. #adobosauce #pullthatpork #harveyiscoming @Heights Area https://www.instagram.com/p/BYO_vVDh-8Q/,#adobosauce #pullthatpork #harveyiscoming,,official
1300,901216538694385665,Nummymuffin,2017-08-25 22:55:41+00:00,Made myself a nice #lunch plate. #stormfood #cottoncandygrapes #felinosalami #seasidecheddar… https://www.instagram.com/p/BYO_hGXDxUL/,#lunch #stormfood #cottoncandygrapes #felinosalami #seasidecheddar,,official
1301,901216391679930368,mariyol_arreaza,2017-08-25 22:55:06+00:00,La batalla de las paletas | imagínate que el dinero no es impedimento y pudieras tener estas… https://www.instagram.com/p/BYO_kHfhllF/,,,official
1302,901216391377944576,magicfishbones,2017-08-25 22:55:06+00:00,Say hello to my little friend! Two days of smoking and roasting to pulled pork. #harveyiscoming… https://www.instagram.com/p/BYO_n07BYg5/,#harveyiscoming,,official
1303,901216162494783488,MegAnne,2017-08-25 22:54:11+00:00,We are home and ready to hunker down! #SurvivingHarvey #dukesanddingssurvivingharvey @awduke4 @… https://www.instagram.com/p/BYO_eQPAzCh/,#SurvivingHarvey #dukesanddingssurvivingharvey,,official
1304,901215742808526850,SavvHISD,2017-08-25 22:52:31+00:00,"Drive slow homey... #igotmyownlane #laneswitchin #hueston @Houston, Texas https://www.instagram.com/p/BYO_U0nh2vY/",#igotmyownlane #laneswitchin #hueston,,official
1305,901215703734390786,TotalTrafficHOU,2017-08-25 22:52:22+00:00,"Accident cleared in #NorthSide on I-45 N Fwy Inbound at The 610 N Lp, stop and go traffic back to Crosstimbers, delay of 3 mins #traffic",#NorthSide #traffic,,official
1306,901215492609908736,HankOnFood,2017-08-25 22:51:31+00:00,Tanker truck is refilling this Exxon. Waiting for them to finish so I can top off the tank https://www.swarmapp.com/c/dNdpt5i2Gfa pic.twitter.com/6OmFyTyNXO,,,official
1307,901215486389747713,UnderbellyHOU,2017-08-25 22:51:30+00:00,"On the menu tonight: UB Hickory King Grits from Circle S Farms, Collard Greens, UB Hot Sauce.… https://www.instagram.com/p/BYO_Nd1gxb5/",,,official
1308,901215019010060289,Ctycksen,2017-08-25 22:49:38+00:00,Definitely prepared for the hurricane @MarieDennise #hurricane #hurricaneharvey #htx #houston… https://www.instagram.com/p/BYO-_0Ihy94/,#hurricane #hurricaneharvey #htx #houston,,official
1309,901214958930808832,MelodramaBTQ,2017-08-25 22:49:24+00:00,Happy Hour Finale NOW! 5-8p at Melodrama Boutique. Be safe and if you can make we would love to… https://www.instagram.com/p/BYO-9VXD_C3/,,,official
1310,901214697579479041,TotalTrafficHOU,2017-08-25 22:48:22+00:00,"Accident blocks 3 right lanes. in #SwSide on 69 SW Fwy Outbound at Gessner, stop and go traffic back to Bellaire Blvd, delay of 3 mins",#SwSide,,official
1311,901214619972382721,wattdogg73,2017-08-25 22:48:03+00:00,All set for Harvey! #hurricaneparty #letsgetdrunktonight #sharingiscaring #blowblowblow @… https://www.instagram.com/p/BYO-z6NnERk/,#hurricaneparty #letsgetdrunktonight #sharingiscaring #blowblowblow,,official
1312,901214504310132736,hectorgarcia,2017-08-25 22:47:36+00:00,Old fashions all weekend. #whiskey #stillhouse #oldcamp #oldfashion #hurricaneprep… https://www.instagram.com/p/BYO-w5zAZ4o/,#whiskey #stillhouse #oldcamp #oldfashion #hurricaneprep,,official
1313,901213688627122181,sugardose,2017-08-25 22:44:21+00:00,Drinking a Lemon And Ginger Radler by @karbachbrewing @Briarwick Southside of Houston — http://untp.beer/s/c495717639 #photo,#photo,,official
1314,901213044268834819,tordior_tweets,2017-08-25 22:41:48+00:00,"Happy pregnant woman!!! (@Shipley's Donuts in Deer Park, TX) https://www.swarmapp.com/c/6kV90IvLcCt",,,official
1315,901212921149116417,MelodramaBTQ,2017-08-25 22:41:18+00:00,Happy Hour Friday finale now 5-8p Despite the storm looming we decided to move forward with the… https://www.instagram.com/p/BYO-ClWDCLF/,,,official
1316,901212811459674112,dustinduchoang,2017-08-25 22:40:52+00:00,Now I can't get my alkaline water! #alkalinewater #hurricaneharvey #wholefoods @Whole Foods Market https://www.instagram.com/p/BYO9_qphYo6/,#alkalinewater #hurricaneharvey #wholefoods,,official
1317,901212296655122434,JBsOutlawSaloon,2017-08-25 22:38:49+00:00,Saturday - August 26th !! Come out and watch the Texans with us on one of our BIG SCREEN TV's… https://www.instagram.com/p/BYO9wrxjvse/,,,official
1318,901211018554216448,ApGustavo,2017-08-25 22:33:45+00:00,Desviando do furacão Harvey para aterrizar em Houston. Por favor Ore pelo Texas. . … https://www.instagram.com/p/BYO9LnxBGUC/,,,official
1319,901210999566544899,marbaquero,2017-08-25 22:33:40+00:00,"Waiting for Harvey. (at @SaltgrassSteak House in Houston, TX) https://www.swarmapp.com/c/daS4uvgX9Pl",,,official
1320,901210968734277636,Chopster1,2017-08-25 22:33:33+00:00,Had a great time with my beautiful girlfriend veronicarosalesmusic… https://www.instagram.com/p/BYO8roSDCC1ebv75qVj-Hu2_mOjTRODE7ibP6k0/ …,,,official
1321,901210829743423488,karlbaughman,2017-08-25 22:33:00+00:00,"While we await Hurricane Harvey, it's an Oktoberfest contest with beer kind of night #harvey… https://www.instagram.com/p/BYO9GD9ng--/",#harvey,,official
1322,901210812265750528,OdieIsAwesome,2017-08-25 22:32:55+00:00,Waiting for a storm to hit but I still got my mail!! So excited to use these!! … https://www.instagram.com/p/BYO9FYVAvAG/,,,official
1323,901210742833262592,TotalTrafficHOU,2017-08-25 22:32:39+00:00,Accident on the exit ramp in #SeSide on 610 N Lp EB at The N Fwy #traffic http://bit.ly/17hsIjn,#SeSide #traffic,,official
1324,901210089125793794,TotalTrafficHOU,2017-08-25 22:30:03+00:00,"Accident blocks 2 right lanes in #NorthSide on I-45 N Fwy Inbound at The 610 N Lp, stop and go traffic back to Crosstimbers, delay of 3 mins",#NorthSide,,official
1325,901210052245078016,4Kellysabrina,2017-08-25 22:29:54+00:00,Congrats to my little bro eric.aguilar99 and @JESS_PhDMommy !!! It's… https://www.instagram.com/p/BYO8u7zHx2ALJrpGq9eSoo09gEQQ2QXP1gRrlM0/ …,,,official
1326,901209484739182592,SpikeMiller_,2017-08-25 22:27:39+00:00,Probably the only water in Houston. ...You're welcome. @Walmart Houston - Dunvale Rd https://www.instagram.com/p/BYO8a-_gyGG/,,,official
1327,901209475868229635,jackallenwomack,2017-08-25 22:27:37+00:00,"I'm at Bubba's 33 - @texasroadhouse in Pasadena, TXhttps://www.swarmapp.com/c/jsWqOOE9kDe",,,official
1328,901209066869071875,HankOnFood,2017-08-25 22:25:59+00:00,Had to pick up my funny books for the week. Little Light reading will get us through it (@Bedrock City Comic Co.)https://www.swarmapp.com/c/a9C3Ntq2DnQ,,,official
1329,901208737024585728,homesteadraised,2017-08-25 22:24:41+00:00,#grindmode #IMBIGJOHNBITCH @Downtown Houston https://www.instagram.com/p/BYO8JFjgPtP/,#grindmode #IMBIGJOHNBITCH,,official
1330,901208707547238401,BellfortTre,2017-08-25 22:24:34+00:00,8200 ways 2 win vol 1 my new album is out everywhere make sure you check it out #8200ways2win… https://www.instagram.com/p/BYO8IPDgAcO/,#8200ways2win,,official
1331,901208527942946817,MYOAMUSIC,2017-08-25 22:23:51+00:00,I want to Travel the World & Perform with my Band #MYOABand . Thankful for these Super Talented… https://www.instagram.com/p/BYO73kXHXA7/,#MYOABand,,official
1332,901208282303406080,FRMSLibrary,2017-08-25 22:22:52+00:00,The aviator hub has been busy this first week of school. #kidslovebooks #lovethelibrary #frms… https://www.instagram.com/p/BYM0-zKFIlu/,#kidslovebooks #lovethelibrary #frms,,official
1333,901207875820806144,jonestrainer,2017-08-25 22:21:15+00:00,"Hurricane Food!! @Alief, Houston https://www.instagram.com/p/BYO7vtZlELd/",,,official
1334,901207580307070978,OrigenYTradicio,2017-08-25 22:20:05+00:00,"Si tienes planes de boda, no dejes a última hora la reservación del Mariachi, si quieres buena… https://www.instagram.com/p/BYO7gvgjgJg/",,,official
1335,901207434508869633,Im_LaCobra,2017-08-25 22:19:30+00:00,Great weather for some Pho! @PHO SAIGON!!! https://www.instagram.com/p/BYO7iswlci0iaLVAoDF02mpZ6akRwmz5eh_xcM0/ …,,,official
1336,901207190349824000,713JuiceBar,2017-08-25 22:18:32+00:00,There's a hurricane coming? Well that's not stopping Kyla from getting a juice cleanse!… https://www.instagram.com/p/BYO7b5enL8H/,,,official
1337,901207183253135360,DJCed2k,2017-08-25 22:18:30+00:00,History lesson with the fam in Houston. Yes karolyn01963 you do… https://www.instagram.com/p/BYO7bt8lgb3Kj0dHEhKHc8y-AecoVisHPH5kNA0/ …,,,official
1338,901206981301719040,BeerGirlHTX,2017-08-25 22:17:42+00:00,Weathering the storm by seeking refuge from #hurricaneharvey in a bottle of soundbrewery Triple… https://www.instagram.com/p/BYO7V-Lg6_c/,#hurricaneharvey,,official
1339,901206925647499264,PwrSerg,2017-08-25 22:17:29+00:00,"Ready for hurricane!!! (@Around the Corner - @arnd_thecorner in Houston, TX w/ @mellymtz @chandrawest)https://www.swarmapp.com/c/dTJjxr6q0b2",,,official
1340,901206676744933377,PwrSerg,2017-08-25 22:16:30+00:00,"Wine time... (at @BeckrewWine House in Houston, TX w/ @mellymtz)https://www.swarmapp.com/c/5nQoCNB2eXx",,,official
1341,901206548541841411,GwenandPecos,2017-08-25 22:15:59+00:00,The parents said we needed a puppy latte because we may get cabin fever this weekend so we… https://www.instagram.com/p/BYO7JPrHjvN/,,,official
1342,901206543819046916,pinktotango,2017-08-25 22:15:58+00:00,"Baby ""B"" and I are rocking our #hurricaneharvey outfit We did some errands early in the… https://www.instagram.com/p/BYO7GxnjMvr/",#hurricaneharvey,,official
1343,901206497757212672,PwrSerg,2017-08-25 22:15:47+00:00,"Yum... (at @SushiKing_htown in Houston, TX w/ @chandrawest)https://www.swarmapp.com/c/kEvj9aKwiG7",,,official
1344,901206483278409728,UnderbellyHOU,2017-08-25 22:15:43+00:00,"We have a dream team of sous chefs on the line tonight, and even @cshepherd13 is working a… https://www.instagram.com/p/BYO7HSxg8jf/",,,official
1345,901206308459827201,Anthonyj3001,2017-08-25 22:15:02+00:00,"Bootcamp , bring it. #dontbeaverage @Levelonefitness https://www.instagram.com/p/BYO7CLKDt0H/",#dontbeaverage,,official
1346,901206204956909568,Mrjdavis84,2017-08-25 22:14:37+00:00,Hurricane party starts now!! #hurricane #harvey #hurricaneparty… https://www.instagram.com/p/BYO6_GcHv_FiCIhvgy8STB87jKr7AfSr2DinuE0/ …,#hurricane #harvey #hurricaneparty,,official
1347,901205788341010434,scotty_griffin,2017-08-25 22:12:58+00:00,"Tonight's Sin City Sinners show in Houston, TX has been cancelled due to Hurricane Harvey. We… https://www.instagram.com/p/BYO6zYCnScs/",,,official
1348,901205695420346370,WmEvents,2017-08-25 22:12:36+00:00,#FBF to two weeks ago when William and Leigh we're in #Houston having a bang up time #planning… https://www.instagram.com/p/BYO6waDgO-o/,#FBF #Houston #planning,,official
1349,901205607298019329,facingbackwards,2017-08-25 22:12:15+00:00,"NOW we're ready for #HurricaneHarvey! In and out at killensbbq in less than 10 minutes, like… https://www.instagram.com/p/BYO6uIJgmxq/",#HurricaneHarvey,,official
1350,901205597969760256,DJ_KRain,2017-08-25 22:12:12+00:00,#Repost @dchamberzciw YOU SEE IT!! We Back On that TOP BOX #Wshh - @QWorldStar #INDABUILDIN… https://www.instagram.com/p/BYO6tMFBWLK/,#Repost #Wshh #INDABUILDIN,,official
1351,901205300711235584,houstonstyle,2017-08-25 22:11:01+00:00,#HSMSelfie - #ErykahBadu & her Daughter aka Twin! @Houston Style Magazine https://www.instagram.com/p/BYO6lHth32R/,#HSMSelfie #ErykahBadu,,official
1352,901205134029410304,SofiiaStrykova,2017-08-25 22:10:22+00:00,We made it through the hurricane #harvey to see the Houston NASA Space Center Earlier today… https://www.instagram.com/p/BYO6gJFjP2Z/,#harvey,,official
1353,901204372834705411,HoustonFashions,2017-08-25 22:07:20+00:00,Enter to win a free beacon with full year service on our website. Never leave home without my… https://www.instagram.com/p/BYO6FzAlBiS/,,,official
1354,901204359236734976,SugarLand_TX,2017-08-25 22:07:17+00:00,Sugar Land TX Fri Aug 25th PM Forecast: TONIGHT Tropical Storm Conditions Lo 79 SATURDAY Tropical Storm Conditions Hi 85,,,official
1355,901204342467854336,SharpstownTX,2017-08-25 22:07:13+00:00,Sharpstown TX Fri Aug 25th PM Forecast: TONIGHT Tropical Storm Conditions Lo 75 SATURDAY Tropical Storm Conditions Hi 81,,,official
1356,901204228735217666,HoustonTX_,2017-08-25 22:06:46+00:00,Houston TX Fri Aug 25th PM Forecast: TONIGHT Tropical Storm Conditions Lo 75 SATURDAY Tropical Storm Conditions Hi 81,,,official
1357,901203704061149184,deysi_alvarez12,2017-08-25 22:04:41+00:00,"Los espero a las 5 en ""Somos Texas"". Por Azteca51. Conozca los famosos tratamientos: ""Terapia en… https://www.instagram.com/p/BYO5sLpDOaQ/",,,official
1358,901203684478132224,komasalazar,2017-08-25 22:04:36+00:00,"@houseattheriver 2017, September 24th. bananabendbeach1 Featuring: * @far_too_loud *… https://www.instagram.com/p/BYO52MMhe36/",,,official
1359,901203613208293377,patrick440,2017-08-25 22:04:19+00:00,"#youknowyoureintexaswhen ... #hurricaneharvey @Houston, Texas https://www.instagram.com/p/BYO50Fgh5SWvsyomTYtRQuw37ABDZgvR4tk6Kw0/ …",#youknowyoureintexaswhen #hurricaneharvey,,official
1360,901203032318197760,karinanova,2017-08-25 22:02:01+00:00,Así mi vista... #houston#huracan#hurricaneharvey2017 #hurricane#huracanharvey#timelapse en… https://www.instagram.com/p/BYO5jA7n46H/,#houston #huracan #hurricaneharvey2017 #hurricane #huracanharvey #timelapse,,official
1361,901203013959905289,malvie5711,2017-08-25 22:01:56+00:00,"All set. Now, a couple of helpful little pills and a stiff cocktail... #hurricaneharvey… https://www.instagram.com/p/BYO5iixhE89/",#hurricaneharvey,,official
1362,901202972738285568,philjon21,2017-08-25 22:01:46+00:00,"I'm at @CheckersRallys in Houston, TXhttps://www.swarmapp.com/c/5y5eCzgTJGn",,,official
1363,901202966648061954,nsddshouston,2017-08-25 22:01:45+00:00,We look forward to seeing your smile post #hurricaneharvey Stay safe from your friends… https://www.instagram.com/p/BYO5g0Ogft8/,#hurricaneharvey,,official
1364,901202682001620992,nutritioninact,2017-08-25 22:00:37+00:00,NEW VALUED FRIEND/CLIENT Let's welcome delia to the herbalife family she came in and got… https://www.instagram.com/p/BYO5YntgAKN/,,,official
1365,901202644139749376,belvedereuptown,2017-08-25 22:00:28+00:00,#belvefridays tonight #belvedere #uptownpark #houston #texas #tonight @Belvedere Latin Thursdays https://www.instagram.com/p/BYO5X4xDKrx/,#belvefridays #belvedere #uptownpark #houston #texas #tonight,,official
1366,901202575265017857,lissysalt,2017-08-25 22:00:12+00:00,How I roll when there is a hurricane brewing outside the airport! #hurricane #hurricaneharvey… https://www.instagram.com/p/BYO5V28DmG3/,#hurricane #hurricaneharvey,,official
1367,901202129531977728,SunIsShining,2017-08-25 21:58:25+00:00,"""if you come upon a road block, don't bother turn back""- Thievery… https://www.instagram.com/p/BYO5IiEHWFa/",,,official
1368,901201566325243905,_Miears,2017-08-25 21:56:11+00:00,EP2 + getting ready to hit the road with danceswithsharkjackson next week!! FIRST UP:… https://www.instagram.com/p/BYO434gjYI7/,,,official
1369,901201141706391553,onurokszz,2017-08-25 21:54:30+00:00,"I'm at @GameStop in Houston, TX w/ @84cagla https://www.swarmapp.com/c/87wwc4OMuHZ",,,official
1370,901200772347568128,SpShell,2017-08-25 21:53:02+00:00,"Run and get @RealRomaDowney's new book as soon as you can, it will lift you up and bless you!… https://www.instagram.com/p/BYO4hJXDsNL/",,,official
1371,901200761249562624,TamekaRonne,2017-08-25 21:52:59+00:00,Safe landing! It was rocky with a lot of turbulence but we made it… https://www.instagram.com/p/BYO4gvwDDKH/,,,official
1372,901200579770425344,djbuddhaTX,2017-08-25 21:52:16+00:00,"#neverunderestimate the #heartofachampion @Houston, Texas https://www.instagram.com/p/BYO4bmdF3r0YaGo8FxgZB_R2utvBzb9AbwhOmE0/ …",#neverunderestimate #heartofachampion,,official
1373,901200505048883200,drew0622,2017-08-25 21:51:58+00:00,Drinking a Cold Brew IPA by @rogueales @420 Lounge — http://untp.beer/s/c495678359 #photo,#photo,,official
