id,tweet,tokenized,lemmatized,stemmed,label
901456672291532800,blogging for profits series pa  6  6 surefire ways to make money from your blog  aiqb,blogging for profits series pa 6 6 surefire ways to make money from your blog aiqb,blogging for profit series pa 6 6 surefire way to make money from your blog aiqb,blog for profit seri pa 6 6 surefir way to make money from your blog aiqb,0
901456554930692098,hoy queremos felicitar a nuestro  pa ero y arpista del mariachi origen y tradici n arpa rojas,hoy queremos felicitar a nuestro pa ero y arpista del mariachi origen y tradici n arpa rojas,hoy queremos felicitar a nuestro pa ero y arpista del mariachi origen y tradici n arpa rojas,hoy queremo felicitar a nuestro pa ero y arpista del mariachi origen y tradici n arpa roja,0
901456465608802304,i m at peet s coffee   tea in houston  tx cntt5xkdqu1,i m at peet s coffee tea in houston tx cntt5xkdqu1,i m at peet s coffee tea in houston tx cntt5xkdqu1,i m at peet s coffe tea in houston tx cntt5xkdqu1,0
901456397824667649,i m at terminal b    united in houston  tx avd3fifmtyd,i m at terminal b united in houston tx avd3fifmtyd,i m at terminal b united in houston tx avd3fifmtyd,i m at termin b unit in houston tx avd3fifmtyd,0
901456325800071168,blogging for profits series pa  6  6 surefire ways to make money from your blog  aiq1,blogging for profits series pa 6 6 surefire ways to make money from your blog aiq1,blogging for profit series pa 6 6 surefire way to make money from your blog aiq1,blog for profit seri pa 6 6 surefir way to make money from your blog aiq1,0
901456226541854720,dear harvey     houston  texas,dear harvey houston texas,dear harvey houston texas,dear harvey houston texa,0
901456225862389761,our physical location worship experiences are cancelled at our sw and katy location this,our physical location worship experiences are cancelled at our sw and katy location this,our physical location worship experience are cancelled at our sw and katy location this,our physic locat worship experi are cancel at our sw and kati locat thi,0
901456170422075393,sending thoughts   prayers and  love to everyone in the wake of  hurricaneharvey especially,sending thoughts prayers and love to everyone in the wake of hurricaneharvey especially,sending thought prayer and love to everyone in the wake of hurricaneharvey especially,send thought prayer and love to everyon in the wake of hurricaneharvey especi,2
901456154534043648,blogging for profits series pa  6  6 surefire ways to make money from your blog  aipw,blogging for profits series pa 6 6 surefire ways to make money from your blog aipw,blogging for profit series pa 6 6 surefire way to make money from your blog aipw,blog for profit seri pa 6 6 surefir way to make money from your blog aipw,0
901455808747241472,blogging for profits series pa  6  6 surefire ways to make money from your blog  aipl,blogging for profits series pa 6 6 surefire ways to make money from your blog aipl,blogging for profit series pa 6 6 surefire way to make money from your blog aipl,blog for profit seri pa 6 6 surefir way to make money from your blog aipl,0
901455807035957253,1124 ellen dr  deer park  tx 77536   150 000 3 beds  2 baths  aipk,1124 ellen dr deer park tx 77536 150 000 3 beds 2 baths aipk,1124 ellen dr deer park tx 77536 150 000 3 bed 2 bath aipk,1124 ellen dr deer park tx 77536 150 000 3 bed 2 bath aipk,0
901455584448266240,sometimes all you need is a little splash of color     theleilalewis lingerie,sometimes all you need is a little splash of color theleilalewis lingerie,sometimes all you need is a little splash of color theleilalewis lingerie,sometim all you need is a littl splash of color theleilalewi lingeri,0
901455539561013248,high water on frontage rd in  houston on 69 eastex fwy frontage rd inbound at aldine mail rte  traffic  17hsijn,high water on frontage rd in houston on 69 eastex fwy frontage rd inbound at aldine mail rte traffic 17hsijn,high water on frontage rd in houston on 69 eastex fwy frontage rd inbound at aldine mail rte traffic 17hsijn,high water on frontag rd in houston on 69 eastex fwi frontag rd inbound at aldin mail rte traffic 17hsijn,0
901455363601567745,hurricane harvey  fall creek,hurricane harvey fall creek,hurricane harvey fall creek,hurrican harvey fall creek,1
901455215592976386,don t worry  hurricane harvey got nothing on us    hurricane  harvey  dogsofinstagram  houston,don t worry hurricane harvey got nothing on us hurricane harvey dogsofinstagram houston,don t worry hurricane harvey got nothing on u hurricane harvey dogsofinstagram houston,don t worri hurrican harvey got noth on us hurrican harvey dogsofinstagram houston,2
901455185846849536,if you re looking for something to watch during this storm    then check out my full video of,if you re looking for something to watch during this storm then check out my full video of,if you re looking for something to watch during this storm then check out my full video of,if you re look for someth to watch dure thi storm then check out my full video of,2
901455001469558785,prayforhouston  prayfortexas  pearland  texas,prayforhouston prayfortexas pearland texas,prayforhouston prayfortexas pearland texas,prayforhouston prayfortexa pearland texa,0
901454948407418880,blogging for profits series pa  6  6 surefire ways to make money from your blog  aipk,blogging for profits series pa 6 6 surefire ways to make money from your blog aipk,blogging for profit series pa 6 6 surefire way to make money from your blog aipk,blog for profit seri pa 6 6 surefir way to make money from your blog aipk,0
901454862717771776,blogging for profits series pa  6  6 surefire ways to make money from your blog  aipg,blogging for profits series pa 6 6 surefire ways to make money from your blog aipg,blogging for profit series pa 6 6 surefire way to make money from your blog aipg,blog for profit seri pa 6 6 surefir way to make money from your blog aipg,0
901454861182660611,blogging for profits series pa  6  6 surefire ways to make money from your blog  aipd,blogging for profits series pa 6 6 surefire ways to make money from your blog aipd,blogging for profit series pa 6 6 surefire way to make money from your blog aipd,blog for profit seri pa 6 6 surefir way to make money from your blog aipd,0
901454775107149825,blogging for profits series pa  6  6 surefire ways to make money from your blog  aipc,blogging for profits series pa 6 6 surefire ways to make money from your blog aipc,blogging for profit series pa 6 6 surefire way to make money from your blog aipc,blog for profit seri pa 6 6 surefir way to make money from your blog aipc,0
901454747072421889,usgs08072000   lk houston nr sheldon  tx heavy rain  1 96 in hr  over the last 15 minutes  uv site no 08072000 t 20170826093000,usgs08072000 lk houston nr sheldon tx heavy rain 1 96 in hr over the last 15 minutes uv site no 08072000 t 20170826093000,usgs08072000 lk houston nr sheldon tx heavy rain 1 96 in hr over the last 15 minute uv site no 08072000 t 20170826093000,usgs08072000 lk houston nr sheldon tx heavi rain 1 96 in hr over the last 15 minut uv site no 08072000 t 20170826093000,0
901454746849951744,rarepairalert ain t gonna let a lil rain stop the weekend         aj4s killin em,rarepairalert ain t gonna let a lil rain stop the weekend aj4s killin em,rarepairalert ain t gonna let a lil rain stop the weekend aj4s killin em,rarepairalert ain t gonna let a lil rain stop the weekend aj4 killin em,0
901454528351944704,a few days of this will be no bueno  newpo   crosby  texas,a few days of this will be no bueno newpo crosby texas,a few day of this will be no bueno newpo crosby texas,a few day of thi will be no bueno newpo crosbi texa,0
901454215134011392,due to hurricane harvey  we will open at 1 pm today saturday 08 26 2017  please call us at,due to hurricane harvey we will open at 1 pm today saturday 08 26 2017 please call us at,due to hurricane harvey we will open at 1 pm today saturday 08 26 2017 please call u at,due to hurrican harvey we will open at 1 pm today saturday 08 26 2017 pleas call us at,2
901454072632528897,high water on the frontage rd  in  houston on i 45 n fwy frontage rd inbound before e tidwell rd  traffic  17hsijn,high water on the frontage rd in houston on i 45 n fwy frontage rd inbound before e tidwell rd traffic 17hsijn,high water on the frontage rd in houston on i 45 n fwy frontage rd inbound before e tidwell rd traffic 17hsijn,high water on the frontag rd in houston on i 45 n fwi frontag rd inbound befor e tidwel rd traffic 17hsijn,0
901453863953223685,i am so thankful for the last 4 weeks of my life  i have learned so much about myself and,i am so thankful for the last 4 weeks of my life i have learned so much about myself and,i am so thankful for the last 4 week of my life i have learned so much about myself and,i am so thank for the last 4 week of my life i have learn so much about myself and,0
901453270513852418,i got jokes   hurricaneharvey  hurricane  harvey  power  netflix  jokes  goodmorningpost,i got jokes hurricaneharvey hurricane harvey power netflix jokes goodmorningpost,i got joke hurricaneharvey hurricane harvey power netflix joke goodmorningpost,i got joke hurricaneharvey hurrican harvey power netflix joke goodmorningpost,1
901453197088362496,still have to walk the baby   harvey  yorkiepoo  gotsoaked  houston  texas,still have to walk the baby harvey yorkiepoo gotsoaked houston texas,still have to walk the baby harvey yorkiepoo gotsoaked houston texas,still have to walk the babi harvey yorkiepoo gotsoak houston texa,0
901452528742789120,i m going home     outfit of the day  hangover chic   mensfashion  manfashion  guysfashion,i m going home outfit of the day hangover chic mensfashion manfashion guysfashion,i m going home outfit of the day hangover chic mensfashion manfashion guysfashion,i m go home outfit of the day hangov chic mensfashion manfashion guysfashion,0
901451972124999680,make sure you are prepared  i hope everyone is safe and okay   hurricanharvey  hurricane  harvey,make sure you are prepared i hope everyone is safe and okay hurricanharvey hurricane harvey,make sure you are prepared i hope everyone is safe and okay hurricanharvey hurricane harvey,make sure you are prepar i hope everyon is safe and okay hurricanharvey hurrican harvey,2
901451792386592769,walked the dogs  checked on buffalo bayou  saw a toad laying eggs in a puddle  now coffee,walked the dogs checked on buffalo bayou saw a toad laying eggs in a puddle now coffee,walked the dog checked on buffalo bayou saw a toad laying egg in a puddle now coffee,walk the dog check on buffalo bayou saw a toad lay egg in a puddl now coffe,0
901451650132459520,finishing this great box of five year old juan lopez seleccion  2s  favorite regular production,finishing this great box of five year old juan lopez seleccion 2s favorite regular production,finishing this great box of five year old juan lopez seleccion 2 favorite regular production,finish thi great box of five year old juan lopez seleccion 2s favorit regular product,0
901451197327998976,my foster dog attempts to escape during hurricane harvey   dog  dogs  l4l  ff  houston  pet,my foster dog attempts to escape during hurricane harvey dog dogs l4l ff houston pet,my foster dog attempt to escape during hurricane harvey dog dog l4l ff houston pet,my foster dog attempt to escap dure hurrican harvey dog dog l4l ff houston pet,1
901451114410786816,its not starbucks  but it will do   mccafe  westside  houston  texas,its not starbucks but it will do mccafe westside houston texas,it not starbucks but it will do mccafe westside houston texas,it not starbuck but it will do mccafe westsid houston texa,0
901450671676731394,thoughts are prayers to all of those in my lone star state   prayfortexas  hurricaneharvey,thoughts are prayers to all of those in my lone star state prayfortexas hurricaneharvey,thought are prayer to all of those in my lone star state prayfortexas hurricaneharvey,thought are prayer to all of those in my lone star state prayfortexa hurricaneharvey,1
901450589439184896,updated schedule for today saturday 8 26    we will be closing doors due to road conditions,updated schedule for today saturday 8 26 we will be closing doors due to road conditions,updated schedule for today saturday 8 26 we will be closing door due to road condition,updat schedul for today saturday 8 26 we will be close door due to road condit,0
901450226581606400,well we may still be waiting for rain from  hurricaneharvey i would,well we may still be waiting for rain from hurricaneharvey i would,well we may still be waiting for rain from hurricaneharvey i would,well we may still be wait for rain from hurricaneharvey i would,0
901450181127831552,lots of rain throughout the night and the electricity flicked off,lots of rain throughout the night and the electricity flicked off,lot of rain throughout the night and the electricity flicked off,lot of rain throughout the night and the electr flick off,0
901449876755681280,we re closed for brunch  but will open at 3pm  stay safe   the hay merchant,we re closed for brunch but will open at 3pm stay safe the hay merchant,we re closed for brunch but will open at 3pm stay safe the hay merchant,we re close for brunch but will open at 3pm stay safe the hay merchant,1
901449757641461760,ministryofmusic  theliberationstation   thesoundmanipulators   thesounddesigners,ministryofmusic theliberationstation thesoundmanipulators thesounddesigners,ministryofmusic theliberationstation thesoundmanipulators thesounddesigners,ministryofmus theliberationst thesoundmanipul thesounddesign,0
901449749362085889,break in the storm  staying safe and  mostly  dry   harvey,break in the storm staying safe and mostly dry harvey,break in the storm staying safe and mostly dry harvey,break in the storm stay safe and mostli dri harvey,1
901449705565155329,tell us what is the perfect taste for you     houstonfood  houstofoodie  houstoneats  houston,tell us what is the perfect taste for you houstonfood houstofoodie houstoneats houston,tell u what is the perfect taste for you houstonfood houstofoodie houstoneats houston,tell us what is the perfect tast for you houstonfood houstofoodi houstoneat houston,0
901449282351321088,delicioso snack saludable para empezar el d a   when you stay,delicioso snack saludable para empezar el d a when you stay,delicioso snack saludable para empezar el d a when you stay,delicioso snack salud para empezar el d a when you stay,0
901449173844631554,i am the grateful owner of the very last pack of aaa batteries from the s wayside walma,i am the grateful owner of the very last pack of aaa batteries from the s wayside walma,i am the grateful owner of the very last pack of aaa battery from the s wayside walma,i am the grate owner of the veri last pack of aaa batteri from the s waysid walma,0
901449103015632896,high water on frontage rd in  houston on 69 eastex fwy frontage rd nb at aldine mail rte  traffic  17hsijn,high water on frontage rd in houston on 69 eastex fwy frontage rd nb at aldine mail rte traffic 17hsijn,high water on frontage rd in houston on 69 eastex fwy frontage rd nb at aldine mail rte traffic 17hsijn,high water on frontag rd in houston on 69 eastex fwi frontag rd nb at aldin mail rte traffic 17hsijn,0
901449058451161093,closed today ig  tomorrow is tbd  stay safe and don t do anything ezzellrobe    i wouldn t,closed today ig tomorrow is tbd stay safe and don t do anything ezzellrobe i wouldn t,closed today ig tomorrow is tbd stay safe and don t do anything ezzellrobe i wouldn t,close today ig tomorrow is tbd stay safe and don t do anyth ezzellrob i wouldn t,0
901448466228011008,riding the storm out with my rabbit friend  ben taub general hospital,riding the storm out with my rabbit friend ben taub general hospital,riding the storm out with my rabbit friend ben taub general hospital,ride the storm out with my rabbit friend ben taub gener hospit,0
901448159242727428,i was at george bush intercontinental airpo  in houston  tx 59a17f52acb00b48c527d6bc s akgqeauhk7ipfelqmlm61ykmege ref tw,i was at george bush intercontinental airpo in houston tx 59a17f52acb00b48c527d6bc s akgqeauhk7ipfelqmlm61ykmege ref tw,i wa at george bush intercontinental airpo in houston tx 59a17f52acb00b48c527d6bc s akgqeauhk7ipfelqmlm61ykmege ref tw,i wa at georg bush intercontinent airpo in houston tx 59a17f52acb00b48c527d6bc s akgqeauhk7ipfelqmlm61ykmeg ref tw,0
901448141869809665,for those braving this weather    hurricaneharvey  prepfood  sweets  petite sweets,for those braving this weather hurricaneharvey prepfood sweets petite sweets,for those braving this weather hurricaneharvey prepfood sweet petite sweet,for those brave thi weather hurricaneharvey prepfood sweet petit sweet,0
901447600234037248,then he got up and rebuked the winds and the waves  and it was,then he got up and rebuked the winds and the waves and it was,then he got up and rebuked the wind and the wave and it wa,then he got up and rebuk the wind and the wave and it wa,0
901447238227984388,mom s having surgery  please leo her in your prayers    houston methodist hospital    hmdigitalmkt in houston  tx   6kpubwteoud,mom s having surgery please leo her in your prayers houston methodist hospital hmdigitalmkt in houston tx 6kpubwteoud,mom s having surgery please leo her in your prayer houston methodist hospital hmdigitalmkt in houston tx 6kpubwteoud,mom s have surgeri pleas leo her in your prayer houston methodist hospit hmdigitalmkt in houston tx 6kpubwteoud,0
901442492956110848,high water on the frontage rd in  eastside on i 10 e fwy frontage rd  eb at federal  traffic  17hsijn,high water on the frontage rd in eastside on i 10 e fwy frontage rd eb at federal traffic 17hsijn,high water on the frontage rd in eastside on i 10 e fwy frontage rd eb at federal traffic 17hsijn,high water on the frontag rd in eastsid on i 10 e fwi frontag rd eb at feder traffic 17hsijn,0
901442092928565248,high water on the frontage rd  in  eastside on i 10 e fwy frontage rd  wb at federal  traffic  17hsijn,high water on the frontage rd in eastside on i 10 e fwy frontage rd wb at federal traffic 17hsijn,high water on the frontage rd in eastside on i 10 e fwy frontage rd wb at federal traffic 17hsijn,high water on the frontag rd in eastsid on i 10 e fwi frontag rd wb at feder traffic 17hsijn,0
901441299655643136,high water across all main lanes in  no hside on n sam houston pkwy eb after aldine westfeild and before vickery dr  traffic,high water across all main lanes in no hside on n sam houston pkwy eb after aldine westfeild and before vickery dr traffic,high water across all main lane in no hside on n sam houston pkwy eb after aldine westfeild and before vickery dr traffic,high water across all main lane in no hside on n sam houston pkwi eb after aldin westfeild and befor vickeri dr traffic,0
901440896964669440,high water across all main lanes in  no hside on n sam houston pkwy wb after vickery dr and before aldine westfeild  traffic,high water across all main lanes in no hside on n sam houston pkwy wb after vickery dr and before aldine westfeild traffic,high water across all main lane in no hside on n sam houston pkwy wb after vickery dr and before aldine westfeild traffic,high water across all main lane in no hside on n sam houston pkwi wb after vickeri dr and befor aldin westfeild traffic,0
901440573638402048,almost forgot it s  texansgameday,almost forgot it s texansgameday,almost forgot it s texansgameday,almost forgot it s texansgameday,0
901439931863715840,shareacoke  checked in  corner store 926 westheimer rd  mina3a    cornerstore4u,shareacoke checked in corner store 926 westheimer rd mina3a cornerstore4u,shareacoke checked in corner store 926 westheimer rd mina3a cornerstore4u,shareacok check in corner store 926 westheim rd mina3a cornerstore4u,0
901439456145797121,high water on entrance ramp in  neside on n sam houston pkwy eb at lee rd  traffic  17hsijn,high water on entrance ramp in neside on n sam houston pkwy eb at lee rd traffic 17hsijn,high water on entrance ramp in neside on n sam houston pkwy eb at lee rd traffic 17hsijn,high water on entranc ramp in nesid on n sam houston pkwi eb at lee rd traffic 17hsijn,1
901438275226939392,high water in  harris on gessner dr  sb at us 290  traffic  17hsijn,high water in harris on gessner dr sb at us 290 traffic 17hsijn,high water in harris on gessner dr sb at u 290 traffic 17hsijn,high water in harri on gessner dr sb at us 290 traffic 17hsijn,0
901438141734809600,high water in  harris on gessner dr  nb at us 290  traffic  17hsijn,high water in harris on gessner dr nb at us 290 traffic 17hsijn,high water in harris on gessner dr nb at u 290 traffic 17hsijn,high water in harri on gessner dr nb at us 290 traffic 17hsijn,0
901436961130414080,high water on exit ramp in  eastside on e sam houston tollway nb at pasadena blvd  traffic  17hsijn,high water on exit ramp in eastside on e sam houston tollway nb at pasadena blvd traffic 17hsijn,high water on exit ramp in eastside on e sam houston tollway nb at pasadena blvd traffic 17hsijn,high water on exit ramp in eastsid on e sam houston tollway nb at pasadena blvd traffic 17hsijn,1
901436567230840833,high water on exit ramp in  eastside on e sam houston tollway sb at pasadena blvd  traffic  17hsijn,high water on exit ramp in eastside on e sam houston tollway sb at pasadena blvd traffic 17hsijn,high water on exit ramp in eastside on e sam houston tollway sb at pasadena blvd traffic 17hsijn,high water on exit ramp in eastsid on e sam houston tollway sb at pasadena blvd traffic 17hsijn,1
901435526573633536,high water  all mainlanes blocked  in  eastside on e sam houston tollway sb after pasadena blvd and before fairmont pkwy  traffic,high water all mainlanes blocked in eastside on e sam houston tollway sb after pasadena blvd and before fairmont pkwy traffic,high water all mainlanes blocked in eastside on e sam houston tollway sb after pasadena blvd and before fairmont pkwy traffic,high water all mainlan block in eastsid on e sam houston tollway sb after pasadena blvd and befor fairmont pkwi traffic,1
901435354686775297,trying to enjoy the electricity before it goes out  no heast houston  houston  texas,trying to enjoy the electricity before it goes out no heast houston houston texas,trying to enjoy the electricity before it go out no heast houston houston texas,tri to enjoy the electr befor it goe out no heast houston houston texa,0
901435273913016321,white oak bayou near our apa ment   jersey village  texas,white oak bayou near our apa ment jersey village texas,white oak bayou near our apa ment jersey village texas,white oak bayou near our apa ment jersey villag texa,0
901435088143097856,we at work     southmore post office,we at work southmore post office,we at work southmore post office,we at work southmor post offic,0
901434694562189312,getting out of dodge  harvey   william p  hobbyairpo  in houston  tx  iknzgafffiw,getting out of dodge harvey william p hobbyairpo in houston tx iknzgafffiw,getting out of dodge harvey william p hobbyairpo in houston tx iknzgafffiw,get out of dodg harvey william p hobbyairpo in houston tx iknzgafffiw,0
901431501119782912,repost  godjhic  get repost      new music alert here is a good look at the august,repost godjhic get repost new music alert here is a good look at the august,repost godjhic get repost new music alert here is a good look at the august,repost godjhic get repost new music alert here is a good look at the august,0
901430559133626369,downtown houston update  it s all good for now  we baked a cake last night and our lights stayed,downtown houston update it s all good for now we baked a cake last night and our lights stayed,downtown houston update it s all good for now we baked a cake last night and our light stayed,downtown houston updat it s all good for now we bake a cake last night and our light stay,0
901430478456205313,sugar land tx sat aug 26th am forecast  today tropical storm conditions tonight tropical storm conditions lo 75,sugar land tx sat aug 26th am forecast today tropical storm conditions tonight tropical storm conditions lo 75,sugar land tx sat aug 26th am forecast today tropical storm condition tonight tropical storm condition lo 75,sugar land tx sat aug 26th am forecast today tropic storm condit tonight tropic storm condit lo 75,1
901430465718099971,sharpstown tx sat aug 26th am forecast  today tropical storm conditions hi 81 tonight tropical storm conditions lo 75,sharpstown tx sat aug 26th am forecast today tropical storm conditions hi 81 tonight tropical storm conditions lo 75,sharpstown tx sat aug 26th am forecast today tropical storm condition hi 81 tonight tropical storm condition lo 75,sharpstown tx sat aug 26th am forecast today tropic storm condit hi 81 tonight tropic storm condit lo 75,0
901430380221411328,houston tx sat aug 26th am forecast  today tropical storm conditions hi 81 tonight tropical storm conditions lo 75,houston tx sat aug 26th am forecast today tropical storm conditions hi 81 tonight tropical storm conditions lo 75,houston tx sat aug 26th am forecast today tropical storm condition hi 81 tonight tropical storm condition lo 75,houston tx sat aug 26th am forecast today tropic storm condit hi 81 tonight tropic storm condit lo 75,0
901429120931950592,hurricaneharvey  shipleys  southbelt   ellington  houston,hurricaneharvey shipleys southbelt ellington houston,hurricaneharvey shipleys southbelt ellington houston,hurricaneharvey shipley southbelt ellington houston,0
901429018641260544,fire alarm in a church   pasadena fire dept  station  8 in pasadena  tx   ovrvauuc8s,fire alarm in a church pasadena fire dept station 8 in pasadena tx ovrvauuc8s,fire alarm in a church pasadena fire dept station 8 in pasadena tx ovrvauuc8s,fire alarm in a church pasadena fire dept station 8 in pasadena tx ovrvauuc8,0
